### ISSUE TITLE
Istio doesn't appear to favour pods on the same node

### ISSUE THREAD

**Issue by Stono** [istio/istio#31707]
**Bug description**
I've been investigating some tail latency problems recently; and stumbled across this behaviour which I believe to be wrong.

Given the following pods:
```
❯ k get pods -o wide
NAME                                 READY   STATUS    RESTARTS   AGE    IP              NODE                                                  NOMINATED NODE   READINESS GATES
solr-0                               1/1     Running   0          2d5h   10.226.16.6     gke-delivery-platform-solrw-20200210-57ae432e-w1n3    <none>           1/1
solr-1                               1/1     Running   0          2d5h   10.226.3.6      gke-delivery-platform-solrw-20200210-2e0a15aa-qj1i    <none>           1/1
solr-2                               1/1     Running   0          2d5h   10.226.20.6     gke-delivery-platform-solrw-20200210-10df47ec-2762    <none>           1/1
solr-3                               1/1     Running   0          2d5h   10.226.13.6     gke-delivery-platform-solrw-20200210-57ae432e-t99f    <none>           1/1
solr-4                               1/1     Running   0          2d5h   10.226.19.6     gke-delivery-platform-solrw-20200210-2e0a15aa-uoar    <none>           1/1
solr-5                               1/1     Running   0          2d5h   10.226.10.8     gke-delivery-platform-solrw-20200210-10df47ec-zytc    <none>           1/1
solr-overwatch-549bc4bcc-mxjfx       2/2     Running   0          77m    10.226.16.9     gke-delivery-platform-solrw-20200210-57ae432e-w1n3    <none>           <none>
```

And the following service:
```
  name: karl
  namespace: search-solr
  resourceVersion: "357571791"
  selfLink: /api/v1/namespaces/search-solr/services/karl
  uid: 883ed57b-42c1-4d12-88c8-b7100452b9ee
spec:
  clusterIP: 10.224.11.190
  ports:
  - name: http-server
    port: 80
    protocol: TCP
    targetPort: http-server
  selector:
    app: solr
  sessionAffinity: None
  type: ClusterIP
status:
  loadBalancer: {}
```

Which resolves to these endpoints:
```
❯ k get ep karl -o wide
NAME   ENDPOINTS                                                  AGE
karl   10.226.10.8:80,10.226.13.6:80,10.226.16.6:80 + 3 more...   9m35s
```

When making requests from `overwatch`, which resides on the same node as `solr-0`, I would expect traffic to remain on that node, however it does not.  Here are the TCP dumps showing me repeatedly hitting `solr-0` from `overwatch`:

```
[atcloud@solr-overwatch-549bc4bcc-mxjfx app]$ curl -s -L "http://karl.search-solr/solr/at-uk/select?q=*:*&rows=0" | jq .
```

```
oot@gke-delivery-platform-solrw-20200210-57ae432e-w1n3:~# tcpdump -AAAA port 80 and src 10.226.16.9 | grep GET
14:49:36.960170 IP 10.226.16.9.56506 > 10.226.20.6.http: Flags [P.], seq 1921231721:1921233968, ack 3409949414, win 331, length 2247: HTTP: GET /solr/at-uk/select?q=*:*&rows=0 HTTP/1.1
......Pr..i.?..P..KB...GET /solr/at-uk/select?q=*:*&rows=0 HTTP/1.1
14:49:37.528387 IP 10.226.16.9.36418 > 10.226.13.6.http: Flags [P.], seq 3930777270:3930779517, ack 4207939322, win 331, length 2247: HTTP: GET /solr/at-uk/select?q=*:*&rows=0 HTTP/1.1
....B.P.J......P..K;...GET /solr/at-uk/select?q=*:*&rows=0 HTTP/1.1
14:49:37.853118 IP 10.226.16.9.53456 > 10.226.10.8.http: Flags [P.], seq 248354423:248356670, ack 3089487598, win 331, length 2247: HTTP: GET /solr/at-uk/select?q=*:*&rows=0 HTTP/1.1
....P...w.%..P..K8...GET /solr/at-uk/select?q=*:*&rows=0 HTTP/1.1
14:49:38.528211 IP 10.226.16.9.56482 > 10.226.20.6.http: Flags [P.], seq 359421875:359424122, ack 1105199185, win 331, length 2247: HTTP: GET /solr/at-uk/select?q=*:*&rows=0 HTTP/1.1
......P.lW.A..QP..KB...GET /solr/at-uk/select?q=*:*&rows=0 HTTP/1.1
14:49:38.798516 IP 10.226.16.9.36448 > 10.226.13.6.http: Flags [P.], seq 410833569:410835816, ack 2891369657, win 331, length 2247: HTTP: GET /solr/at-uk/select?q=*:*&rows=0 HTTP/1.1
....`.P.|...V..P..K;...GET /solr/at-uk/select?q=*:*&rows=0 HTTP/1.1
14:49:39.061700 IP 10.226.16.9.50168 > 10.226.19.6.http: Flags [P.], seq 955976578:955978825, ack 181264837, win 331, length 2247: HTTP: GET /solr/at-uk/select?q=*:*&rows=0 HTTP/1.1

```

[ ] Docs
[ ] Installation
[x] Networking
[x] Performance and Scalability
[ ] Extensions and Telemetry
[ ] Security
[ ] Test and Release
[ ] User Experience
[ ] Developer Infrastructure
[ ] Upgrade

**Expected behavior**
Pods scheduled with other pods using nodeAffinity should route locally 

**Steps to reproduce the bug**
🤷  

**Version** (include the output of `istioctl version --remote` and `kubectl version --short` and `helm version --short` if you used Helm)
1.9.1 

**How was Istio installed?**

**Environment where the bug was observed (cloud vendor, OS, etc)**

Additionally, please consider running `istioctl bug-report` and attach the generated cluster-state tarball to this issue.
Refer [cluster state archive](http://istio.io/help/bugs/#generating-a-cluster-state-archive) for more details.

**Comment by Stono** [comment]
Few things which are atypical about this particular app:

- The target workload is a `Statefulset`
- The target workload _does not_ have `istio`

**Comment by howardjohn** [comment]
> Pods scheduled with other pods using nodeAffinity should route locally

Why is this expected? My understanding is this isn't how Kubernetes works without Istio, and its not how Istio is documented (based on locality info, not cluster/node) - is that not accurate?

Its a valid feature request to route to node-local but I wouldn't expect it to happen today or by default?

**Comment by Stono** [comment]
@howardjohn two years using kubernetes i've worked on that assumption, but you're absolutely right; after digging - its not how k8s routes either.  Apologies.

In that case, this is a feature request!
