### ISSUE TITLE
Ingress Gateway SSL handshake error using proxy protocol

### ISSUE THREAD

**Issue by BeWut** [istio/istio#21059]
**Bug description**
Our On-Premise Cluster uses HAProxy as reverse proxy to forward all http/https traffic to the corresponding NodePorts of the Ingress Gateway. This works fine but we need to keep the origin ip of the client. To do that we need to activate the use of proxy protocol in HAProxy.
We added an EnvoyFilter as described here: https://github.com/istio/istio/pull/12748#issuecomment-576488018
This works fine for HTTP traffic (the client ip is preserved) but fails for HTTPS.
When we use openssl and tcpdump to debug the connection we get the following output:
openssl:
```
CONNECTED(00000003)
SSL_connect:before SSL initialization
>>> ??? [length 0005]
    16 03 01 01 42
>>> TLS 1.3, Handshake [length 0142], ClientHello
    01 00 01 3e 03 03 c4 06 01 12 f9 6f 5f 92 88 72
    e3 5e 1b 87 c3 1d bc 57 23 11 85 bc 8e 0a 74 6e
    19 85 7b 1f 34 1d 20 0c 61 2d 8f d2 68 60 6f 7f
    e9 b8 3a 7a 6b fb 64 67 bb 7c 5c 07 c7 ca 14 af
    1e e2 51 dd d2 89 3e 00 3e 13 02 13 03 13 01 c0
    2c c0 30 00 9f cc a9 cc a8 cc aa c0 2b c0 2f 00
    9e c0 24 c0 28 00 6b c0 23 c0 27 00 67 c0 0a c0
    14 00 39 c0 09 c0 13 00 33 00 9d 00 9c 00 3d 00
    3c 00 35 00 2f 00 ff 01 00 00 b7 00 00 00 1e 00
    1c 00 00 19 67 72 61 66 61 6e 61 2e 70 6c 61 79
    2e 6b 72 69 65 67 65 72 69 74 2e 64 65 00 0b 00
    04 03 00 01 02 00 0a 00 0c 00 0a 00 1d 00 17 00
    1e 00 19 00 18 00 23 00 00 00 16 00 00 00 17 00
    00 00 0d 00 30 00 2e 04 03 05 03 06 03 08 07 08
    08 08 09 08 0a 08 0b 08 04 08 05 08 06 04 01 05
    01 06 01 03 03 02 03 03 01 02 01 03 02 02 02 04
    02 05 02 06 02 00 2b 00 09 08 03 04 03 03 03 02
    03 01 00 2d 00 02 01 01 00 33 00 26 00 24 00 1d
    00 20 49 21 0d b0 21 f8 19 ff 84 4e aa c7 d4 eb
    fb c0 8b 4a f0 cf 53 56 db 17 dc d6 8d 59 02 35
    9b 53
write to 0x55a378e1bf20 [0x55a378e2c9c0] (327 bytes => 327 (0x147))
0000 - 16 03 01 01 42 01 00 01-3e 03 03 c4 06 01 12 f9   ....B...>.......
0010 - 6f 5f 92 88 72 e3 5e 1b-87 c3 1d bc 57 23 11 85   o_..r.^.....W#..
0020 - bc 8e 0a 74 6e 19 85 7b-1f 34 1d 20 0c 61 2d 8f   ...tn..{.4. .a-.
0030 - d2 68 60 6f 7f e9 b8 3a-7a 6b fb 64 67 bb 7c 5c   .h`o...:zk.dg.|\
0040 - 07 c7 ca 14 af 1e e2 51-dd d2 89 3e 00 3e 13 02   .......Q...>.>..
0050 - 13 03 13 01 c0 2c c0 30-00 9f cc a9 cc a8 cc aa   .....,.0........
0060 - c0 2b c0 2f 00 9e c0 24-c0 28 00 6b c0 23 c0 27   .+./...$.(.k.#.'
0070 - 00 67 c0 0a c0 14 00 39-c0 09 c0 13 00 33 00 9d   .g.....9.....3..
0080 - 00 9c 00 3d 00 3c 00 35-00 2f 00 ff 01 00 00 b7   ...=.<.5./......
0090 - 00 00 00 1e 00 1c 00 00-19 67 72 61 66 61 6e 61   .........grafana
00a0 - 2e 70 6c 61 79 2e 6b 72-69 65 67 65 72 69 74 2e   .play.domain.
00b0 - 64 65 00 0b 00 04 03 00-01 02 00 0a 00 0c 00 0a   com..............
00c0 - 00 1d 00 17 00 1e 00 19-00 18 00 23 00 00 00 16   ...........#....
00d0 - 00 00 00 17 00 00 00 0d-00 30 00 2e 04 03 05 03   .........0......
00e0 - 06 03 08 07 08 08 08 09-08 0a 08 0b 08 04 08 05   ................
00f0 - 08 06 04 01 05 01 06 01-03 03 02 03 03 01 02 01   ................
0100 - 03 02 02 02 04 02 05 02-06 02 00 2b 00 09 08 03   ...........+....
0110 - 04 03 03 03 02 03 01 00-2d 00 02 01 01 00 33 00   ........-.....3.
0120 - 26 00 24 00 1d 00 20 49-21 0d b0 21 f8 19 ff 84   &.$... I!..!....
0130 - 4e aa c7 d4 eb fb c0 8b-4a f0 cf 53 56 db 17 dc   N.......J..SV...
0140 - d6 8d 59 02 35 9b 53                              ..Y.5.S
SSL_connect:SSLv3/TLS write client hello
read from 0x55a378e1bf20 [0x55a378e236b3] (5 bytes => 0 (0x0))
SSL_connect:error in SSLv3/TLS write client hello
write:errno=0
---
no peer certificate available
---
No client certificate CA names sent
---
SSL handshake has read 0 bytes and written 327 bytes
Verification: OK
---
New, (NONE), Cipher is (NONE)
Secure Renegotiation IS NOT supported
Compression: NONE
Expansion: NONE
No ALPN negotiated
Early data was not sent
```

tcpdump:
```
tcpdump: listening on ens160, link-type EN10MB (Ethernet), capture size 262144 bytes
10:36:55.775069 IP (tos 0x0, ttl 64, id 5941, offset 0, flags [DF], proto TCP (6), length 60)
    server.domain.com.59398 > 10.1.196.68.31390: Flags [S], cksum 0xb75b (incorrect -> 0x10c9), seq 702542430, win 64240, options [mss 1460,sackOK,TS val 1538239110 ecr 0,nop,wscale 7], length 0
	0x0000:  4500 003c 1735 4000 4006 6c5a 0a01 dee6  E..<.5@.@.lZ....
	0x0010:  0a01 c444 e806 7a9e 29df f25e 0000 0000  ...D..z.)..^....
	0x0020:  a002 faf0 b75b 0000 0204 05b4 0402 080a  .....[..........
	0x0030:  5baf aa86 0000 0000 0103 0307            [...........
10:36:55.775699 IP (tos 0x0, ttl 62, id 0, offset 0, flags [DF], proto TCP (6), length 60)
    10.1.196.68.31390 > server.domain.com.59398: Flags [S.], cksum 0x492a (correct), seq 1949228043, ack 702542431, win 28960, options [mss 1460,sackOK,TS val 3990623047 ecr 1538239110,nop,wscale 7], length 0
	0x0000:  4500 003c 0000 4000 3e06 858f 0a01 c444  E..<..@.>......D
	0x0010:  0a01 dee6 7a9e e806 742e dc0b 29df f25f  ....z...t...).._
	0x0020:  a012 7120 492a 0000 0204 05b4 0402 080a  ..q.I*..........
	0x0030:  eddc 1347 5baf aa86 0103 0307            ...G[.......
10:36:55.775718 IP (tos 0x0, ttl 64, id 5942, offset 0, flags [DF], proto TCP (6), length 52)
   server.domain.com.59398 > 10.1.196.68.31390: Flags [.], cksum 0xb753 (incorrect -> 0xe720), ack 1, win 502, options [nop,nop,TS val 1538239110 ecr 3990623047], length 0
	0x0000:  4500 0034 1736 4000 4006 6c61 0a01 dee6  E..4.6@.@.la....
	0x0010:  0a01 c444 e806 7a9e 29df f25f 742e dc0c  ...D..z.).._t...
	0x0020:  8010 01f6 b753 0000 0101 080a 5baf aa86  .....S......[...
	0x0030:  eddc 1347                                ...G
10:36:55.777064 IP (tos 0x0, ttl 64, id 5943, offset 0, flags [DF], proto TCP (6), length 604)
    server.domain.com.59398 > 10.1.196.68.31390: Flags [P.], cksum 0xb97b (incorrect -> 0xb42d), seq 1:553, ack 1, win 502, options [nop,nop,TS val 1538239112 ecr 3990623047], length 552
	0x0000:  4500 025c 1737 4000 4006 6a38 0a01 dee6  E..\.7@.@.j8....
	0x0010:  0a01 c444 e806 7a9e 29df f25f 742e dc0c  ...D..z.).._t...
	0x0020:  8018 01f6 b97b 0000 0101 080a 5baf aa88  .....{......[...
	0x0030:  eddc 1347 0d0a 0d0a 000d 0a51 5549 540a  ...G.......QUIT.
	0x0040:  2111 0013 0a14 051e 0a01 dee8 a1a2 01bb  !...............
	0x0050:  0300 0438 333c 4616 0301 0200 0100 01fc  ...83<F.........
	0x0060:  0303 5c6b 9861 32d6 36f4 1582 3e83 ed84  ..\k.a2.6...>...
	0x0070:  69fa 2393 7919 757f 41c5 37b2 af88 18a8  i.#.y.u.A.7.....
	0x0080:  843b 2016 eae0 0a8b 3158 5894 58e2 94fb  .;......1XX.X...
	0x0090:  f854 5bbb bcb8 417d b2c8 f534 85f6 ed83  .T[...A}...4....
	0x00a0:  78da 5900 3e13 0213 0313 01c0 2cc0 3000  x.Y.>.......,.0.
	0x00b0:  9fcc a9cc a8cc aac0 2bc0 2f00 9ec0 24c0  ........+./...$.
	0x00c0:  2800 6bc0 23c0 2700 67c0 0ac0 1400 39c0  (.k.#.'.g.....9.
	0x00d0:  09c0 1300 3300 9d00 9c00 3d00 3c00 3500  ....3.....=.<.5.
	0x00e0:  2f00 ff01 0001 7500 0000 1e00 1c00 0019  /.....u.........
	0x00f0:  6772 6166 616e 612e 706c 6179 2e6b 7269  grafana.play.dom
	0x0100:  6567 6572 6974 2e64 6500 0b00 0403 0001  ain.com.......
	0x0110:  0200 0a00 0c00 0a00 1d00 1700 1e00 1900  ................
	0x0120:  1833 7400 0000 1000 0e00 0c02 6832 0868  .3t.........h2.h
	0x0130:  7474 702f 312e 3100 1600 0000 1700 0000  ttp/1.1.........
	0x0140:  3100 0000 0d00 3000 2e04 0305 0306 0308  1.....0.........
	0x0150:  0708 0808 0908 0a08 0b08 0408 0508 0604  ................
	0x0160:  0105 0106 0103 0302 0303 0102 0103 0202  ................
	0x0170:  0204 0205 0206 0200 2b00 0908 0304 0303  ........+.......
	0x0180:  0302 0301 002d 0002 0101 0033 0026 0024  .....-.....3.&.$
	0x0190:  001d 0020 6d0b 6345 c116 1381 ee30 297f  ....m.cE.....0).
	0x01a0:  cb9e 1a88 d706 7727 f089 3f82 5e7a e28e  ......w'..?.^z..
	0x01b0:  d4d8 ef66 0015 00a4 0000 0000 0000 0000  ...f............
	0x01c0:  0000 0000 0000 0000 0000 0000 0000 0000  ................
	0x01d0:  0000 0000 0000 0000 0000 0000 0000 0000  ................
	0x01e0:  0000 0000 0000 0000 0000 0000 0000 0000  ................
	0x01f0:  0000 0000 0000 0000 0000 0000 0000 0000  ................
	0x0200:  0000 0000 0000 0000 0000 0000 0000 0000  ................
	0x0210:  0000 0000 0000 0000 0000 0000 0000 0000  ................
	0x0220:  0000 0000 0000 0000 0000 0000 0000 0000  ................
	0x0230:  0000 0000 0000 0000 0000 0000 0000 0000  ................
	0x0240:  0000 0000 0000 0000 0000 0000 0000 0000  ................
	0x0250:  0000 0000 0000 0000 0000 0000            ............
10:36:55.777440 IP (tos 0x0, ttl 62, id 34338, offset 0, flags [DF], proto TCP (6), length 52)
    10.1.196.68.31390 > server.domain.com.59398: Flags [.], cksum 0xe5ff (correct), ack 553, win 235, options [nop,nop,TS val 3990623049 ecr 1538239112], length 0
	0x0000:  4500 0034 8622 4000 3e06 ff74 0a01 c444  E..4."@.>..t...D
	0x0010:  0a01 dee6 7a9e e806 742e dc0c 29df f487  ....z...t...)...
	0x0020:  8010 00eb e5ff 0000 0101 080a eddc 1349  ...............I
	0x0030:  5baf aa88                                [...
10:36:55.777741 IP (tos 0x0, ttl 62, id 34339, offset 0, flags [DF], proto TCP (6), length 52)
    10.1.196.68.31390 > server.domain.com.59398: Flags [R.], cksum 0xe5fb (correct), seq 1, ack 553, win 235, options [nop,nop,TS val 3990623049 ecr 1538239112], length 0
	0x0000:  4500 0034 8623 4000 3e06 ff73 0a01 c444  E..4.#@.>..s...D
	0x0010:  0a01 dee6 7a9e e806 742e dc0c 29df f487  ....z...t...)...
	0x0020:  8014 00eb e5fb 0000 0101 080a eddc 1349  ...............I
	0x0030:  5baf aa88                                [...
^C
6 packets captured
6 packets received by filter
0 packets dropped by kernel

```

**Expected behavior**
TLS termination should work with proxy protocol enabled

**Steps to reproduce the bug**

* Ingress Gateway needs to be available via NodePort
* HAProxy forwards traffic from ports 80/443 to the corresponding NodePorts in tcp mode
* HAProxy sends proxy protocol (v1 and v2 produce the same result)
* create EnvoyFilter based on https://github.com/istio/istio/pull/12748#issuecomment-576488018

**Version**

kubectl version:
```
Client Version: version.Info{Major:"1", Minor:"17", GitVersion:"v1.17.2", GitCommit:"59603c6e503c87169aea6106f57b9f242f64df89", GitTreeState:"clean", BuildDate:"2020-01-21T22:17:28Z", GoVersion:"go1.13.5", Compiler:"gc", Platform:"linux/amd64"}
Server Version: version.Info{Major:"1", Minor:"17", GitVersion:"v1.17.2", GitCommit:"59603c6e503c87169aea6106f57b9f242f64df89", GitTreeState:"clean", BuildDate:"2020-01-18T23:22:30Z", GoVersion:"go1.13.5", Compiler:"gc", Platform:"linux/amd64"}
```
helm version:
```
version.BuildInfo{Version:"v3.0.2", GitCommit:"19e47ee3283ae98139d98460de796c1be1e3975f", GitTreeState:"clean", GoVersion:"go1.13.5"}
```

istio version --remote:
```
client version: 1.4.3
control plane version: 1.4.3
data plane version: 1.4.3 (1 proxies)
```

**How was Istio installed?**
Istio was installed using the helm install guide (https://istio.io/docs/setup/install/helm/) 

**Environment where bug was observed (cloud vendor, OS, etc)**
On-Premise Kubernetes Cluster provisioned with Rancher.
Kubernetes version: 1.17.2
Rancher version: 2.3.5
RancherOS version: 1.5.4

**Comment by Tharun-Sabbu** [comment]
I'm having the exact same issue, using proxy protocol on AWS ELB and enabled TLS termination on Ingress Gateway. Tried with both HTTP and HTTPS, HTTP requests seems to be working fine, however HTTPS were failing.

**Comment by dhermes** [comment]
Have you tried something like

```yaml
apiVersion: networking.istio.io/v1alpha3
kind: EnvoyFilter
metadata:
  name: proxy-protocol
spec:
  workloadSelector:
    labels:
      istio: {{ .IngressGateway }}
  configPatches:
  - applyTo: LISTENER
    patch:
      operation: MERGE
      value:
        listener_filters:
        - name: envoy.listener.proxy_protocol
        - name: envoy.listener.tls_inspector
```

**Comment by Tharun-Sabbu** [comment]
Hello @dhermes, thanks for reaching out. Yeah I tried with that configuration, only extra configuration added was namespace istio-system to the envoy filter configuration you posted. Will that make any difference?

**Comment by BeWut** [comment]
@dhermes Thanks for the suggestion we will try that as well.

**Comment by BeWut** [comment]
@dhermes The additional filter `- name: envoy.listener.tls_inspector` worked like a charm thanks for the suggestion again.

Although this issue is resolved, documentation on proxy protocol is rather lacking and I first want to check the proper procedure to suggest improvements to the docs before before closing this issue.
