### DISCUSSION TITLE
K8s cluster, issue with access timeout of 1 second

### DISCUSSION THREAD

**Discussion by jimmy535535** [istio/istio#48498] [Q&A]
Background: We are currently preparing for the launch of Istio and have set up a new Kubernetes (K8S) environment. However, we encountered numerous 502 and other related issues during the traffic switch. Here are some important details:

- K8S version: 1.26.9
- Istio version: http://docker.io/istio/pilot:1.18.2 and http://docker.io/istio/proxyv2:1.18.2
- Containerd version: 1.6.26
- Calico version: http://docker.io/calico/kube-controllers:v3.26.1

Phenomenon: When using a shell script to loop through curl requests, we observed that there were instances of link timeouts exceeding 1 second, which is unusual considering that the normal response time is 3-5 milliseconds. These timeouts occurred when directly curling the NodePort of Istio.

Troubleshooting process:

1. We attempted various actions, including switching to different virtual machines, changing the virtual machine's host, upgrading the kernel, upgrading the operating system, and adjusting kernel parameters. Some machines showed improvement after these adjustments, but others did not respond to the same measures.

2. In the development and testing environments, we downgraded Containerd to version 1.6.10. This resulted in an improvement in the development environment, with no timeouts observed in 1.8 million attempts. In the testing environment, the frequency of timeouts decreased to 1.5 million times, with approximately 2000 timeouts.

3. We tested the Service (SVC) NodePort of internal cluster services without using Istio and found no issues.

4. Whether this issue is related to Istio remains unclear, as some machines could pass through Istio without problems.

5. Further testing on different nodes in the cluster revealed that the timeout frequency was relatively high on certain nodes while others did not experience timeouts.

6. Packet capture data was collected and analyzed, as shown below:

   ```
   101 2023-12-15 15:53:47.534642 172.128.9.24 172.129.9.102 TCP 74 58572 → 31896 [SYN] Seq=0 Win=64240 Len=0 MSS=1460 SACK_ Perm=1 TSval=3255928425 TSecr=0 WS=128
   102 2023-12-15 15:53:47.535058 172.129.9.102 172.128.9.24 TCP 66 31896 → 58572 [ACK] Seq=1 Ack=2246793900 Win=64128 Len=0 TSval=242533004 TSecr=276815163
   103 2023-12-15 15:53:47.535074 172.128.9.24 172.129.9.102 TCP 54 58572 → 31896 [RST] Seq=2246793900 Win=0 Len=0
   ```

Additionally, here are some details about my operating system environment:

- Operating System: CentOS 7.2009
- Kernel Version: `Linux ds test k8smaster-01 5.15.2-1.el7.elrepo.x86_64 #1 SMP Wed Nov 10 18:06:14 EST 2021 x86_64 x86_64 GNU/Linux`

I would appreciate any recommendations for versions of K8S, Istio, Containerd, or Calico that are widely used, as I am open to setting up a testing environment with those versions. Thank you for your assistance.

**Comment by jimmy535535** [comment]
Or recommend me a version of k8s, isio, containerd, or calico that everyone is using, and I will set it up for testing
thanks
