### ISSUE TITLE
istio sidecar has many FIN-WAIT-2 connections

### ISSUE THREAD

**Issue by fatedier** [istio/istio#39371]
### Bug Description

Our golang program send HTTPS requests to external service. It will active close connections after finishing requests.

WIthout istio sidecar, the connections can be closed normally. Connection state from ESTAB to TIME-WAIT.

With istio sidecar, connections between envoy and external service will always keep FIN-WAIT-2，connections between go program and envoy will be CLOSE-WAIT.

There are also some confusing point:
1. Not all external services trigger this problem.
2. I can reproduce this problem with `118.89.205.206.443`(domain is `sms.tencentcloudapi.com`) in my environment.
3. Envoy got the last FIN package but do nothing.

tcpdump info:

### Without istio sidecar
```
18:34:08.484290 IP 172.17.14.106.57592 > 118.89.205.206.443: Flags [S], seq 1544573619, win 65535, options [mss 1460,sackOK,TS val 2630119319 ecr 0,nop,wscale 9], length 0
18:34:08.493157 IP 118.89.205.206.443 > 172.17.14.106.57592: Flags [S.], seq 3972571483, ack 1544573620, win 14600, options [mss 1440,nop,nop,sackOK,nop,wscale 7], length 0
18:34:08.493181 IP 172.17.14.106.57592 > 118.89.205.206.443: Flags [.], ack 1, win 128, length 0
18:34:08.493460 IP 172.17.14.106.57592 > 118.89.205.206.443: Flags [P.], seq 1:294, ack 1, win 128, length 293
18:34:08.501957 IP 118.89.205.206.443 > 172.17.14.106.57592: Flags [.], ack 294, win 123, length 0
18:34:08.503822 IP 118.89.205.206.443 > 172.17.14.106.57592: Flags [.], seq 1:1441, ack 294, win 123, length 1440
18:34:08.503832 IP 172.17.14.106.57592 > 118.89.205.206.443: Flags [.], ack 1441, win 134, length 0
18:34:08.503861 IP 118.89.205.206.443 > 172.17.14.106.57592: Flags [.], seq 1441:2881, ack 294, win 123, length 1440
18:34:08.503867 IP 118.89.205.206.443 > 172.17.14.106.57592: Flags [.], seq 2881:5761, ack 294, win 123, length 2880
18:34:08.503870 IP 118.89.205.206.443 > 172.17.14.106.57592: Flags [P.], seq 5761:6481, ack 294, win 123, length 720
18:34:08.503879 IP 172.17.14.106.57592 > 118.89.205.206.443: Flags [.], ack 2881, win 140, length 0
18:34:08.503896 IP 172.17.14.106.57592 > 118.89.205.206.443: Flags [.], ack 5761, win 151, length 0
18:34:08.503903 IP 172.17.14.106.57592 > 118.89.205.206.443: Flags [.], ack 6481, win 157, length 0
18:34:08.504970 IP 172.17.14.106.57592 > 118.89.205.206.443: Flags [P.], seq 294:420, ack 6481, win 157, length 126
18:34:08.514349 IP 118.89.205.206.443 > 172.17.14.106.57592: Flags [P.], seq 6481:6532, ack 420, win 123, length 51
18:34:08.514556 IP 172.17.14.106.57592 > 118.89.205.206.443: Flags [P.], seq 420:553, ack 6532, win 157, length 133
18:34:08.523471 IP 118.89.205.206.443 > 172.17.14.106.57592: Flags [P.], seq 6532:6876, ack 553, win 131, length 344
18:34:08.563931 IP 172.17.14.106.57592 > 118.89.205.206.443: Flags [.], ack 6876, win 162, length 0
18:34:13.528029 IP 172.17.14.106.57592 > 118.89.205.206.443: Flags [P.], seq 553:584, ack 6876, win 162, length 31
18:34:13.528071 IP 172.17.14.106.57592 > 118.89.205.206.443: Flags [F.], seq 584, ack 6876, win 162, length 0
18:34:13.538107 IP 118.89.205.206.443 > 172.17.14.106.57592: Flags [F.], seq 6876, ack 585, win 131, length 0
18:34:13.538119 IP 172.17.14.106.57592 > 118.89.205.206.443: Flags [.], ack 6877, win 162, length 0
```

### With istio sidecar

```
18:47:45.877689 IP 172.17.12.221.36332 > 127.0.0.1.15001: Flags [S], seq 1739242300, win 65535, options [mss 1460,sackOK,TS val 3633262896 ecr 0,nop,wscale 9], length 0
18:47:45.877701 IP 118.89.205.206.443 > 172.17.12.221.36332: Flags [S.], seq 3826395862, ack 1739242301, win 65535, options [mss 65495,sackOK,TS val 57162210 ecr 3633262896,nop,wscale 9], length 0
18:47:45.877711 IP 172.17.12.221.36332 > 127.0.0.1.15001: Flags [.], ack 3826395863, win 128, options [nop,nop,TS val 3633262896 ecr 57162210], length 0
18:47:45.877939 IP 172.17.12.221.36332 > 127.0.0.1.15001: Flags [P.], seq 0:293, ack 1, win 128, options [nop,nop,TS val 3633262897 ecr 57162210], length 293
18:47:45.877946 IP 118.89.205.206.443 > 172.17.12.221.36332: Flags [.], ack 294, win 131, options [nop,nop,TS val 57162211 ecr 3633262897], length 0
18:47:45.877994 IP 172.17.12.221.36334 > 118.89.205.206.443: Flags [S], seq 1803986277, win 65535, options [mss 1460,sackOK,TS val 3633262897 ecr 0,nop,wscale 9], length 0
18:47:45.887748 IP 118.89.205.206.443 > 172.17.12.221.36334: Flags [S.], seq 90194126, ack 1803986278, win 14600, options [mss 1440,nop,nop,sackOK,nop,wscale 7], length 0
18:47:45.887765 IP 172.17.12.221.36334 > 118.89.205.206.443: Flags [.], ack 1, win 128, length 0
18:47:45.887838 IP 172.17.12.221.36334 > 118.89.205.206.443: Flags [P.], seq 1:294, ack 1, win 128, length 293
18:47:45.897433 IP 118.89.205.206.443 > 172.17.12.221.36334: Flags [.], ack 294, win 123, length 0
18:47:45.899349 IP 118.89.205.206.443 > 172.17.12.221.36334: Flags [.], seq 1:1441, ack 294, win 123, length 1440
18:47:45.899361 IP 172.17.12.221.36334 > 118.89.205.206.443: Flags [.], ack 1441, win 134, length 0
18:47:45.899385 IP 118.89.205.206.443 > 172.17.12.221.36334: Flags [.], seq 1441:2881, ack 294, win 123, length 1440
18:47:45.899400 IP 172.17.12.221.36334 > 118.89.205.206.443: Flags [.], ack 2881, win 140, length 0
18:47:45.899392 IP 118.89.205.206.443 > 172.17.12.221.36334: Flags [.], seq 2881:5761, ack 294, win 123, length 2880
18:47:45.899406 IP 172.17.12.221.36334 > 118.89.205.206.443: Flags [.], ack 5761, win 151, length 0
18:47:45.899395 IP 118.89.205.206.443 > 172.17.12.221.36334: Flags [P.], seq 5761:6481, ack 294, win 123, length 720
18:47:45.899418 IP 172.17.12.221.36334 > 118.89.205.206.443: Flags [.], ack 6481, win 157, length 0
18:47:45.899452 IP 118.89.205.206.443 > 172.17.12.221.36332: Flags [P.], seq 1:6481, ack 294, win 131, options [nop,nop,TS val 57162232 ecr 3633262897], length 6480
18:47:45.899467 IP 172.17.12.221.36332 > 127.0.0.1.15001: Flags [.], ack 6481, win 154, options [nop,nop,TS val 3633262918 ecr 57162232], length 0
18:47:45.900331 IP 172.17.12.221.36332 > 127.0.0.1.15001: Flags [P.], seq 293:419, ack 6481, win 154, options [nop,nop,TS val 3633262919 ecr 57162232], length 126
18:47:45.900364 IP 172.17.12.221.36334 > 118.89.205.206.443: Flags [P.], seq 294:420, ack 6481, win 157, length 126
18:47:45.909888 IP 118.89.205.206.443 > 172.17.12.221.36334: Flags [P.], seq 6481:6532, ack 420, win 123, length 51
18:47:45.909957 IP 118.89.205.206.443 > 172.17.12.221.36332: Flags [P.], seq 6481:6532, ack 420, win 131, options [nop,nop,TS val 57162243 ecr 3633262919], length 51
18:47:45.910107 IP 172.17.12.221.36332 > 127.0.0.1.15001: Flags [P.], seq 419:552, ack 6532, win 154, options [nop,nop,TS val 3633262929 ecr 57162243], length 133
18:47:45.910139 IP 172.17.12.221.36334 > 118.89.205.206.443: Flags [P.], seq 420:553, ack 6532, win 157, length 133
18:47:45.919760 IP 118.89.205.206.443 > 172.17.12.221.36334: Flags [P.], seq 6532:6876, ack 553, win 131, length 344
18:47:45.919823 IP 118.89.205.206.443 > 172.17.12.221.36332: Flags [P.], seq 6532:6876, ack 553, win 133, options [nop,nop,TS val 57162253 ecr 3633262929], length 344
18:47:45.960567 IP 172.17.12.221.36332 > 127.0.0.1.15001: Flags [.], ack 6876, win 159, options [nop,nop,TS val 3633262979 ecr 57162253], length 0
18:47:45.961560 IP 172.17.12.221.36334 > 118.89.205.206.443: Flags [.], ack 6876, win 162, length 0
18:47:50.920931 IP 172.17.12.221.36332 > 127.0.0.1.15001: Flags [P.], seq 552:583, ack 6876, win 159, options [nop,nop,TS val 3633267939 ecr 57162253], length 31
18:47:50.920977 IP 172.17.12.221.36332 > 127.0.0.1.15001: Flags [F.], seq 583, ack 6876, win 159, options [nop,nop,TS val 3633267939 ecr 57162253], length 0
18:47:50.921015 IP 172.17.12.221.36334 > 118.89.205.206.443: Flags [P.], seq 553:584, ack 6876, win 162, length 31
18:47:50.921041 IP 172.17.12.221.36334 > 118.89.205.206.443: Flags [F.], seq 584, ack 6876, win 162, length 0
18:47:50.928573 IP 172.17.12.221.36332 > 127.0.0.1.15001: Flags [F.], seq 583, ack 6876, win 159, options [nop,nop,TS val 3633267947 ecr 57162253], length 0
18:47:50.928586 IP 118.89.205.206.443 > 172.17.12.221.36332: Flags [.], ack 585, win 133, options [nop,nop,TS val 57167261 ecr 3633267939,nop,nop,sack 1 {584:585}], length 0
18:47:50.930541 IP 118.89.205.206.443 > 172.17.12.221.36334: Flags [.], ack 585, win 131, length 0
18:47:50.930546 IP 118.89.205.206.443 > 172.17.12.221.36334: Flags [F.], seq 6876, ack 584, win 131, length 0
18:47:50.930575 IP 172.17.12.221.36334 > 118.89.205.206.443: Flags [.], ack 6876, win 162, length 0
```

connection state
```
FIN-WAIT-2 0      0      172.17.12.221:36334              118.89.205.206:443                 users:(("envoy",pid=2963419,fd=84))
```

Envoy got the last FIN package:

`18:47:50.930546 IP 118.89.205.206.443 > 172.17.12.221.36334: Flags [F.], seq 6876, ack 584, win 131, length 0`

But don't close downstream and upstream connection.

### Version

```prose
Istio
client version: 1.12.6
control plane version: 1.12.6
data plane version: 1.12.6
```

**Comment by bluemir** [comment]
I have exactly same problem in Istio 1.4.10.
I assumed it cause connection timeout(not connection reset) 0.005% of connection.

**Comment by fatedier** [comment]
<img width="564" alt="image" src="https://user-images.githubusercontent.com/7346661/178681299-4114119e-718c-4391-88b0-3d553f64deb4.png">
<img width="555" alt="image" src="https://user-images.githubusercontent.com/7346661/178681326-906d021e-84f3-4d5e-af42-d473a2b04d47.png">

It's really a big problem for us. 

> I assumed it cause connection timeout(not connection reset) 0.005% of connection(POD --> outside).

@bluemir Yes, same problem.

@howardjohn Can you give me some hint how to debug more about this issue?
