### ISSUE TITLE
Can not connect to service in k8s from virtual machine

### ISSUE THREAD

**Issue by copbint** [istio/istio#35572]
### Bug Description

I'm flowing this [guide](https://istio.io/latest/docs/setup/install/virtual-machine/#verify-istio-works-successfully) to intergrate vm into istio cluster,  after finish all steps, istio-proxy is runing well.

I'm flowing [this](https://istio.io/latest/docs/setup/install/virtual-machine/#verify-istio-works-successfully) to visit service in k8s cluster but failed.
> 4. Send requests from your Virtual Machine to the Service:
> $ curl helloworld.sample.svc:5000/hello
> Hello version: v1, instance: helloworld-v1-578dd69f69-fxwwk

tcp packets captured by tcpdump:
```
root@vm-0001:~# tcpdump -i any -nn port 5000
tcpdump: verbose output suppressed, use -v or -vv for full protocol decode
listening on any, link-type LINUX_SLL (Linux cooked), capture size 262144 bytes
21:26:53.865024 IP 10.98.193.173.5000 > 192.168.4.25.57112: Flags [S.], seq 742084919, ack 232241655, win 65483, options [mss 65495,sackOK,TS val 371338016 ecr 3423922482,nop,wscale 7], length 0
21:26:53.865157 IP 10.98.193.173.5000 > 192.168.4.25.57112: Flags [.], ack 96, win 511, options [nop,nop,TS val 371338016 ecr 3423922482], length 0
21:26:53.865488 IP 192.168.4.25.38814 > 10.244.1.5.5000: Flags [S], seq 2076199064, win 64240, options [mss 1460,sackOK,TS val 2591076325 ecr 0,nop,wscale 7], length 0
21:26:54.877738 IP 192.168.4.25.38814 > 10.244.1.5.5000: Flags [S], seq 2076199064, win 64240, options [mss 1460,sackOK,TS val 2591077337 ecr 0,nop,wscale 7], length 0
21:26:56.893763 IP 192.168.4.25.38814 > 10.244.1.5.5000: Flags [S], seq 2076199064, win 64240, options [mss 1460,sackOK,TS val 2591079353 ecr 0,nop,wscale 7], length 0
21:27:01.053758 IP 192.168.4.25.38814 > 10.244.1.5.5000: Flags [S], seq 2076199064, win 64240, options [mss 1460,sackOK,TS val 2591083513 ecr 0,nop,wscale 7], length 0
21:27:03.868422 IP 192.168.4.25.40438 > 10.244.1.4.5000: Flags [S], seq 805488883, win 64240, options [mss 1460,sackOK,TS val 3884209083 ecr 0,nop,wscale 7], length 0

```
It's obvious, app on vm is connecting helloworld using clusterIp and istio transfer it to pod IP, but pod IP is not known to vm.

I think k8s cni plugin(such as flannel) is doing this: support pod to pod connectivity using "mac in udp". 
While our app is running on VM, pod ip is not accessable. So what is the solution to intergrate vm? I did't get information about this from the guide. 

Any reply would be great appreciated.

### Version

```prose
root@0001:/etc/ssh# istioctl version
client version: 1.11.2
control plane version: 1.11.2
data plane version: 1.11.0 (2 proxies), 1.11.2 (5 proxies)
root@0001:/etc/ssh#
root@0001:/etc/ssh# kubectl version --short
Client Version: v1.22.1
Server Version: v1.22.1
```
