### ISSUE TITLE
L7 routing doesn't work with waypoint if source pod not in the ambient mesh

### ISSUE THREAD

**Issue by yuval-k** [istio/istio#44534]
### Bug Description

Scenario:
- Pod not in the mesh tries to access a service that has a waypoint
- Because the pod is not in the mesh, the VIP is resolved to a pod ip
- Ztunnel captures the traffic for the destination pod and sends it to waypoint
- waypoint receives traffic with pod ip (and not serviced vip) and doesn't apply the service routing

### Version

```Text
1.18.0-alpha.0
```

### Affected product area

- [X] Ambient
- [ ] Docs
- [ ] Installation
- [ ] Networking
- [ ] Performance and Scalability
- [ ] Extensions and Telemetry
- [ ] Security
- [ ] Test and Release
- [ ] User Experience
- [ ] Developer Infrastructure
- [ ] Upgrade
- [ ] Multi Cluster
- [ ] Virtual Machine
- [ ] Control Plane Revisions

**Comment by kyessenov** [comment]
That seems like a desired intent - for example, the source might be running its own load balancer (a sidecar or an SDK).

**Comment by birkland** [comment]
Consider AuthorizationPolicy (L7 in particular).  In the sidecar world, the producer sidecar can apply policy to all inbound traffic regardless of source.    To lose that property in ambient with waypoints would seem to be a regression.  To me, desired intent of policy on a waypoint is that the policy is enacted on all inbound traffic to my app -- it's a gateway, after all.

**Comment by kyessenov** [comment]
@birkland Right, which is why authorization policy doesn't bind to services, but to waypoints themselves, regardless of the destination IP.

**Comment by birkland** [comment]
.. and the bug described here in this ticket has the net result that the waypoint currently does not enforce AuthorizationPolicy policy on traffic originating from outside the mesh.

**Comment by keithmattix** [comment]
In the AuthorizationPolicy case though, there's no cert or identity to match on for services outside the mesh. The only thing that you can depend on would be ipBlock which I would expect to work since you're blocking workload IPs not service IPs

**Comment by birkland** [comment]
> In the AuthorizationPolicy case though, there's no cert or identity to match on for services outside the mesh. The only thing that you can depend on would be ipBlock which I would expect to work since you're blocking workload IPs not service IPs

But even in that case - can't you mix ip blocks with L7 concepts, like grant hosts from certain IP blocks permission to do  HTTP `GET` on `/foo` (which would require a waypoint due to rules based on HTTP concepts)?  Likewise, how about `requestPrincipals` as a `source` (if using JWT)? 

Taking a step back, the fundamental issue at a high level is that it doesn't seem that _any_ policy applied to the waypoint can currently be enacted on traffic that originates from outside the mesh for the original reasons stated in the issue description.   Is that not a bug?

**Comment by kyessenov** [comment]
> .. and the bug described here in this ticket has the net result that the waypoint currently does not enforce AuthorizationPolicy policy on traffic originating from outside the mesh. (i.e. it's not just L7 routing that doesn't work on traffic originating from outside the mesh, it's L7 anything - including AuthorizationPolicies)

Are you sure about that? I think in the latest xDS we apply authorization policy uniformly, regardless of the service routing. Direct pod access is supported, with all the policy attachment, and if not, it's a bug.

**Comment by birkland** [comment]
Let me build the tip of main and see if it has the same issues as alpha 0

**Comment by linsun** [comment]
@birkland any update? I'd expect this to work. I think this is one of the advantages we promote for ambient where the policy is enforced regardless of whether the source is in-mesh or out-of-mesh.

**Comment by linsun** [comment]
cc @stevenctl

**Comment by vikaschoudhary16** [comment]
it seems working for me. Actually ip which goes to ztunnel, even for non-mesh client, seems to be dest service vip. 
I have a `sleep` pod in `sleep` namespace. namespace has no special annotations or labels:
```
vikas@ istio-oss (master) $ k get ns sleep -o yaml | yq .metadata
creationTimestamp: "2023-05-13T10:55:54Z"
labels:
  kubernetes.io/metadata.name: sleep
name: sleep
resourceVersion: "88458"
uid: 54a0b2ca-954a-49f6-a7e2-1f0d92c62f5e

```

`sleep` pod is on `kind-worker` node:
```
vikas@ istio-oss (master) $ kgp -n sleep -o wide
NAME                     READY   STATUS    RESTARTS   AGE     IP            NODE          NOMINATED NODE   READINESS GATES
sleep-75bbc86479-7vvs9   1/1     Running   0          6m57s   10.244.1.15   kind-worker   <none>           <none>
```

`bookinfo` is running in `default` namespace as per quickstart guide:
```
vikas@ istio-oss (master) $ k get svc -o wide
NAME                                  TYPE        CLUSTER-IP      EXTERNAL-IP   PORT(S)     AGE   SELECTOR
bookinfo-productpage-istio-waypoint   ClusterIP   10.96.158.253   <none>        15008/TCP   24h   istio.io/gateway-name=bookinfo-productpage
details                               ClusterIP   10.96.227.100   <none>        9080/TCP    24h   app=details
kubernetes                            ClusterIP   10.96.0.1       <none>        443/TCP     24h   <none>
notsleep                              ClusterIP   10.96.115.113   <none>        80/TCP      24h   app=notsleep
productpage                           ClusterIP   10.96.112.1     <none>        9080/TCP    24h   app=productpage
ratings                               ClusterIP   10.96.32.200    <none>        9080/TCP    24h   app=ratings
reviews                               ClusterIP   10.96.135.222   <none>        9080/TCP    24h   app=reviews
sleep                                 ClusterIP   10.96.170.7     <none>        80/TCP      24h   app=sleep

```

on running:
```
vikas@ istio-oss (master) $ kubectl exec deploy/sleep -n sleep  -- curl -s http://productpage.default:9080/ | grep -o "<title>.*</title>"
<title>Simple Bookstore App</title>
```

 tcpdump on the `istioout` port on the node to see what dest ip is coming out of the client pod and it shows `product` svc vip `10.96.112.1`
```
tcpdump: verbose output suppressed, use -v or -vv for full protocol decode
listening on istioout, link-type EN10MB (Ethernet), capture size 262144 bytes

16:45:49.757886 IP 10.244.1.15.58846 > 10.96.112.1.9080: Flags [S], seq 2286788578, win 64240, options [mss 1460,sackOK,TS val 2933119560 ecr 0,nop,wscale 7], length 0
16:45:53.973187 IP 10.244.1.15.58852 > 10.96.112.1.9080: Flags [S], seq 1415437984, win 64240, options [mss 1460,sackOK,TS val 2933123775 ecr 0,nop,wscale 7], length 0
16:45:59.087001 ARP, Request who-has 192.168.127.2 tell 192.168.127.1, length 28
16:45:59.087225 ARP, Reply 192.168.127.2 is-at 2a:31:bc:2e:d9:22 (oui Unknown), length 28
16:46:01.437854 IP 10.244.1.15.51426 > 10.96.112.1.9080: Flags [S], seq 2961876844, win 64240, options [mss 1460,sackOK,TS val 2933131240 ecr 0,nop,wscale 7], length 0
```

Even before trying I was thinking that it should be svc vip only to which dns should resolve to even for non-mesh pods.
