### ISSUE TITLE
frontend virtual service requests k8s internal fqdn for a service always gives 404 and because of that istio gives 500 internal error

### ISSUE THREAD

**Issue by dockercaptain** [istio/istio#20293]
i have created a virtual service and able to access the frontend service via istio's ingress gateway, but if frontend service needs to access another backend service within the k8s cluster using it's internal name  which is backend1.ns1.svc.cluster.local. it always gives 404 and because of that istio gives 500 internal error to my main request(that i made for frontend service). interesting thing is when i access backend service from frontend service's pod, I am able to access that using internal fqdn. Not sure why it's not working.

frontend request gives 500 internal error:-
============================

curl -i -X GET  http://<ip-of-ingress-gateway>/api/authorization/v1/institutions/112233445/applications/Wires/permission-sets  -H 'authorization: Bearer eyJhbGciOiJSUzI1NiIsImtpZCI6ImRDelFrdWFsWVdSVFFONkJkYUo1YXciLCJ0eXAiOiJhdCtqd3QifQ.eyJuYmYiOjE1NzkyNDIxMDUsImV4cCI6MTU3OTMyODUwNCwiaXNzIjoiaHR0cDovL2lkZW50aXR5c2VydmljZS53ZXN0dXMyLmNsb3VkYXBwLmF6dXJlLmNvbSIsImF1ZCI6WyJvcGVuaWQiLCJ1eC1hcGkiXSwiY2xpZW50X2lkIjoiamhhLXV4Iiwic3ViIjoiVXNlck5hbWUiLCJhdXRoX3RpbWUiOjE1NzkyNDIxMDUsImlkcCI6ImxvY2FsIiwicHJlZmVycmVkX3VzZXJuYW1lIjoiVXNlck5hbWUiLCJuYW1lIjoiRmlyc3ROYW1lIExhc3ROYW1lIiwiZ2l2ZW5fbmFtZSI6IkZpcnN0TmFtZSIsImZhbWlseV9uYW1lIjoiTGFzdE5hbWUiLCJlbWFpbCI6InVzZXJAZXhhbXBsZS5jb20iLCJyb2xlIjoiUk9MRTEsUk9MRTIsUk9MRTMsMTEyMjMzNDQ1Iiwic2FtbFRva2VuX2lkIjoiYjU5YzQ1ZmYtMWU2MC00ZjEzLTkyMWEtMjEyYzA5OWQ1Njc0Iiwic2NvcGUiOlsib3BlbmlkIiwidXgtYXBpIl0sImFtciI6WyJwYXNzd29yZCJdfQ.i08nZ6lxWaDxjpT6zd3tK0bawDaJ9MwPhGUjr_D6FenQ4MQKGbQNyxFEb6-yPIMUqvC3wmgCEr-5_EPiC7-vlMeXHk6hYkSUNJgXQb8I7KKEfhnEhW9-h2YhGUWZQ4Qu-r_lfqfzqy8LBPYL9LJkfNO4nCzEIu4Hj9-fMYsF-LsAvc_d5gfDcun-jYG1XELJWhvSvKFsSoxxUORBY7Xy5m35V1l4jsvScJQh4gMqlH7TWAfpnG--f5yV7b-Tz70GVfOv9AHGt9Yk5whkhTfGhQvwujkW3c1I2ILhvODr-qa0PJwqiKqkrCtrFdQr3lKYU3FJDiSEP5vJXZP-i9DteQ'  -H 'cache-control: no-cache'  -H 'postman-token: 35c43ad4-60c8-ecea-15c4-332422016362'  -H 'x-request-id: 23d74dfd-2420-4e17-89cc-582e6f818d7b'  -H 'Host: authorization-service.core-shared-service.svc.cluster.local'
HTTP/1.1 500 Internal Server Error
date: Sat, 18 Jan 2020 04:09:08 GMT
server: istio-envoy
content-length: 0
x-envoy-upstream-service-time: 6

at the same time logs inside the frontend pod internal backend service(configurationmanagement-service.core-shared-service.svc.cluster.local) gives 404:-
====================
04:09:09.277050 IP localhost.33378 > localhost.80: Flags [P.], seq 1:2286, ack 1, win 342, options [nop,nop,TS val 71195705 ecr 71195704], length 2285: HTTP: GET /api/authorization/v1/institutions/112233445/applications/Wires/permission-sets HTTP/1.1
04:09:09.280156 IP **configurationmanagement-service.core-shared-service.svc.cluster.local**.80 > authorization-service-575b598858-hpqxd.49448: Flags [P.], seq 1:98, ack 2529, win 1365, options [nop,nop,TS val 2140326908 ecr 4050084607], length 97: HTTP: HTTP/1.1 404 Not Found
04:09:09.283079 IP localhost.80 > localhost.33378: Flags [P.], seq 1:112, ack 2286, win 1365, options [nop,nop,TS val 71195711 ecr 71195705], length 111: HTTP: HTTP/1.1 500 Internal Server Error

if same backend url I access from the frontned pod, i can access that:-
=============================================

curl -I --location --request GET 'http://configurationmanagement-service/api/v1/configuration/Config/CSS.Authorization.AppSettings' --header 'Authorization: Bearer eyJhbGciOiJSUzI1NiIsImtpZCI6ImRDelFrdWFsWVdSVFFONkJkYUo1YXciLCJ0eXAiOiJhdCtqd3QifQ.eyJuYmYiOjE1NzkyNTIwNTMsImV4cCI6MTU3OTMzODQ1MiwiaXNzIjoiaHR0cDovL2lkZW50aXR5c2VydmljZS53ZXN0dXMyLmNsb3VkYXBwLmF6dXJlLmNvbSIsImF1ZCI6WyJvcGVuaWQiLCJ1eC1hcGkiXSwiY2xpZW50X2lkIjoiamhhLXV4Iiwic3ViIjoiVXNlck5hbWUiLCJhdXRoX3RpbWUiOjE1NzkyNTIwNTMsImlkcCI6ImxvY2FsIiwicHJlZmVycmVkX3VzZXJuYW1lIjoiVXNlck5hbWUiLCJuYW1lIjoiRmlyc3ROYW1lIExhc3ROYW1lIiwiZ2l2ZW5fbmFtZSI6IkZpcnN0TmFtZSIsImZhbWlseV9uYW1lIjoiTGFzdE5hbWUiLCJlbWFpbCI6InVzZXJAZXhhbXBsZS5jb20iLCJyb2xlIjoiUk9MRTEsUk9MRTIsUk9MRTMsMTEyMjMzNDQ1Iiwic2FtbFRva2VuX2lkIjoiMWM1ZDMzMWUtMWFlZC00NjdhLThhZjAtYTQxNjNlYzhlMTVlIiwic2NvcGUiOlsib3BlbmlkIiwidXgtYXBpIl0sImFtciI6WyJwYXNzd29yZCJdfQ.APO8dksqW2tYW3Q3Ky26a61IuQSQZnzuwBH_UBtm5ph4fGTf1mRBYdhQlhN9vthleCrSeDhp7AO9zmJ-penGLn51dlA03d7yeejGnU_-NojMEKVMtKmkT8EeeIt7Q16Kxvrtfz41YYmqQQLunsQi98W_J8fZStjn2jerW6N36XcFEQVviyd3PLaeMrkxgTs7JBgr4_ye2MCZClS8RQ1528NhyKt2-NB4XVj3_VERXYyuXepCppqoHrqIYtCxSb6tMMxNR3BSn5ZAxfRwvnI75CV1_kaVaYFLVU9Qj4-uOVwQPPG1qgS9pOsWOQo7R4yB-vgiUeglQyJrKEyTcB7jXwl' --header 'Content-Type: application/json' --header 'x-css-correlation-id: e8712ca6-d31f-49fd-87a3-6fd66b5c683c'
HTTP/1.1 200 OK
date: Sat, 18 Jan 2020 04:13:02 GMT
content-type: application/json; charset=utf-8
server: envoy
request-context: appId=cid-v1:be393687-16de-46d9-b62e-91dcdf2b708a
api-supported-versions: 1.0
x-envoy-upstream-service-time: 634
transfer-encoding: chunked

not sure what is different when i access frontend virtual service, which internally access the backend service.

**Comment by howardjohn** [comment]
Can you get access logs and config dumps from all 3 pods? See https://github.com/istio/istio/wiki/Troubleshooting-Istio
