### ISSUE TITLE
istio 1.6.8 with mtls - kafka and zookeeper issue

### ISSUE THREAD

**Issue by satishmane** [istio/istio#26791]
**Bug description**

Enabled PeerAuthentication to STRICT mode for mtls on kafka namespace which has both kafka and zookeeper pods. One of Kafka pods keep raising below errors. When application tries to connect to kafka, it fails with "Leader not available error". In permissive mode, everything works fine.

ch=Optional[0]), vin.ota.provision.response-0=(fetchOffset=0, logStartOffset=0, maxBytes=1048576, currentLeaderEpoch=Optional[0])}, isolationLevel=READ_UNCOMMITTED, toForget=, metadata=(sessionId=INVALID, epoch=INITIAL)) (kafka.server.ReplicaFetcherThread)
java.io.IOException: Connection to 1003 was disconnected before the response was read
	at org.apache.kafka.clients.NetworkClientUtils.sendAndReceive(NetworkClientUtils.java:100)
	at kafka.server.ReplicaFetcherBlockingSend.sendRequest(ReplicaFetcherBlockingSend.scala:99)
	at kafka.server.ReplicaFetcherThread.fetchFromLeader(ReplicaFetcherThread.scala:192)
	at kafka.server.AbstractFetcherThread.kafka$server$AbstractFetcherThread$$processFetchRequest(AbstractFetcherThread.scala:274)
	at kafka.server.AbstractFetcherThread$$anonfun$maybeFetch$1.apply(AbstractFetcherThread.scala:132)
	at kafka.server.AbstractFetcherThread$$anonfun$maybeFetch$1.apply(AbstractFetcherThread.scala:131)
	at scala.Option.foreach(Option.scala:257)
	at kafka.server.AbstractFetcherThread.maybeFetch(AbstractFetcherThread.scala:131)
	at kafka.server.AbstractFetcherThread.doWork(AbstractFetcherThread.scala:113)
	at kafka.utils.ShutdownableThread.run(ShutdownableThread.scala:82)
[2020-08-25 06:06:18,152] INFO [ReplicaFetcher replicaId=1002, leaderId=1001, fetcherId=0] Error sending fetch request (sessionId=INVALID, epoch=INITIAL) to node 1001: java.io.IOException: Connection to 1001 was disconnected before the response was read. (org.apache.kafka.clients.FetchSessionHandler)
[2020-08-25 06:06:18,152] WARN [ReplicaFetcher replicaId=1002, leaderId=1001, fetcherId=0] Error in response for fetch request (type=FetchRequest, replicaId=1002, maxWait=500, minBytes=1, maxBytes=10485760

[ ] Docs
[ ] Installation
[ ] Networking
[ ] Performance and Scalability
[ ] Extensions and Telemetry
[ X] Security
[ ] Test and Release
[ ] User Experience
[ ] Developer Infrastructure

**Expected behavior**

Kafka should work smoothly in mtls mode.

**Steps to reproduce the bug**

1. Zookeeper - 3 pods
Enabled quorumListenAllIPs to true and also excluded 2888 and 3888 ports using annotations. Zookeeper is able to elect leader and followers

2. bitnami Kafka - 3 pods

One out of 3 pods keep raising below exception. When checked tcpdump on kafka pod, I see plain text traffic.

java.io.IOException: Connection to 1003 was disconnected before the response was read
	at org.apache.kafka.clients.NetworkClientUtils.sendAndReceive(NetworkClientUtils.java:100)
	at kafka.server.ReplicaFetcherBlockingSend.sendRequest(ReplicaFetcherBlockingSend.scala:99)
	at kafka.server.ReplicaFetcherThread.fetchFromLeader(ReplicaFetcherThread.scala:192)
	at kafka.server.AbstractFetcherThread.kafka$server$AbstractFetcherThread$$processFetchRequest(AbstractFetcherThread.scala:274)
	at kafka.server.AbstractFetcherThread$$anonfun$maybeFetch$1.apply(AbstractFetcherThread.scala:132)
	at kafka.server.AbstractFetcherThread$$anonfun$maybeFetch$1.apply(AbstractFetcherThread.scala:131)
	at scala.Option.foreach(Option.scala:257)
	at kafka.server.AbstractFetcherThread.maybeFetch(AbstractFetcherThread.scala:131)
	at kafka.server.AbstractFetcherThread.doWork(AbstractFetcherThread.scala:113)
	at kafka.utils.ShutdownableThread.run(ShutdownableThread.scala:82)
[2020-08-25 06:06:18,152] INFO [ReplicaFetcher replicaId=1002, leaderId=1001, fetcherId=0] Error sending fetch request (sessionId=INVALID, epoch=INITIAL) to node 1001: java.io.IOException: Connection to 1001 was disconnected before the response was read. (org.apache.kafka.clients.FetchSessionHandler)

**Version (include the output of `istioctl version --remote` and `kubectl version` and `helm version` if you used Helm)**

Istio : 1.6.8
kubernetest : 1.14 GKE
helm : 2
**How was Istio installed?**
istioctl install

**Comment by satishmane** [comment]
After PERMISSIVE mode, in this mode, kafka works fine.

$ netstat -pa
Active Internet connections (servers and established)
Proto Recv-Q Send-Q Local Address           Foreign Address         State       PID/Program name    
tcp        0      0 0.0.0.0:9092            0.0.0.0:*               LISTEN      -                   
tcp        0      0 0.0.0.0:36619           0.0.0.0:*               LISTEN      -                   
tcp        0      0 0.0.0.0:15021           0.0.0.0:*               LISTEN      18/envoy            
tcp        0      0 0.0.0.0:15090           0.0.0.0:*               LISTEN      18/envoy            
tcp        0      0 0.0.0.0:5556            0.0.0.0:*               LISTEN      -                   
tcp        0      0 localhost:15000         0.0.0.0:*               LISTEN      18/envoy            
tcp        0      0 0.0.0.0:15001           0.0.0.0:*               LISTEN      18/envoy            
tcp        0      0 0.0.0.0:15006           0.0.0.0:*               LISTEN      18/envoy            
tcp        0      0 infra-kafka-0.inf:15006 infra-kafka-1.inf:40304 ESTABLISHED 18/envoy            
tcp        0      0 localhost:15001         infra-kafka-0.inf:42470 ESTABLISHED 18/envoy            
tcp        0      0 localhost:9092          localhost:52854         ESTABLISHED -                   
tcp        0      0 localhost:15001         infra-kafka-0.inf:40690 ESTABLISHED 18/envoy            
tcp        0      0 infra-kafka-0.inf:40690 infra-kafka-2.infr:9092 ESTABLISHED -                   
tcp        0      0 localhost:55760         localhost:9092          ESTABLISHED 18/envoy            
tcp        0      0 localhost:45366         localhost:15020         ESTABLISHED 18/envoy            
tcp        0      0 infra-kafka-0.inf:40692 infra-kafka-2.infr:9092 ESTABLISHED 18/envoy            
tcp        0      0 infra-kafka-0.inf:15006 infra-kafka-2.inf:45148 ESTABLISHED 18/envoy            
tcp        0      0 localhost:52854         localhost:9092          ESTABLISHED 18/envoy            
tcp        0      0 infra-kafka-0.inf:39558 infra-kafka-1.infr:9092 ESTABLISHED -                   
tcp        0      0 infra-kafka-0.inf:45882 infra-kafka-zookee:2181 ESTABLISHED 18/envoy            
tcp        0      0 localhost:52852         localhost:9092          ESTABLISHED 18/envoy            
tcp        0      0 infra-kafka-0.inf:39560 infra-kafka-1.infr:9092 ESTABLISHED 18/envoy            
tcp        0      0 localhost:56426         localhost:15000         ESTABLISHED 1/pilot-agent       
tcp        0      0 infra-kafka-0.inf:15006 172.18.6.58:54340       ESTABLISHED 18/envoy            
tcp        0      0 localhost:15001         infra-kafka-0.inf:39558 ESTABLISHED 18/envoy            
tcp        0      0 localhost:45352         localhost:15020         ESTABLISHED 18/envoy            
tcp        0      0 localhost:52842         localhost:9092          CLOSE_WAIT  18/envoy            
tcp        0      0 localhost:15000         localhost:56426         ESTABLISHED 18/envoy            
tcp        0      0 localhost:9092          localhost:52852         ESTABLISHED -                   
tcp        0      0 infra-kafka-0.inf:32992 istiod.istio-syst:15012 ESTABLISHED 18/envoy            
tcp        0      0 infra-kafka-0.inf:59682 istiod.istio-syst:15012 ESTABLISHED 1/pilot-agent       
tcp        0      0 infra-kafka-0.inf:15006 infra-kafka-1.inf:40280 FIN_WAIT2   18/envoy            
tcp        0      0 infra-kafka-0.inf:42470 infra-kafka-zookee:2181 ESTABLISHED -                   
tcp        0      0 localhost:9092          localhost:55760         ESTABLISHED -                   
tcp6       0      0 [::]:15020              [::]:*                  LISTEN      1/pilot-agent       
tcp6       0      0 localhost:15020         localhost:45366         ESTABLISHED 1/pilot-agent       
tcp6       0      0 localhost:15020         localhost:45352         ESTABLISHED 1/pilot-agent


After Mtls strict mode, kafka does not work

$ netstat -a
Active Internet connections (servers and established)
Proto Recv-Q Send-Q Local Address           Foreign Address         State      
tcp        0      0 0.0.0.0:9092            0.0.0.0:*               LISTEN     
tcp        0      0 0.0.0.0:36619           0.0.0.0:*               LISTEN     
tcp        0      0 0.0.0.0:15021           0.0.0.0:*               LISTEN     
tcp        0      0 0.0.0.0:15090           0.0.0.0:*               LISTEN     
tcp        0      0 0.0.0.0:5556            0.0.0.0:*               LISTEN     
tcp        0      0 localhost:15000         0.0.0.0:*               LISTEN     
tcp        0      0 0.0.0.0:15001           0.0.0.0:*               LISTEN     
tcp        0      0 0.0.0.0:15006           0.0.0.0:*               LISTEN     
tcp        0      0 localhost:34716         localhost:9092          TIME_WAIT  
tcp        0      0 localhost:34480         localhost:9092          TIME_WAIT  
tcp        0      0 localhost:34904         localhost:9092          TIME_WAIT  
tcp        0      0 localhost:15001         infra-kafka-0.inf:50570 TIME_WAIT  
tcp        0      0 localhost:34582         localhost:9092          TIME_WAIT  
tcp        0      0 localhost:34266         localhost:9092          TIME_WAIT  
tcp        0      0 localhost:34560         localhost:9092          TIME_WAIT  
tcp        0      0 localhost:15001         infra-kafka-0.inf:50618 TIME_WAIT  
tcp        0      0 localhost:34410         localhost:9092          TIME_WAIT  
tcp        0      0 localhost:15001         infra-kafka-0.inf:51024 TIME_WAIT  
tcp        0      0 localhost:15001         infra-kafka-0.inf:50474 TIME_WAIT  
tcp        0      0 localhost:15001         infra-kafka-0.inf:49628 TIME_WAIT  
tcp        0      0 localhost:34680         localhost:9092          TIME_WAIT  
tcp        0      0 localhost:34608         localhost:9092          TIME_WAIT  
tcp        0      0 localhost:15001         infra-kafka-0.inf:49336 TIME_WAIT  
tcp        0      0 localhost:15001         infra-kafka-0.inf:50356 TIME_WAIT  
tcp        0      0 localhost:34314         localhost:9092          TIME_WAIT  
tcp        0      0 localhost:34534         localhost:9092          TIME_WAIT  
tcp        0      0 localhost:34506         localhost:9092          TIME_WAIT  
tcp        0      0 localhost:15001         infra-kafka-0.inf:50928 TIME_WAIT  
tcp        0      0 localhost:34616         localhost:9092          TIME_WAIT  
tcp        0      0 localhost:15001         infra-kafka-0.inf:49262 TIME_WAIT  
tcp        0      0 localhost:15001         infra-kafka-0.inf:49698 TIME_WAIT  
tcp        0      0 localhost:15001         infra-kafka-0.inf:50714 TIME_WAIT  
tcp        0      0 localhost:34860         localhost:9092          TIME_WAIT  
tcp        0      0 localhost:34818         localhost:9092          TIME_WAIT  
tcp        0      0 localhost:15001         infra-kafka-0.inf:49794 TIME_WAIT  
tcp        0      0 localhost:34460         localhost:9092          TIME_WAIT  
tcp        0      0 localhost:15001         infra-kafka-0.inf:50548 TIME_WAIT  
tcp        0      0 localhost:15001         infra-kafka-0.inf:49314 TIME_WAIT  
tcp        0      0 localhost:15001         infra-kafka-0.inf:49360 TIME_WAIT  
tcp        0      0 localhost:34858         localhost:9092          TIME_WAIT  
tcp        0      0 localhost:34290         localhost:9092          TIME_WAIT  
tcp        0      0 localhost:15001         infra-kafka-0.inf:50882 TIME_WAIT  
tcp        0      0 localhost:34344         localhost:9092          TIME_WAIT  
tcp        0      0 localhost:34882         localhost:9092          TIME_WAIT  
tcp        0      0 localhost:34482         localhost:9092          TIME_WAIT  
tcp        0      0 localhost:15001         infra-kafka-0.inf:50404 TIME_WAIT  
tcp        0      0 localhost:15001         infra-kafka-0.inf:50592 TIME_WAIT  
tcp        0      0 localhost:34462         localhost:9092          TIME_WAIT  
tcp        0      0 localhost:15001         infra-kafka-0.inf:49936 TIME_WAIT  
tcp        0      0 localhost:34934         localhost:9092          TIME_WAIT  
tcp        0      0 localhost:15001         infra-kafka-0.inf:49458 TIME_WAIT  
tcp        0      0 localhost:34280         localhost:9092          TIME_WAIT  
tcp        0      0 localhost:34592         localhost:9092          TIME_WAIT  
tcp        0      0 localhost:15001         infra-kafka-0.inf:50378 TIME_WAIT  
tcp        0      0 localhost:45366         localhost:15020         ESTABLISHED
tcp        0      0 localhost:34662         localhost:9092          TIME_WAIT  
tcp        0      0 localhost:15001         infra-kafka-0.inf:49816 TIME_WAIT  
tcp        0      0 localhost:15001         infra-kafka-0.inf:51046 TIME_WAIT  
tcp        0      0 localhost:15001         infra-kafka-0.inf:49842 TIME_WAIT  
tcp        0      0 localhost:15001         infra-kafka-0.inf:50620 ESTABLISHED
tcp        0      0 localhost:15001         infra-kafka-0.inf:49436 TIME_WAIT  
tcp        0      0 localhost:15001         infra-kafka-0.inf:49534 TIME_WAIT  
tcp        0      0 localhost:15001         infra-kafka-0.inf:50792 TIME_WAIT  
tcp        0      0 localhost:15001         infra-kafka-0.infr:1024 TIME_WAIT  
tcp        0      0 localhost:34638         localhost:9092          TIME_WAIT  
tcp        0      0 localhost:15001         infra-kafka-0.inf:50858 TIME_WAIT  
tcp        0      0 localhost:34528         localhost:9092          TIME_WAIT  
tcp        0      0 localhost:15001         infra-kafka-0.inf:50334 TIME_WAIT  
tcp        0      0 localhost:15001         infra-kafka-0.inf:49580 TIME_WAIT  
tcp        0      0 localhost:34816         localhost:9092          TIME_WAIT  
tcp        0      0 localhost:15001         infra-kafka-0.inf:49676 TIME_WAIT  
tcp        0      0 localhost:15001         infra-kafka-0.inf:51068 TIME_WAIT  
tcp        0      0 localhost:15001         infra-kafka-0.inf:50814 TIME_WAIT  
tcp        0      0 localhost:34360         localhost:9092          TIME_WAIT  
tcp        0      0 localhost:15001         infra-kafka-0.inf:49892 TIME_WAIT  
tcp        0      0 localhost:34936         localhost:9092          TIME_WAIT  
tcp        0      0 localhost:15001         infra-kafka-0.inf:50670 TIME_WAIT  
tcp        0      0 localhost:34708         localhost:9092          TIME_WAIT  
tcp        0      0 infra-kafka-0.inf:50620 infra-kafka-zookee:2181 ESTABLISHED
tcp        0      0 localhost:34738         localhost:9092          TIME_WAIT  
tcp        0      0 localhost:15001         infra-kafka-0.inf:49508 TIME_WAIT  
tcp        0      0 localhost:34382         localhost:9092          TIME_WAIT  
tcp        0      0 localhost:56426         localhost:15000         ESTABLISHED
tcp        0      0 localhost:15001         infra-kafka-0.inf:49748 TIME_WAIT  
tcp        0      0 localhost:15001         infra-kafka-0.inf:50524 TIME_WAIT  
tcp        0      0 localhost:34782         localhost:9092          TIME_WAIT  
tcp        0      0 localhost:15001         infra-kafka-0.inf:49914 TIME_WAIT  
tcp        0      0 localhost:15001         infra-kafka-0.inf:49772 TIME_WAIT  
tcp        0      0 localhost:34406         localhost:9092          TIME_WAIT  
tcp        0      0 localhost:34550         localhost:9092          TIME_WAIT  
tcp        0      0 localhost:34836         localhost:9092          TIME_WAIT  
tcp        0      0 localhost:34788         localhost:9092          TIME_WAIT  
tcp        0      0 infra-kafka-0.inf:54032 infra-kafka-zookee:2181 ESTABLISHED
tcp        0      0 localhost:34734         localhost:9092          TIME_WAIT  
tcp        0      0 localhost:34430         localhost:9092          TIME_WAIT  
tcp        0      0 localhost:34982         localhost:9092          TIME_WAIT  
tcp        0      0 localhost:34386         localhost:9092          TIME_WAIT  
tcp        0      0 localhost:15001         infra-kafka-0.inf:49482 TIME_WAIT  
tcp        0      0 localhost:15001         infra-kafka-0.inf:49388 TIME_WAIT  
tcp        0      0 localhost:15001         infra-kafka-0.inf:49558 TIME_WAIT  
tcp        0      0 localhost:15001         infra-kafka-0.inf:50644 TIME_WAIT  
tcp        0      0 localhost:15001         infra-kafka-0.inf:49292 TIME_WAIT  
tcp        0      0 localhost:15001         infra-kafka-0.inf:50430 TIME_WAIT  
tcp        0      0 localhost:34302         localhost:9092          TIME_WAIT  
tcp        0      0 localhost:34960         localhost:9092          TIME_WAIT  
tcp        0      0 localhost:34756         localhost:9092          TIME_WAIT  
tcp        0      0 localhost:45352         localhost:15020         ESTABLISHED
tcp        0      0 localhost:15001         infra-kafka-0.inf:50950 TIME_WAIT  
tcp        0      0 localhost:34978         localhost:9092          TIME_WAIT  
tcp        0      0 localhost:15000         localhost:56426         ESTABLISHED
tcp        0      0 localhost:34688         localhost:9092          TIME_WAIT  
tcp        0      0 localhost:15001         infra-kafka-0.inf:50768 TIME_WAIT  
tcp        0      0 localhost:15001         infra-kafka-0.inf:49414 TIME_WAIT  
tcp        0      0 localhost:15001         infra-kafka-0.inf:50834 TIME_WAIT  
tcp        0      0 localhost:34652         localhost:9092          TIME_WAIT  
tcp        0      0 localhost:15001         infra-kafka-0.inf:50740 TIME_WAIT  
tcp        0      0 localhost:34838         localhost:9092          TIME_WAIT  
tcp        0      0 infra-kafka-0.inf:32992 istiod.istio-syst:15012 ESTABLISHED
tcp        0      0 localhost:15001         infra-kafka-0.inf:50974 TIME_WAIT  
tcp        0      0 localhost:15001         infra-kafka-0.inf:50692 TIME_WAIT  
tcp        0      0 localhost:34906         localhost:9092          TIME_WAIT  
tcp        0      0 localhost:15001         infra-kafka-0.inf:51004 TIME_WAIT  
tcp        0      0 localhost:15001         infra-kafka-0.inf:49722 TIME_WAIT  
tcp        0      0 localhost:15001         infra-kafka-0.inf:49656 TIME_WAIT  
tcp        0      0 localhost:34954         localhost:9092          TIME_WAIT  
tcp        0      0 localhost:34764         localhost:9092          TIME_WAIT  
tcp        0      0 localhost:34884         localhost:9092          TIME_WAIT  
tcp        0      0 localhost:15001         infra-kafka-0.inf:50452 TIME_WAIT  
tcp        0      0 localhost:15001         infra-kafka-0.inf:50498 TIME_WAIT  
tcp        0      0 infra-kafka-0.inf:59682 istiod.istio-syst:15012 ESTABLISHED
tcp        0      0 localhost:34432         localhost:9092          TIME_WAIT  
tcp        0      0 localhost:15001         infra-kafka-0.inf:49868 TIME_WAIT  
tcp        0      0 localhost:34364         localhost:9092          TIME_WAIT  
tcp        0      0 localhost:15001         infra-kafka-0.inf:49216 TIME_WAIT  
tcp        0      0 localhost:15001         infra-kafka-0.inf:50906 TIME_WAIT  
tcp        0      0 localhost:34502         localhost:9092          TIME_WAIT  
tcp        0      0 localhost:15001         infra-kafka-0.inf:49602 TIME_WAIT  
tcp        0      0 localhost:34630         localhost:9092          TIME_WAIT  
tcp        0      0 localhost:34334         localhost:9092          TIME_WAIT  
tcp6       0      0 [::]:15020              [::]:*                  LISTEN     
tcp6       0      0 localhost:15020         localhost:45366         ESTABLISHED
tcp6       0      0 localhost:15020         localhost:45352         ESTABLISHED
Active UNIX domain sockets (servers and established)
Proto RefCnt Flags       Type       State         I-Node   Path
unix  2      [ ]         DGRAM                    115065   @envoy_domain_socket_parent_0@@@@@@@@@@@@@@@@@@@@@@@@@@@@@@@@@@@@@@@@@@@@@@@@@@@@@@@@@@@@@@@@@@@@@@@@@@@@@@@
unix  2      [ ACC ]     STREAM     LISTENING     113979   ./etc/istio/proxy/SDS
unix  2      [ ]         DGRAM                    115064   @envoy_domain_socket_child_0@@@@@@@@@@@@@@@@@@@@@@@@@@@@@@@@@@@@@@@@@@@@@@@@@@@@@@@@@@@@@@@@@@@@@@@@@@@@@@@@
unix  2      [ ]         STREAM     CONNECTED     114863   
unix  2      [ ]         STREAM     CONNECTED     111387   
unix  2      [ ]         STREAM     CONNECTED     111375   
unix  3      [ ]         STREAM     CONNECTED     117838   
unix  3      [ ]         STREAM     CONNECTED     112995   ./etc/istio/proxy/SDS

**Comment by satishmane** [comment]
@howardjohn 
Can you please help me - if I put namespace in STRICT mode where kafka and zookeeper are, then kafka pods start throwing exceptions such as below. I checked tcpdump on 9092, it shows below dump having PLAINTEXT listener etc. But If I keep in PERMISSIVE MODE, everything works fine. 

tcpdump low
==========
06:52:25.564626 IP infra-kafka-1.infra-kafka-headless.infra.svc.cluster.local.60764 > infra-kafka-0.infra-kafka-headless.infra.svc.cluster.local.9092: Flags [P.], seq 1:446, ack 1, win 222, options [nop,nop,TS val 1354475978 ecr 4150797004], length 445
E.....@.@..0......
9.\#.....+..O....g......
P....h"............:..1002..............__consumer_offsets...%..............................................__consumer_offsets..................................................__consumer_offsets..............................................................#..(infra-kafka-0.infra-kafka-headless.infra.	PLAINTEXT..............#..(infra-kafka-1.infra-kafka-headless.infra.	PLAINTEXT..............#..(infra-kafka-2.infra-kafka-headless.infra.	PLAINTEXT....
06:52:25.564819 IP infra-kafka-0.infra-kafka-headless.infra.svc.cluster.local.9092 > infra-kafka-1.infra-kafka-headless.infra.svc.cluster.local.60764: Flags [.], ack 446, win 229, options [nop,nop,TS val 4150797140 ecr 1354475978], length 0
E..4..@.>.3...
9....#..\+..O.........@.....
.h#TP...
06:52:25.565029 IP infra-kafka-0.infra-kafka-headless.infra.svc.cluster.local.9092 > infra-kafka-1.infra-kafka-headless.infra.svc.cluster.local.60764: Flags [P.], seq 1:8, ack 446, win 229, options [nop,nop,TS val 4150797140 ecr 1354475978], length 7

kafka pod error
==============
java.io.IOException: Connection to 1003 was disconnected before the response was read
	at org.apache.kafka.clients.NetworkClientUtils.sendAndReceive(NetworkClientUtils.java:100)
	at kafka.server.ReplicaFetcherBlockingSend.sendRequest(ReplicaFetcherBlockingSend.scala:99)
	at kafka.server.ReplicaFetcherThread.fetchFromLeader(ReplicaFetcherThread.scala:192)
	at kafka.server.AbstractFetcherThread.kafka$server$AbstractFetcherThread$$processFetchRequest(AbstractFetcherThread.scala:274)
	at kafka.server.AbstractFetcherThread$$anonfun$maybeFetch$1.apply(AbstractFetcherThread.scala:132)
	at kafka.server.AbstractFetcherThread$$anonfun$maybeFetch$1.apply(AbstractFetcherThread.scala:131)
	at scala.Option.foreach(Option.scala:257)
	at kafka.server.AbstractFetcherThread.maybeFetch(AbstractFetcherThread.scala:131)
	at kafka.server.AbstractFetcherThread.doWork(AbstractFetcherThread.scala:113)
	at kafka.utils.ShutdownableThread.run(ShutdownableThread.scala:82)
[2020-08-27 06:53:00,275] INFO [ReplicaFetcher replicaId=1001, leaderId=1002, fetcherId=0] Error sending fetch request (sessionId=1878827350, epoch=INITIAL) to node 1002: java.io.IOException: Connection to 1002 was disconnected before the response was read. (org.apache.kafka.clients.FetchSessionHandler)

**Comment by satishmane** [comment]
@howardjohn 
If I do netstat -pa in kafka-0 pod proxy, then I see lot of TIME_WAIT connections. Is loopback connections getting blocked...?

tcp        0      0 localhost:15001         infra-kafka-0.inf:51038 TIME_WAIT   -                   
tcp        0      0 localhost:15001         infra-kafka-0.inf:52168 TIME_WAIT   -                   
tcp        0      0 localhost:15001         infra-kafka-0.inf:52346 TIME_WAIT   -                   
tcp        0      0 localhost:15001         infra-kafka-0.inf:38118 TIME_WAIT

**Comment by esnible** [comment]
There is a closed Zookeeper issue, see https://github.com/istio/istio/issues/14743 for background.

**Comment by satishmane** [comment]
Managed to resolve

**Comment by manpreet1992** [comment]
Hi @satishmane ,
     We are also facing the same issue. May i know how did you resolve this issue as i am struggling from past 4 days?

**Comment by Thnai** [comment]
@satishmane mind to share your solution?
