### ISSUE TITLE
The ingress gateway won't close the downstream connection when upstream backend server crashes

### ISSUE THREAD

**Issue by flyingyang** [istio/istio#36818]
### Bug Description

We had a client to list-watch to API server using HTTP 2.0 and for some reason the server restarted. The FIN packet (produced by server closing) only passed through to the ingress gateway and the ingress gateway didn't hand over the FIN packet to client. The client still believed the connection is established, but it won't receive any packets from the server. 

Based on the above phenomenon, we did some experiments to figure out this. 
For easily testing, we disable sidecar injection and don't configure any HTTP idle timeout in these two connections.
![image](https://user-images.githubusercontent.com/22345415/149298735-05fe748c-1f80-4b62-bf3d-4f9129cb95cc.png)
The client use HTTP 2.0 or HTTP 1.1 with Keep-Alive header to access server. After for a while, we kill the application process and observe the two connections. 
We found the upstream connection can be closed normally, but the downstream connection will be reserved because the ingress gateway didn't tell the client that server crashed. 

**According to our test, we believe the sidecar envoy can pass through the FIN packet but ingress gateway envoy can not.**

We do tcpdump on the ingress gateway node and get results listed below:
```
08:57:37.377633 IP 10.10.10.10.62108 > 10.20.20.20.8080: Flags [S], seq 3541859721, win 65535, options [mss 1086,nop,wscale 6,nop,nop,TS val 1431424447 ecr 0,sackOK,eol], length 0
08:57:37.377683 IP 10.20.20.20.8080 > 10.10.10.10.62108: Flags [S.], seq 2015933617, ack 3541859722, win 65160, options [mss 1460,sackOK,TS val 287268209 ecr 1431424447,nop,wscale 7], length 0
08:57:37.610415 IP 10.10.10.10.62108 > 10.20.20.20.8080: Flags [.], ack 1, win 2064, options [nop,nop,TS val 1431424676 ecr 287268209], length 0
08:57:37.611209 IP 10.10.10.10.62108 > 10.20.20.20.8080: Flags [P.], seq 1:229, ack 1, win 2064, options [nop,nop,TS val 1431424676 ecr 287268209], length 228: HTTP: GET / HTTP/1.1
08:57:37.611230 IP 10.20.20.20.8080 > 10.10.10.10.62108: Flags [.], ack 229, win 508, options [nop,nop,TS val 287268442 ecr 1431424676], length 0
08:57:37.611592 IP 10.20.20.20.46050 > 10.30.30.30.8080: Flags [S], seq 1754948961, win 64240, options [mss 1460,sackOK,TS val 814370055 ecr 0,nop,wscale 7], length 0
08:57:37.613273 IP 10.30.30.30.8080 > 10.20.20.20.46050: Flags [S.], seq 1714948868, ack 1754948962, win 65160, options [mss 1460,sackOK,TS val 1870209083 ecr 814370055,nop,wscale 7], length 0
08:57:37.613315 IP 10.20.20.20.46050 > 10.30.30.30.8080: Flags [.], ack 1, win 502, options [nop,nop,TS val 814370056 ecr 1870209083], length 0
08:57:37.613387 IP 10.20.20.20.46050 > 10.30.30.30.8080: Flags [P.], seq 1:242, ack 1, win 502, options [nop,nop,TS val 814370056 ecr 1870209083], length 241: HTTP
08:57:37.613590 IP 10.30.30.30.8080 > 10.20.20.20.46050: Flags [.], ack 242, win 508, options [nop,nop,TS val 1870209084 ecr 814370056], length 0
08:57:37.616947 IP 10.30.30.30.8080 > 10.20.20.20.46050: Flags [P.], seq 1:5590, ack 242, win 508, options [nop,nop,TS val 1870209088 ecr 814370056], length 5589: HTTP
08:57:37.616971 IP 10.20.20.20.46050 > 10.30.30.30.8080: Flags [.], ack 5590, win 479, options [nop,nop,TS val 814370060 ecr 1870209088], length 0
08:57:37.619442 IP 10.20.20.20.46050 > 10.30.30.30.8080: Flags [P.], seq 242:5730, ack 5590, win 501, options [nop,nop,TS val 814370062 ecr 1870209088], length 5488: HTTP
08:57:37.619760 IP 10.30.30.30.8080 > 10.20.20.20.46050: Flags [.], ack 5730, win 483, options [nop,nop,TS val 1870209091 ecr 814370062], length 0
08:57:37.620684 IP 10.30.30.30.8080 > 10.20.20.20.46050: Flags [P.], seq 5590:10968, ack 5730, win 501, options [nop,nop,TS val 1870209092 ecr 814370062], length 5378: HTTP
08:57:37.620703 IP 10.20.20.20.46050 > 10.30.30.30.8080: Flags [.], ack 10968, win 479, options [nop,nop,TS val 814370064 ecr 1870209092], length 0
08:57:37.621039 IP 10.20.20.20.46050 > 10.30.30.30.8080: Flags [P.], seq 5730:8302, ack 10968, win 501, options [nop,nop,TS val 814370064 ecr 1870209092], length 2572: HTTP
08:57:37.621245 IP 10.30.30.30.8080 > 10.20.20.20.46050: Flags [.], ack 8302, win 497, options [nop,nop,TS val 1870209092 ecr 814370064], length 0
08:57:37.621498 IP 10.30.30.30.8080 > 10.20.20.20.46050: Flags [P.], seq 10968:12096, ack 8302, win 501, options [nop,nop,TS val 1870209092 ecr 814370064], length 1128: HTTP
08:57:37.621511 IP 10.20.20.20.46050 > 10.30.30.30.8080: Flags [.], ack 12096, win 501, options [nop,nop,TS val 814370064 ecr 1870209092], length 0
08:57:37.621871 IP 10.30.30.30.8080 > 10.20.20.20.46050: Flags [P.], seq 12096:12376, ack 8302, win 501, options [nop,nop,TS val 1870209093 ecr 814370064], length 280: HTTP
08:57:37.621879 IP 10.20.20.20.46050 > 10.30.30.30.8080: Flags [.], ack 12376, win 501, options [nop,nop,TS val 814370065 ecr 1870209093], length 0
08:57:37.622444 IP 10.20.20.20.8080 > 10.10.10.10.62108: Flags [P.], seq 1:284, ack 229, win 508, options [nop,nop,TS val 287268453 ecr 1431424676], length 283: HTTP: HTTP/1.1 200 OK
08:57:37.856270 IP 10.10.10.10.62108 > 10.20.20.20.8080: Flags [.], ack 284, win 2059, options [nop,nop,TS val 1431424919 ecr 287268453], length 0
08:57:53.004357 IP 10.10.10.10.62108 > 10.20.20.20.8080: Flags [.], ack 284, win 2059, length 0
08:57:53.004373 IP 10.20.20.20.8080 > 10.10.10.10.62108: Flags [.], ack 229, win 508, options [nop,nop,TS val 287283835 ecr 1431424919], length 0
08:58:08.500918 IP 10.10.10.10.62108 > 10.20.20.20.8080: Flags [.], ack 284, win 2059, length 0
08:58:08.500929 IP 10.20.20.20.8080 > 10.10.10.10.62108: Flags [.], ack 229, win 508, options [nop,nop,TS val 287299332 ecr 1431424919], length 0
08:58:20.421068 IP 10.30.30.30.8080 > 10.20.20.20.46050: Flags [P.], seq 12376:12407, ack 8302, win 501, options [nop,nop,TS val 1870251891 ecr 814370065], length 31: HTTP
08:58:20.421094 IP 10.20.20.20.46050 > 10.30.30.30.8080: Flags [.], ack 12407, win 501, options [nop,nop,TS val 814412864 ecr 1870251891], length 0
08:58:20.421181 IP 10.20.20.20.46050 > 10.30.30.30.8080: Flags [P.], seq 8302:8333, ack 12407, win 501, options [nop,nop,TS val 814412864 ecr 1870251891], length 31: HTTP
08:58:20.421218 IP 10.20.20.20.46050 > 10.30.30.30.8080: Flags [F.], seq 8333, ack 12407, win 501, options [nop,nop,TS val 814412864 ecr 1870251891], length 0
08:58:20.421871 IP 10.30.30.30.8080 > 10.20.20.20.46050: Flags [.], ack 8302, win 501, options [nop,nop,TS val 1870251893 ecr 814412864,nop,nop,sack 1 {8333:8334}], length 0
08:58:20.421875 IP 10.30.30.30.8080 > 10.20.20.20.46050: Flags [.], ack 8334, win 501, options [nop,nop,TS val 1870251893 ecr 814412864], length 0
08:58:20.421918 IP 10.30.30.30.8080 > 10.20.20.20.46050: Flags [F.], seq 12407, ack 8334, win 501, options [nop,nop,TS val 1870251893 ecr 814412864], length 0
08:58:20.421948 IP 10.20.20.20.46050 > 10.30.30.30.8080: Flags [.], ack 12408, win 501, options [nop,nop,TS val 814412865 ecr 1870251893], length 0
08:58:24.308294 IP 10.10.10.10.62108 > 10.20.20.20.8080: Flags [.], ack 284, win 2059, length 0
08:58:24.308310 IP 10.20.20.20.8080 > 10.10.10.10.62108: Flags [.], ack 229, win 508, options [nop,nop,TS val 287315139 ecr 1431424919], length 0
08:58:39.850042 IP 10.10.10.10.62108 > 10.20.20.20.8080: Flags [.], ack 284, win 2059, length 0
08:58:39.850056 IP 10.20.20.20.8080 > 10.10.10.10.62108: Flags [.], ack 229, win 508, options [nop,nop,TS val 287330681 ecr 1431424919], length 0
08:58:55.308049 IP 10.10.10.10.62108 > 10.20.20.20.8080: Flags [.], ack 284, win 2059, length 0
08:58:55.308063 IP 10.20.20.20.8080 > 10.10.10.10.62108: Flags [.], ack 229, win 508, options [nop,nop,TS val 287346139 ecr 1431424919], length 0
```

### Version

```prose
istio version: 1.10
kubectl version: 1.18.8
```

**Comment by howardjohn** [comment]
The downstream connection is not expected to be closed. The http2 *stream* should be closed though

**Comment by flyingyang** [comment]
Thank @howardjohn  for reply. 
I have some questions there. 
1. "The downstream connection is not expected to be closed. ", that's means, the downstream connection and upstream connection can exist independently and the ingress gateway isn't responsible for closing downstream connection when upstream connection closed. Am I right? 
2. I'm confused about gateway behavior because the sidecar envoy can redirect all packet to the other side. In the istio env, I think client don't need to realize the gateway/sidecar existence. Is the running mode different between gateway and sidecar?

**Comment by shonecyx** [comment]
> The downstream connection is not expected to be closed. The http2 _stream_ should be closed though

@howardjohn  This behavior looks unfriendly to http2/streaming request, for example apiserver list-watch case. If the backend is apiserver pod and somehow it got killed/deleted, then the ingressgateway downstream connection will be always leaked unless we configure the downstream connection idle time out in ingressgateway, but the downside is that ingress gateway envoy will periodically kill the downstream connection.  

We'll explore if using consistentHash  DestinationRule can close both downstream and upstream connection for this case.

**Comment by howardjohn** [comment]
Your http2 client should handle the stream closing. a single http2
connections can multiple 100s of streams so it would not make sense for
typical case to close the connection just because one of these terminated

**Comment by shonecyx** [comment]
@howardjohn For below case client is using http2 
```
client --> ingressgateway --> apiserver pod
```
Assume the apiserver pod physical machine goes down and there is no idle timeout/keepalive configure in both client/server but configured the idle timeout/tcp keepalive in Ingressgateway through DestinationRule and based on our testing, only the ingressgatway upstream connection will be closed but the client to ingressgateway connection leaked.

Should IngressGateway close the downstream connections bound to the closed upstream connection too? Because no matter how many streams share that upstream connection,  they won't work any more.

**Comment by howardjohn** [comment]
No, the connection should not be closed, only the stream. One connection
could have 1000 of different upstream machines. You would not want a single
machine failing breaking every stream

**Comment by flyingyang** [comment]
> @flyingyang could you please share a sample GW/VS spec you were using?

The Gateway spec:
```
apiVersion: networking.istio.io/v1beta1
kind: Gateway
metadata:
  name: helloworld
  namespace: helloworld
spec:
  selector:
    istio: ingressgateway
  servers:
    - hosts:
        - helloworld.test.com
      port:
        name: http-helloworld
        number: 80
        protocol: HTTP
    - hosts:
        - helloworld.test.com
      port:
        name: https-helloworld
        number: 443
        protocol: HTTPS
      tls:
        minProtocolVersion: TLSV1_2
        mode: SIMPLE
```
The VS spec:
```
apiVersion: networking.istio.io/v1beta1
kind: VirtualService
metadata:
  name: helloworld
  namespace: helloworld
spec:
  gateways:
    - helloworld
  hosts:
    - helloworld.test.com
  http:
    - match:
        - port: 443
          uri:
            prefix: /
      route:
        - destination:
            host: helloworld.helloworld.svc.kubernetes.io
            port:
              number: 8080
    - match:
        - port: 80
          uri:
            prefix: /
      route:
        - destination:
            host: helloworld.helloworld.svc.kubernetes.io
            port:
              number: 8080
```

**Comment by l8huang** [comment]
see k8s [CHANGELOG-1.20.md](https://github.com/kubernetes/kubernetes/blob/master/CHANGELOG/CHANGELOG-1.20.md)

> HTTP/2 connection health check is enabled by default in all Kubernetes clients. The feature should work out-of-the-box. If needed, users can tune the feature via the HTTP2_READ_IDLE_TIMEOUT_SECONDS and HTTP2_PING_TIMEOUT_SECONDS environment variables. The feature is disabled if HTTP2_READ_IDLE_TIMEOUT_SECONDS is set to 0. (#95981, @caesarxuchao) [SIG API Machinery, CLI, Cloud Provider, Cluster Lifecycle, Instrumentation and Node]

**Comment by flyingyang** [comment]
@l8huang thank you for your advice.
I will have a try to enable HTTP/2 connection health check.

**Comment by shonecyx** [comment]
Thanks @howardjohn and @l8huang, I think this issue is the same as https://github.com/kubernetes/kubernetes/pull/95981.

I understand we can fix this either in client side(like introduce the HTTP/2 health check) or the server side(like configure the connection idle time out). But I wonder if is it possible to enhance in envoy side or even make the HTTP/2 health check configurable in Ingress gateway?

**Comment by thehackercat** [comment]
> Thanks @howardjohn and @l8huang, I think this issue is the same as [kubernetes/kubernetes#95981](https://github.com/kubernetes/kubernetes/pull/95981).
> 
> I understand we can fix this either in client side(like introduce the HTTP/2 health check) or the server side(like configure the connection idle time out). But I wonder if is it possible to enhance in envoy side or even make the HTTP/2 health check configurable in Ingress gateway?

yes, we have the same issue, wondering if there are anything we can do in ingress gateway side, such as a downstream stream timeout or something

**Comment by flyingyang** [comment]
I have enabled the HTTP2 health check in client side, but the health check can only take effect on the downstream connection. When we kill the server pod, the upstream connection is closed normally but the downstream connection keeps established and the HTTP2 health check keeps going on.

I think the HTTP2 health check will only work for the case that the client access to the server directly. 

Below is the tcpdump results. The ingress gateway did nothing when it received the server's FIN packet.
```
06:02:26.614360 IP 10.10.10.10.64197 > 10.20.20.20.8080: Flags [S], seq 1806436244, win 65535, options [mss 1086,nop,wscale 6,nop,nop,TS val 1140267755 ecr 0,sackOK,eol], length 0
06:02:26.614400 IP 10.20.20.20.8080 > 10.10.10.10.64197: Flags [S.], seq 768275571, ack 1806436245, win 65160, options [mss 1460,sackOK,TS val 2648991936 ecr 1140267755,nop,wscale 7], length 0
06:02:26.924024 IP 10.10.10.10.64197 > 10.20.20.20.8080: Flags [.], ack 1, win 2064, options [nop,nop,TS val 1140268059 ecr 2648991936], length 0
06:02:26.925725 IP 10.10.10.10.64197 > 10.20.20.20.8080: Flags [P.], seq 1:65, ack 1, win 2064, options [nop,nop,TS val 1140268059 ecr 2648991936], length 64: HTTP
06:02:26.925756 IP 10.20.20.20.8080 > 10.10.10.10.64197: Flags [.], ack 65, win 509, options [nop,nop,TS val 2648992248 ecr 1140268059], length 0
06:02:26.925778 IP 10.10.10.10.64197 > 10.20.20.20.8080: Flags [P.], seq 65:160, ack 1, win 2064, options [nop,nop,TS val 1140268059 ecr 2648991936], length 95: HTTP
06:02:26.925789 IP 10.20.20.20.8080 > 10.10.10.10.64197: Flags [.], ack 160, win 509, options [nop,nop,TS val 2648992248 ecr 1140268059], length 0
06:02:26.925842 IP 10.20.20.20.8080 > 10.10.10.10.64197: Flags [P.], seq 1:56, ack 160, win 509, options [nop,nop,TS val 2648992248 ecr 1140268059], length 55: HTTP
06:02:26.926149 IP 10.20.20.20.37048 > 10.30.30.30.8080: Flags [S], seq 4145059168, win 64240, options [mss 1460,sackOK,TS val 1732707580 ecr 0,nop,wscale 7], length 0
06:02:26.927318 IP 10.30.30.30.8080 > 10.20.20.20.37048: Flags [S.], seq 1462301914, ack 4145059169, win 65160, options [mss 1460,sackOK,TS val 887100968 ecr 1732707580,nop,wscale 7], length 0
06:02:26.927345 IP 10.20.20.20.37048 > 10.30.30.30.8080: Flags [.], ack 1, win 502, options [nop,nop,TS val 1732707581 ecr 887100968], length 0
06:02:26.927558 IP 10.20.20.20.37048 > 10.30.30.30.8080: Flags [P.], seq 1:5586, ack 1, win 502, options [nop,nop,TS val 1732707581 ecr 887100968], length 5585: HTTP
06:02:26.927764 IP 10.30.30.30.8080 > 10.20.20.20.37048: Flags [.], ack 5586, win 485, options [nop,nop,TS val 887100969 ecr 1732707581], length 0
06:02:26.928477 IP 10.30.30.30.8080 > 10.20.20.20.37048: Flags [P.], seq 1:174, ack 5586, win 501, options [nop,nop,TS val 887100970 ecr 1732707581], length 173: HTTP
06:02:26.928489 IP 10.20.20.20.37048 > 10.30.30.30.8080: Flags [.], ack 174, win 501, options [nop,nop,TS val 1732707582 ecr 887100970], length 0
06:02:26.928589 IP 10.20.20.20.37048 > 10.30.30.30.8080: Flags [P.], seq 5586:5637, ack 174, win 501, options [nop,nop,TS val 1732707583 ecr 887100970], length 51: HTTP
06:02:26.928743 IP 10.20.20.20.37048 > 10.30.30.30.8080: Flags [P.], seq 5637:8209, ack 174, win 501, options [nop,nop,TS val 1732707583 ecr 887100970], length 2572: HTTP
06:02:26.928751 IP 10.30.30.30.8080 > 10.20.20.20.37048: Flags [.], ack 5637, win 501, options [nop,nop,TS val 887100970 ecr 1732707583], length 0
06:02:26.928900 IP 10.30.30.30.8080 > 10.20.20.20.37048: Flags [.], ack 8209, win 497, options [nop,nop,TS val 887100970 ecr 1732707583], length 0
06:02:26.929159 IP 10.30.30.30.8080 > 10.20.20.20.37048: Flags [P.], seq 174:1301, ack 8209, win 501, options [nop,nop,TS val 887100970 ecr 1732707583], length 1127: HTTP
06:02:26.929171 IP 10.20.20.20.37048 > 10.30.30.30.8080: Flags [.], ack 1301, win 501, options [nop,nop,TS val 1732707583 ecr 887100970], length 0
06:02:26.929891 IP 10.30.30.30.8080 > 10.20.20.20.37048: Flags [P.], seq 1301:1557, ack 8209, win 501, options [nop,nop,TS val 887100971 ecr 1732707583], length 256: HTTP
06:02:26.929901 IP 10.20.20.20.37048 > 10.30.30.30.8080: Flags [.], ack 1557, win 501, options [nop,nop,TS val 1732707584 ecr 887100971], length 0
06:02:26.930447 IP 10.20.20.20.8080 > 10.10.10.10.64197: Flags [P.], seq 56:277, ack 160, win 509, options [nop,nop,TS val 2648992252 ecr 1140268059], length 221: HTTP
06:02:27.142592 IP 10.10.10.10.64197 > 10.20.20.20.8080: Flags [.], ack 56, win 2063, options [nop,nop,TS val 1140268282 ecr 2648992248], length 0
06:02:27.145201 IP 10.10.10.10.64197 > 10.20.20.20.8080: Flags [P.], seq 160:169, ack 56, win 2063, options [nop,nop,TS val 1140268282 ecr 2648992248], length 9: HTTP
06:02:27.145212 IP 10.20.20.20.8080 > 10.10.10.10.64197: Flags [.], ack 169, win 509, options [nop,nop,TS val 2648992467 ecr 1140268282], length 0
06:02:27.148406 IP 10.10.10.10.64197 > 10.20.20.20.8080: Flags [.], ack 277, win 2059, options [nop,nop,TS val 1140268287 ecr 2648992252], length 0
06:02:37.151750 IP 10.10.10.10.64197 > 10.20.20.20.8080: Flags [P.], seq 169:186, ack 277, win 2059, options [nop,nop,TS val 1140278236 ecr 2648992467], length 17: HTTP
06:02:37.151768 IP 10.20.20.20.8080 > 10.10.10.10.64197: Flags [.], ack 186, win 509, options [nop,nop,TS val 2649002474 ecr 1140278236], length 0
06:02:37.151834 IP 10.20.20.20.8080 > 10.10.10.10.64197: Flags [P.], seq 277:294, ack 186, win 509, options [nop,nop,TS val 2649002474 ecr 1140278236], length 17: HTTP
06:02:37.472350 IP 10.10.10.10.64197 > 10.20.20.20.8080: Flags [.], ack 294, win 2059, options [nop,nop,TS val 1140278552 ecr 2649002474], length 0
06:02:47.478827 IP 10.10.10.10.64197 > 10.20.20.20.8080: Flags [P.], seq 186:203, ack 294, win 2059, options [nop,nop,TS val 1140288508 ecr 2649002474], length 17: HTTP
06:02:47.478845 IP 10.20.20.20.8080 > 10.10.10.10.64197: Flags [.], ack 203, win 509, options [nop,nop,TS val 2649012801 ecr 1140288508], length 0
06:02:47.478923 IP 10.20.20.20.8080 > 10.10.10.10.64197: Flags [P.], seq 294:311, ack 203, win 509, options [nop,nop,TS val 2649012801 ecr 1140288508], length 17: HTTP
06:02:47.806517 IP 10.10.10.10.64197 > 10.20.20.20.8080: Flags [.], ack 311, win 2059, options [nop,nop,TS val 1140288841 ecr 2649012801], length 0
06:02:57.813415 IP 10.10.10.10.64197 > 10.20.20.20.8080: Flags [P.], seq 203:220, ack 311, win 2059, options [nop,nop,TS val 1140298795 ecr 2649012801], length 17: HTTP
06:02:57.813430 IP 10.20.20.20.8080 > 10.10.10.10.64197: Flags [.], ack 220, win 509, options [nop,nop,TS val 2649023135 ecr 1140298795], length 0
06:02:57.813488 IP 10.20.20.20.8080 > 10.10.10.10.64197: Flags [P.], seq 311:328, ack 220, win 509, options [nop,nop,TS val 2649023135 ecr 1140298795], length 17: HTTP
06:02:58.030388 IP 10.10.10.10.64197 > 10.20.20.20.8080: Flags [.], ack 328, win 2058, options [nop,nop,TS val 1140299017 ecr 2649023135], length 0
06:02:59.859302 IP 10.30.30.30.8080 > 10.20.20.20.55054: Flags [P.], seq 1696491995:1696492026, ack 4202568750, win 501, options [nop,nop,TS val 887133900 ecr 1732244067], length 31: HTTP
06:02:59.859337 IP 10.20.20.20.55054 > 10.30.30.30.8080: Flags [.], ack 31, win 501, options [nop,nop,TS val 1732740513 ecr 887133900], length 0
06:02:59.859371 IP 10.30.30.30.8080 > 10.20.20.20.37048: Flags [P.], seq 1557:1588, ack 8209, win 501, options [nop,nop,TS val 887133900 ecr 1732707584], length 31: HTTP
06:02:59.859390 IP 10.20.20.20.37048 > 10.30.30.30.8080: Flags [.], ack 1588, win 501, options [nop,nop,TS val 1732740513 ecr 887133900], length 0
06:02:59.859404 IP 10.20.20.20.55054 > 10.30.30.30.8080: Flags [P.], seq 1:32, ack 31, win 501, options [nop,nop,TS val 1732740513 ecr 887133900], length 31: HTTP
06:02:59.859437 IP 10.20.20.20.55054 > 10.30.30.30.8080: Flags [F.], seq 32, ack 31, win 501, options [nop,nop,TS val 1732740513 ecr 887133900], length 0
06:02:59.859478 IP 10.20.20.20.37048 > 10.30.30.30.8080: Flags [P.], seq 8209:8240, ack 1588, win 501, options [nop,nop,TS val 1732740513 ecr 887133900], length 31: HTTP
06:02:59.859505 IP 10.20.20.20.37048 > 10.30.30.30.8080: Flags [F.], seq 8240, ack 1588, win 501, options [nop,nop,TS val 1732740513 ecr 887133900], length 0
06:02:59.860220 IP 10.30.30.30.8080 > 10.20.20.20.37048: Flags [.], ack 8240, win 501, options [nop,nop,TS val 887133901 ecr 1732740513], length 0
06:02:59.860219 IP 10.30.30.30.8080 > 10.20.20.20.55054: Flags [.], ack 32, win 501, options [nop,nop,TS val 887133901 ecr 1732740513], length 0
06:02:59.860301 IP 10.30.30.30.8080 > 10.20.20.20.55054: Flags [F.], seq 31, ack 33, win 501, options [nop,nop,TS val 887133901 ecr 1732740513], length 0
06:02:59.860318 IP 10.20.20.20.55054 > 10.30.30.30.8080: Flags [.], ack 32, win 501, options [nop,nop,TS val 1732740514 ecr 887133901], length 0
06:02:59.875556 IP 10.30.30.30.8080 > 10.20.20.20.37048: Flags [F.], seq 1588, ack 8241, win 501, options [nop,nop,TS val 887133917 ecr 1732740513], length 0
06:02:59.875584 IP 10.20.20.20.37048 > 10.30.30.30.8080: Flags [.], ack 1589, win 501, options [nop,nop,TS val 1732740529 ecr 887133917], length 0
06:03:08.037948 IP 10.10.10.10.64197 > 10.20.20.20.8080: Flags [P.], seq 220:237, ack 328, win 2058, options [nop,nop,TS val 1140308959 ecr 2649023135], length 17: HTTP
06:03:08.038043 IP 10.20.20.20.8080 > 10.10.10.10.64197: Flags [P.], seq 328:345, ack 237, win 509, options [nop,nop,TS val 2649033360 ecr 1140308959], length 17: HTTP
06:03:08.256476 IP 10.10.10.10.64197 > 10.20.20.20.8080: Flags [.], ack 345, win 2058, options [nop,nop,TS val 1140309182 ecr 2649033360], length 0
06:03:18.258231 IP 10.10.10.10.64197 > 10.20.20.20.8080: Flags [P.], seq 237:254, ack 345, win 2058, options [nop,nop,TS val 1140319137 ecr 2649033360], length 17: HTTP
06:03:18.258323 IP 10.20.20.20.8080 > 10.10.10.10.64197: Flags [P.], seq 345:362, ack 254, win 509, options [nop,nop,TS val 2649043580 ecr 1140319137], length 17: HTTP
06:03:18.527335 IP 10.10.10.10.64197 > 10.20.20.20.8080: Flags [.], ack 362, win 2058, options [nop,nop,TS val 1140319407 ecr 2649043580], length 0
```

**Comment by shonecyx** [comment]
@howardjohn  So it means even client side HTTP/2 health check won't work for this case because gateway is responding the HTTP/2 ping check but not forwarding it to the backend. Looks like something we can enhance in IngressGateway, for example:
1. Forward the HTTP/2 heath check to upstream
2. Close the downstream connection if upstream HTTP/2 heath check failed
3. Support to configure both downstream/upstream stream connection idle time out?

**Comment by howardjohn** [comment]
My understanding is when the downstream closes, Envoy should *not* close the connection, but it should close the stream. If its not doing that it seems like a bug in Envoy? @ramaraochavali @lambdai

**Comment by lambdai** [comment]
@howardjohn Right. Upstream and downstream connection life time should be independent. 

I don't see a violation in this long thread. Could you elaborate the seen bug?

**Comment by lambdai** [comment]
> We found the upstream connection can be closed normally,

It's probably because the http protocol between gw and sidecar is http1.
http1 doesn't guarantee proprogate FIN either. It's your tested behavior happens to not recoverable by sidecar proxy.The  FIN is used by the sidecar proxy to interrupt the http1 between gw and sidecar proxy.

**Comment by flyingyang** [comment]
I have done some more tests of HTTP2 connection. 
1. Delete the pod while the server is handling the request.
The client get a STREAM ERROR from ingress gateway.
`stream error: stream ID 3; NO_ERROR; received from peer`
2. Set the server pod's network interface down while the server is handling the request.
- If we don't configure tcp keepalive through the DestinationRule, the client won't receive any information. 
- If we configure tcp keepalive through the DestinationRule, the client will receive a STREAM ERROR after `timeout + probes * interval` seconds. The HTTP idle timeout is invalid in this scenario. 
`stream error: stream ID 3; NO_ERROR; received from peer`

I don't know if my HTTP2 stream usage is correct, so I paste my server code here. 
```
package main
import (
	"context"
	"flag"
	"fmt"
	"golang.org/x/net/http2"
	"golang.org/x/net/http2/h2c"
	"log"
	"net"
	"net/http"
	"os"
	"time"
)

var (
	readTimeout time.Duration
	writeTimeout time.Duration
	idleTimeout time.Duration
	tcpKeepAlive time.Duration
	defaultTimeout = 10000 * time.Second
)

func main() {
	flag.DurationVar(&readTimeout, "r", defaultTimeout, "HTTP read timeout")
	flag.DurationVar(&writeTimeout, "w", defaultTimeout, "HTTP write timeout")
	flag.DurationVar(&idleTimeout, "i", defaultTimeout, "HTTP idle timeout")
	flag.DurationVar(&tcpKeepAlive, "t", 15 * time.Second, "TCP keep alive")
	flag.Parse()
	if readTimeout == defaultTimeout || writeTimeout == defaultTimeout || idleTimeout == defaultTimeout {
		flag.Usage()
		os.Exit(-1)
	}
	addr := "0.0.0.0:8080"
	fmt.Printf("parameters are ready. run http server on %s...", addr)

	h2s := &http2.Server{}

	handler := http.HandlerFunc(func(w http.ResponseWriter, req *http.Request) {
		flusher, ok := w.(http.Flusher)
		if !ok {
			panic("expected http.ResponseWriter to be an http.Flusher")
		}
		w.Header().Set("Connection", "Keep-Alive")
		//w.Header().Set("Transfer-Encoding", "chunked")
		w.Header().Set("X-Content-Type-Options", "nosniff")

		fmt.Printf("received %v to access %v, proto: %v", req.Host, req.URL, req.Proto)
		msg := fmt.Sprintf("received %s information.", req.Host + req.URL.String())
		//w.Header().Set("Connection", "Keep-Alive")
		for i := 0; i < 10; i ++ {
			_, err := w.Write([]byte(msg))
			if err != nil {
				os.Exit(-1)
			}
			flusher.Flush()
			time.Sleep(10 * time.Second)
		}
	})

	srv := &http.Server{
		Addr: addr,
		ReadTimeout:  readTimeout,
		WriteTimeout: writeTimeout,
		IdleTimeout: idleTimeout,
		Handler: h2c.NewHandler(handler, h2s),
	}

	//http2.ConfigureServer(srv, &http2.Server{})

	lc := net.ListenConfig{KeepAlive: tcpKeepAlive}

	ln, err := lc.Listen(context.Background(), "tcp", addr)
	if err != nil {
		fmt.Printf("net.Listen error: %v", err)
		os.Exit(-1)
	}
	log.Fatal(srv.Serve(ln))
}

**Comment by shonecyx** [comment]
> @howardjohn Right. Upstream and downstream connection life time should be independent.
> 
> I don't see a violation in this long thread. Could you elaborate the seen bug?

@lambdai  There are two issues there for below scenario(sidecar is not involved to simplify the case).
```
client --> ingressgateway --> apiserver pod
```
Let's assume there is no idle timeout in both client and server and they are using HTTP/2.
1. If the apiserver pod is gone, then the client watch request will stuck forever because there is only one list-watch call from the client then it will keep waiting for server to push event.  Then if we introduce the upstream connection idle timeout and tcp keepalive in the ingressgateway, the gateway will close the upstream connection after the time out but downstream connection will still leak.
2. If we introduce the HTTP/2 ping check in client side, it's the ingressgateway responding the HTTP/2 ping check so it will still not able to know if apiserver pod is live or not.

This is not only for the list-watch case but also for other streaming/HTTP 2 cases, for example we'll run into this issue for downloading case from a storage service behind the ingressgateway.

**Comment by thehackercat** [comment]
@flyingyang Hi we have the same issue, but have difficulty reproducing it. How did  you reproduce this bug?

**Comment by flyingyang** [comment]
> @flyingyang Hi we have the same issue, but have difficulty reproducing it. How did you reproduce this bug?

Sorry for replying late.
I didn't reproduce this bug in real cluster because the production flow. 
I just wrote a go http client and go http server to simulate the behavior.

**Comment by norru** [comment]
I have the exact opposite problem, I've got a server event stream which never ends. When a client terminates, its connection downstream drops but upstream doesn't close the connection so I get an upstream leak for each new client connection.

- Accessing the application directly (no Envoy in between) causes the server to correctly and gracefully detect FIN, end the event stream and close the connection.
- I am using HTTP/1.1 and one connection per request (as it's supposed to only end when the client closes it).
- "Connection: close" doesn't make any difference.
- I can recreate with just one instance of the server and one single client.
- Each additional client creates a new downstream connection and a new upstream connection.
- Every time a client terminates, downstream connection terminates but upstream leaks.
- Restarting ingress releases all the upstream connections at once.

I have little experience with Istio and Envoy as I've adopted them recently. Problem looks very similar. Any suggestions?

**Comment by norru** [comment]
@flyingyang @thehackercat @howardjohn @lambdai sorry to bother you all, but how was this problem solved in the end?

**Comment by shonecyx** [comment]
@norru  You can try to config the upstream connection idle timeout which is managed by DestinationRule. FYI https://github.com/istio/istio/issues/22073#issuecomment-836255790

**Comment by norru** [comment]
Not sure I understand. What value of idleTime should I specify for "close when the downstream dies"? I want the upstream to be active forever *until* the client side closes it.

**Comment by costinm** [comment]
To clarify - the connection was active, with a long-lived request, not idle ? If yes, it would be a serious bug.

**Comment by norru** [comment]
@costinm yes, the connection was active and not idle.

The app detects the close correctly if ran in isolation (no Envoy between client and server). 

I have performed a packet capture and indeed it appears that neither the FIN nor the RST are never propagated upstream. 

Killing the ingress pod clears the leak as upstream connections terminate.

**Comment by costinm** [comment]
Are you using h2 or h1 ? Can you attach the tcpdump ?

Spent a lot of time debugging connection and streams closing - it can be very bad for certain apps to not detect close.

**Comment by norru** [comment]
This specific application uses HTTP/1.1. I have a capture, will attach as soon as I get back to my work PC.

**Comment by norru** [comment]
I've done two fresh captures from the ingress pod.

This happens when accessing the ingress endpoint from a pod. It looks like FIN flags get forwarded, client gets manually terminated after 4 seconds, the application detects the F and there are no leaks. No RST packets.

```
10:26:42.224547 IP 10.140.136.158.33808 > 10.1.78.78.443: Flags [S], seq 756184649, win 62727, options [mss 8961,sackOK,TS val 509318107 ecr 0,nop,wscale 7], length 0
10:26:42.224588 IP 10.1.78.78.443 > 10.140.136.158.33808: Flags [S.], seq 2164082539, ack 756184650, win 62643, options [mss 8961,sackOK,TS val 740502025 ecr 509318107,nop,wscale 7], length 0
10:26:42.225748 IP 10.140.136.158.33808 > 10.1.78.78.443: Flags [.], ack 1, win 491, options [nop,nop,TS val 509318109 ecr 740502025], length 0
10:26:42.225830 IP 10.140.136.158.33808 > 10.1.78.78.443: Flags [P.], seq 1:767, ack 1, win 491, options [nop,nop,TS val 509318109 ecr 740502025], length 766
10:26:42.225846 IP 10.1.78.78.443 > 10.140.136.158.33808: Flags [.], ack 767, win 484, options [nop,nop,TS val 740502026 ecr 509318109], length 0
10:26:42.263633 IP 10.1.78.78.443 > 10.140.136.158.33808: Flags [P.], seq 1:320, ack 767, win 484, options [nop,nop,TS val 740502064 ecr 509318109], length 319
10:26:42.264875 IP 10.140.136.158.33808 > 10.1.78.78.443: Flags [.], ack 320, win 489, options [nop,nop,TS val 509318148 ecr 740502064], length 0
10:26:43.263874 IP 10.1.78.78.443 > 10.140.136.158.33808: Flags [P.], seq 320:421, ack 767, win 484, options [nop,nop,TS val 740503064 ecr 509318148], length 101
10:26:43.265108 IP 10.140.136.158.33808 > 10.1.78.78.443: Flags [.], ack 421, win 489, options [nop,nop,TS val 509319148 ecr 740503064], length 0
10:26:44.264364 IP 10.1.78.78.443 > 10.140.136.158.33808: Flags [P.], seq 421:522, ack 767, win 484, options [nop,nop,TS val 740504065 ecr 509319148], length 101
10:26:44.265644 IP 10.140.136.158.33808 > 10.1.78.78.443: Flags [.], ack 522, win 489, options [nop,nop,TS val 509320148 ecr 740504065], length 0
10:26:45.264698 IP 10.1.78.78.443 > 10.140.136.158.33808: Flags [P.], seq 522:623, ack 767, win 484, options [nop,nop,TS val 740505065 ecr 509320148], length 101
10:26:45.265998 IP 10.140.136.158.33808 > 10.1.78.78.443: Flags [.], ack 623, win 489, options [nop,nop,TS val 509321149 ecr 740505065], length 0
10:26:45.462371 IP 10.140.136.158.33808 > 10.1.78.78.443: Flags [F.], seq 767, ack 623, win 489, options [nop,nop,TS val 509321345 ecr 740505065], length 0
10:26:45.462444 IP 10.1.78.78.443 > 10.140.136.158.33808: Flags [F.], seq 623, ack 768, win 484, options [nop,nop,TS val 740505263 ecr 509321345], length 0
10:26:45.463601 IP 10.140.136.158.33808 > 10.1.78.78.443: Flags [.], ack 624, win 489, options [nop,nop,TS val 509321346 ecr 740505263], length 0
```

This is what happens when the same endpoint is invoked through an ELB which is hooked to the ingress's exposed EKS Service. It seems that some port redirection is undergoing (but I can't figure out the details at a first glance, need more staring at screen). 

Client is terminated after 4 seconds but no FIN or RST so the server keeps sending forever. It looks like more investigation required on the ELB and Service side.

```
10:23:55.139869 IP 10.1.64.49.28163 > 10.1.78.78.443: Flags [S], seq 2382010941, win 26883, options [mss 8961,sackOK,TS val 3552951279 ecr 0,nop,wscale 8], length 0
10:23:55.139910 IP 10.1.78.78.443 > 10.1.64.49.28163: Flags [S.], seq 506633701, ack 2382010942, win 62643, options [mss 8961,sackOK,TS val 3655262490 ecr 3552951279,nop,wscale 7], length 0
10:23:55.139872 IP 10.1.64.49.2717 > 10.1.78.78.443: Flags [P.], seq 1:870, ack 1, win 106, options [nop,nop,TS val 3552951279 ecr 3655219952], length 869
10:23:55.139925 IP 10.1.78.78.443 > 10.1.64.49.2717: Flags [.], ack 870, win 483, options [nop,nop,TS val 3655262490 ecr 3552951279], length 0
10:23:55.139960 IP 10.1.64.49.39083 > 10.1.78.78.443: Flags [S], seq 3424413651, win 26883, options [mss 8961,sackOK,TS val 3552951279 ecr 0,nop,wscale 8], length 0
10:23:55.139978 IP 10.1.78.78.443 > 10.1.64.49.39083: Flags [S.], seq 908416415, ack 3424413652, win 62643, options [mss 8961,sackOK,TS val 3655262490 ecr 3552951279,nop,wscale 7], length 0
10:23:55.140188 IP 10.1.64.49.28163 > 10.1.78.78.443: Flags [.], ack 1, win 106, options [nop,nop,TS val 3552951280 ecr 3655262490], length 0
10:23:55.140215 IP 10.1.64.49.39083 > 10.1.78.78.443: Flags [.], ack 1, win 106, options [nop,nop,TS val 3552951280 ecr 3655262490], length 0
10:23:55.641193 IP 10.1.78.78.443 > 10.1.64.49.2717: Flags [P.], seq 1:321, ack 870, win 483, options [nop,nop,TS val 3655262991 ecr 3552951279], length 320
10:23:55.641623 IP 10.1.64.49.2717 > 10.1.78.78.443: Flags [.], ack 321, win 110, options [nop,nop,TS val 3552951781 ecr 3655262991], length 0
10:23:56.641393 IP 10.1.78.78.443 > 10.1.64.49.2717: Flags [P.], seq 321:422, ack 870, win 483, options [nop,nop,TS val 3655263992 ecr 3552951781], length 101
10:23:56.641713 IP 10.1.64.49.2717 > 10.1.78.78.443: Flags [.], ack 422, win 110, options [nop,nop,TS val 3552952781 ecr 3655263992], length 0
10:23:57.641533 IP 10.1.78.78.443 > 10.1.64.49.2717: Flags [P.], seq 422:523, ack 870, win 483, options [nop,nop,TS val 3655264992 ecr 3552952781], length 101
10:23:57.641855 IP 10.1.64.49.2717 > 10.1.78.78.443: Flags [.], ack 523, win 110, options [nop,nop,TS val 3552953781 ecr 3655264992], length 0
10:23:58.642010 IP 10.1.78.78.443 > 10.1.64.49.2717: Flags [P.], seq 523:624, ack 870, win 483, options [nop,nop,TS val 3655265992 ecr 3552953781], length 101
10:23:58.642357 IP 10.1.64.49.2717 > 10.1.78.78.443: Flags [.], ack 624, win 110, options [nop,nop,TS val 3552954782 ecr 3655265992], length 0
10:23:59.642166 IP 10.1.78.78.443 > 10.1.64.49.2717: Flags [P.], seq 624:725, ack 870, win 483, options [nop,nop,TS val 3655266992 ecr 3552954782], length 101
10:23:59.642498 IP 10.1.64.49.2717 > 10.1.78.78.443: Flags [.], ack 725, win 110, options [nop,nop,TS val 3552955782 ecr 3655266992], length 0
10:24:00.642584 IP 10.1.78.78.443 > 10.1.64.49.2717: Flags [P.], seq 725:826, ack 870, win 483, options [nop,nop,TS val 3655267993 ecr 3552955782], length 101
10:24:00.642911 IP 10.1.64.49.2717 > 10.1.78.78.443: Flags [.], ack 826, win 110, options [nop,nop,TS val 3552956782 ecr 3655267993], length 0
10:24:01.643522 IP 10.1.78.78.443 > 10.1.64.49.2717: Flags [P.], seq 826:927, ack 870, win 483, options [nop,nop,TS val 3655268994 ecr 3552956782], length 101
10:24:01.644922 IP 10.1.64.49.2717 > 10.1.78.78.443: Flags [.], ack 927, win 110, options [nop,nop,TS val 3552957784 ecr 3655268994], length 0
10:24:02.643676 IP 10.1.78.78.443 > 10.1.64.49.2717: Flags [P.], seq 927:1028, ack 870, win 483, options [nop,nop,TS val 3655269994 ecr 3552957784], length 101
10:24:02.644083 IP 10.1.64.49.2717 > 10.1.78.78.443: Flags [.], ack 1028, win 110, options [nop,nop,TS val 3552958784 ecr 3655269994], length 0
10:24:03.644328 IP 10.1.78.78.443 > 10.1.64.49.2717: Flags [P.], seq 1028:1129, ack 870, win 483, options [nop,nop,TS val 3655270995 ecr 3552958784], length 101
10:24:03.644648 IP 10.1.64.49.2717 > 10.1.78.78.443: Flags [.], ack 1129, win 110, options [nop,nop,TS val 3552959784 ecr 3655270995], length 0
10:24:04.644447 IP 10.1.78.78.443 > 10.1.64.49.2717: Flags [P.], seq 1129:1230, ack 870, win 483, options [nop,nop,TS val 3655271995 ecr 3552959784], length 101
10:24:04.644860 IP 10.1.64.49.2717 > 10.1.78.78.443: Flags [.], ack 1230, win 110, options [nop,nop,TS val 3552960784 ecr 3655271995], length 0
```

**Comment by norru** [comment]
Same capture, upstream (on the pod running the app)

```
10:59:15.273592 IP 10.1.78.78.51948 > 10.1.78.161.8080: Flags [P.], seq 2835649910:2835652172, ack 1730510697, win 488, options [nop,nop,TS val 2005832176 ecr 1835532650], length 2262: HTTP
10:59:15.273615 IP 10.1.78.161.8080 > 10.1.78.78.51948: Flags [.], ack 2262, win 442, options [nop,nop,TS val 1836075758 ecr 2005832176], length 0
10:59:15.777443 IP 10.1.78.161.8080 > 10.1.78.78.51948: Flags [P.], seq 1:1362, ack 2262, win 442, options [nop,nop,TS val 1836076262 ecr 2005832176], length 1361: HTTP
10:59:15.777490 IP 10.1.78.78.51948 > 10.1.78.161.8080: Flags [.], ack 1362, win 478, options [nop,nop,TS val 2005832680 ecr 1836076262], length 0
10:59:16.777729 IP 10.1.78.161.8080 > 10.1.78.78.51948: Flags [P.], seq 1362:1494, ack 2262, win 442, options [nop,nop,TS val 1836077262 ecr 2005832680], length 132: HTTP
10:59:16.777774 IP 10.1.78.78.51948 > 10.1.78.161.8080: Flags [.], ack 1494, win 477, options [nop,nop,TS val 2005833680 ecr 1836077262], length 0
10:59:17.778117 IP 10.1.78.161.8080 > 10.1.78.78.51948: Flags [P.], seq 1494:1626, ack 2262, win 442, options [nop,nop,TS val 1836078262 ecr 2005833680], length 132: HTTP
10:59:17.778162 IP 10.1.78.78.51948 > 10.1.78.161.8080: Flags [.], ack 1626, win 476, options [nop,nop,TS val 2005834680 ecr 1836078262], length 0
10:59:18.637271 IP 10.1.78.78.51948 > 10.1.78.161.8080: Flags [P.], seq 2262:2293, ack 1626, win 476, options [nop,nop,TS val 2005835539 ecr 1836078262], length 31: HTTP
10:59:18.637285 IP 10.1.78.161.8080 > 10.1.78.78.51948: Flags [.], ack 2293, win 442, options [nop,nop,TS val 1836079121 ecr 2005835539], length 0
10:59:18.637315 IP 10.1.78.78.51948 > 10.1.78.161.8080: Flags [F.], seq 2293, ack 1626, win 476, options [nop,nop,TS val 2005835539 ecr 1836079121], length 0
10:59:18.637368 IP 10.1.78.161.8080 > 10.1.78.78.51948: Flags [P.], seq 1626:1657, ack 2294, win 442, options [nop,nop,TS val 1836079122 ecr 2005835539], length 31: HTTP
10:59:18.637407 IP 10.1.78.78.51948 > 10.1.78.161.8080: Flags [R], seq 2835652204, win 0, length 0
```

And with the client hitting the Ingress via ELB:
```
11:00:34.126446 IP 10.1.78.78.33416 > 10.1.78.161.8080: Flags [S], seq 4153605219, win 62727, options [mss 8961,sackOK,TS val 2005911029 ecr 0,nop,wscale 7], length 0
11:00:34.126465 IP 10.1.78.161.8080 > 10.1.78.78.33416: Flags [S.], seq 3258685861, ack 4153605220, win 62643, options [mss 8961,sackOK,TS val 1836154611 ecr 2005911029,nop,wscale 7], length 0
11:00:34.126484 IP 10.1.78.78.33416 > 10.1.78.161.8080: Flags [.], ack 1, win 491, options [nop,nop,TS val 2005911029 ecr 1836154611], length 0
11:00:34.126634 IP 10.1.78.78.33416 > 10.1.78.161.8080: Flags [P.], seq 1:2058, ack 1, win 491, options [nop,nop,TS val 2005911029 ecr 1836154611], length 2057: HTTP
11:00:34.126649 IP 10.1.78.161.8080 > 10.1.78.78.33416: Flags [.], ack 2058, win 474, options [nop,nop,TS val 1836154611 ecr 2005911029], length 0
11:00:34.126876 IP 10.1.78.161.8080 > 10.1.78.78.33416: Flags [P.], seq 1:148, ack 2058, win 474, options [nop,nop,TS val 1836154611 ecr 2005911029], length 147: HTTP
11:00:34.126914 IP 10.1.78.78.33416 > 10.1.78.161.8080: Flags [.], ack 148, win 490, options [nop,nop,TS val 2005911029 ecr 1836154611], length 0
11:00:34.126982 IP 10.1.78.78.33416 > 10.1.78.161.8080: Flags [P.], seq 2058:2109, ack 148, win 490, options [nop,nop,TS val 2005911029 ecr 1836154611], length 51: HTTP
11:00:34.126987 IP 10.1.78.161.8080 > 10.1.78.78.33416: Flags [.], ack 2109, win 474, options [nop,nop,TS val 1836154611 ecr 2005911029], length 0
11:00:34.127115 IP 10.1.78.78.33416 > 10.1.78.161.8080: Flags [P.], seq 2109:4416, ack 148, win 490, options [nop,nop,TS val 2005911029 ecr 1836154611], length 2307: HTTP
11:00:34.127120 IP 10.1.78.161.8080 > 10.1.78.78.33416: Flags [.], ack 4416, win 456, options [nop,nop,TS val 1836154611 ecr 2005911029], length 0
11:00:34.798790 IP 10.1.78.161.8080 > 10.1.78.78.33416: Flags [P.], seq 148:1509, ack 4416, win 456, options [nop,nop,TS val 1836155283 ecr 2005911029], length 1361: HTTP
11:00:34.798831 IP 10.1.78.78.33416 > 10.1.78.161.8080: Flags [.], ack 1509, win 480, options [nop,nop,TS val 2005911701 ecr 1836155283], length 0
11:00:35.798923 IP 10.1.78.161.8080 > 10.1.78.78.33416: Flags [P.], seq 1509:1641, ack 4416, win 456, options [nop,nop,TS val 1836156283 ecr 2005911701], length 132: HTTP
11:00:35.798971 IP 10.1.78.78.33416 > 10.1.78.161.8080: Flags [.], ack 1641, win 479, options [nop,nop,TS val 2005912701 ecr 1836156283], length 0
11:00:36.799279 IP 10.1.78.161.8080 > 10.1.78.78.33416: Flags [P.], seq 1641:1773, ack 4416, win 456, options [nop,nop,TS val 1836157283 ecr 2005912701], length 132: HTTP
11:00:36.799326 IP 10.1.78.78.33416 > 10.1.78.161.8080: Flags [.], ack 1773, win 478, options [nop,nop,TS val 2005913701 ecr 1836157283], length 0
11:00:37.799646 IP 10.1.78.161.8080 > 10.1.78.78.33416: Flags [P.], seq 1773:1905, ack 4416, win 456, options [nop,nop,TS val 1836158284 ecr 2005913701], length 132: HTTP
11:00:37.799698 IP 10.1.78.78.33416 > 10.1.78.161.8080: Flags [.], ack 1905, win 477, options [nop,nop,TS val 2005914702 ecr 1836158284], length 0
11:00:38.800385 IP 10.1.78.161.8080 > 10.1.78.78.33416: Flags [P.], seq 1905:2037, ack 4416, win 456, options [nop,nop,TS val 1836159285 ecr 2005914702], length 132: HTTP
11:00:38.800428 IP 10.1.78.78.33416 > 10.1.78.161.8080: Flags [.], ack 2037, win 476, options [nop,nop,TS val 2005915703 ecr 1836159285], length 0
11:00:39.800761 IP 10.1.78.161.8080 > 10.1.78.78.33416: Flags [P.], seq 2037:2169, ack 4416, win 456, options [nop,nop,TS val 1836160285 ecr 2005915703], length 132: HTTP
11:00:39.800805 IP 10.1.78.78.33416 > 10.1.78.161.8080: Flags [.], ack 2169, win 475, options [nop,nop,TS val 2005916703 ecr 1836160285], length 0
11:00:40.801408 IP 10.1.78.161.8080 > 10.1.78.78.33416: Flags [P.], seq 2169:2301, ack 4416, win 456, options [nop,nop,TS val 1836161286 ecr 2005916703], length 132: HTTP
11:00:40.801456 IP 10.1.78.78.33416 > 10.1.78.161.8080: Flags [.], ack 2301, win 474, options [nop,nop,TS val 2005917704 ecr 1836161286], length 0
11:00:41.801844 IP 10.1.78.161.8080 > 10.1.78.78.33416: Flags [P.], seq 2301:2433, ack 4416, win 456, options [nop,nop,TS val 1836162286 ecr 2005917704], length 132: HTTP
11:00:41.801895 IP 10.1.78.78.33416 > 10.1.78.161.8080: Flags [.], ack 2433, win 473, options [nop,nop,TS val 2005918704 ecr 1836162286], length 0
11:00:42.802156 IP 10.1.78.161.8080 > 10.1.78.78.33416: Flags [P.], seq 2433:2565, ack 4416, win 456, options [nop,nop,TS val 1836163286 ecr 2005918704], length 132: HTTP
11:00:42.802196 IP 10.1.78.78.33416 > 10.1.78.161.8080: Flags [.], ack 2565, win 472, options [nop,nop,TS val 2005919704 ecr 1836163286], length 0
```

**Comment by norru** [comment]
Hi @shonecyx thanks for the detailed suggestions, much appreciated!

This, in particular, is interesting:
>If we don’t configure the HTTP idle timeout on either side of two connections, the connection could be leaked.

**Comment by norru** [comment]
For anyone following this, I've obtained support from AWS and they seem to think there is an issue with their CLB. As CLB is deprecated and will be retired in a few months, they recommend retrying with ALB or NLB.

**Comment by norru** [comment]
>  after some time it should get RST or retry sending until max retry, and close.
The application was doing exactly that, but unfortunately also the RST packets were dropped.

**Comment by leitu** [comment]
@norru  in 2024 we had experiences your issue. just want to see after 2 years if you issue had been resolved after switched to ALB.

**Comment by norru** [comment]
I am no longer working on that project. For reference, the problem was solved by using an NLB. We never got round to test the ALB.
