### ISSUE TITLE
Envoy not closing connections to dead IPs

### ISSUE THREAD

**Issue by jacobgo93** [istio/istio#17051]
**Bug description**
In the past couple of days we’ve witnessed a strange behaviour in our production environment. We now believe this behaviour may be caused by a bug or an unexpected behavior in istio-envoy, and we would like to report our findings here. 

A symptom first noted was a large ratio of `5XX` status codes being returned from one of our services, deployed to an EKS environment as a deployment. This service is working against other internal and external services, the internal ones reside on a different managed cluster (for the record, a DC/OS cluster, but seems this fact doesn’t play a role here). To reach those internal services, the service in question used an istio-envoy side-car inside its pod, configured with a ServiceEntry. The side-car created a connection against an AWS ELB, which routed the request to different services in the DC/OS cluster. 

When we started to dig in, we’ve noticed the following error being logged inside istio-envoy container: ```upstream reset: reset reason connection failure```. To us it seemed that maybe the istio-envoy container couldn’t, for some reason, reach the ELB on its path to the DC/OS cluster. To confirm that, we’ve used `netstat` and `tcpdump`, provided here: 

> Netstat

> $ netstat -p | grep "xx.x.5.5:80"
**> tcp        0      0 <ADDRESS>:56864   xx.x.5.5:80             ESTABLISHED -
> tcp        0      0 <ADDRESS>:51484   xx.x.5.5:80             ESTABLISHED -
> tcp        0      1 <ADDRESS>:52088   xx.x.5.5:80             SYN_SENT    19/envoy
> tcp        0      1 <ADDRESS>:52170   xx.x.5.5:80             SYN_SENT    19/envoy**

> TCPDUMP

> **10:55:56.425308 IP xx.xx.xx.xxx.38062 > xx.x.5.5.80: Flags [S], seq 4146406413, win 26883, options [mss 8961,sackOK,TS val 587493197 ecr 0,nop,wscale 7], length 0**
> 10:55:56.786456 IP xx.xx.xx.xxx.54546 > xx.x.4.164.80: Flags [P.], seq 5281:6305, ack 3850, win 280, options [nop,nop,TS val 2085473143 ecr 2304225758], length 1024: HTTP: GET /v1 HTTP/1.1
> 10:55:56.793539 IP xx.x.4.164.80 > xx.xx.xx.xxx.54546: Flags [P.], seq 3850:4411, ack 6305, win 164, options [nop,nop,TS val 2304226009 ecr 2085473143], length 561: HTTP: HTTP/1.1 200 OK
> 10:55:56.793552 IP xx.xx.xx.xxx.54546 > xx.x.4.164.80: Flags [.], ack 4411, win 288, options [nop,nop,TS val 2085473150 ecr 2304226009], length 0
> 10:55:56.794897 IP xx.xx.xx.xxx.33688 > xx.x.4.68.80: Flags [P.], seq 11236:12841, ack 5181, win 291, options [nop,nop,TS val 2031960282 ecr 886409658], length 1605: HTTP: GET /v1
> 10:55:56.795705 IP xx.x.4.68.80 > xx.xx.xx.xxx.33688: Flags [.], ack 12841, win 214, options [nop,nop,TS val 886409751 ecr 2031960282], length 0
> **10:55:56.798715 IP xx.xx.xx.xxx.38016 > xx.x.5.5.80: Flags [S], seq 2418907848, win 26883, options [mss 8961,sackOK,TS val 587493571 ecr 0,nop,wscale 7], length** 
> [...]
> **010:55:57.286879 IP xx.xx.xx.xxx.49194 > xx.x.5.200.80: Flags [P.], seq 4097:5121, ack 2245, win 246, options [nop,nop,TS val 3278777960 ecr 80888370], length 1024: HTTP: GET /v1
> 10:55:57.312444 IP xx.x.5.200.80 >  xx.xx.xx.xxx.49194: Flags [P.], seq 2245:2806, ack 5121, win 145, options [nop,nop,TS val 80888618 ecr 3278777960], length 561: HTTP: HTTP/1.1 200 OK
> 10:55:57.312463 IP  xx.xx.xx.xxx.49194 > xx.x.5.200.80: Flags [.], ack 2806, win 254, options [nop,nop,TS val 3278777986 ecr 80888618], length 0**

To reach the ELB, any entity had to resolve a CNAME record created via AWS’s DNS service, Route53. Currently, the record is pointing to two A records resolved to addresses ending with `5.60` and `4.164`. In the command output we’ve supplied here you can see that also other addresses are being used as destinations: for instance, those ending with `5.5` and `5.200`. These address indeed belong to our private subnet in that DC/OS environment, but from scanning all the addresses in our VPC - we reached the conclusion that we don’t have any interface associated with any of these IPs. When looking through CloudWatch logs (AWS default logging utility), we’ve also noticed a spike in latency exactly in the same time the `5XX` statuses started. This led us to think that maybe, due to a spike in traffic (and latency), new interfaces were added and then removed from ELB service in AWS. 

After reaching out to AWS support, they’ve confirmed to us that indeed, to cope with increasing traffic, they’ve scaled out and in that exact ELB. The process was: 

1. Adding instances (interfaces, IPs) to the ELB
2. Updating DNS records to point to new IPs
3. Serving traffic 
4. Removing IPs from DNS 
5. Destroying instances - thus, destroying IPs entirely

 
Unfortunately, istio-envoy have already opened different connections to the addresses behind the record. The problem was it didn’t cleaned up the connections though receiving `503` from the address after IPs were removed from DNS and even after being destroyed entirely. As you can see in netstat output and tcpdump, istio-envoy tried to open a connection to an address ending with `5.50` - always sending a `[S.]` packet, but not receiving any answer. Interesting fact is that istio-envoy did manage to communicate with `5.200` address, even though it was completely removed from DNS by AWS but still haven’t been destroyed completely. The retries to `5.5` caused the container app using the side-car to send traffic to a dead-end, resulting in `5XX` statuses. 

**Affected product area (please put an X in all that apply)**

[ ] Configuration Infrastructure
[ ] Docs
[ ] Installation
[X] Networking
[ ] Performance and Scalability
[ ] Policies and Telemetry
[ ] Security
[ ] Test and Release
[ ] User Experience
[ ] Developer Infrastructure

**Expected behavior**
Istio-envoy should close connections to non-existent IP addresses even if DNS records stay the same. 

**Steps to reproduce the bug**
1. Deploy a simple web-app that uses istio-envoy as side-car on-top of EKS/K8S
2. Deploy two instances of a simple web-server on two different hosts outside EKS/K8S cluster (different from web-app location, of course)
3. Now you have a web-app trying to reach a scaled-up web-server on a different location
4. Create an A record to point to the two instances of the web server, for instance: `web-server.domain.com`. Our TTL was 60 seconds.
5. Create a CNAME record to point to both of the A records, for instance: `*.web-server.domain.com`. Our TTL was 300 seconds. We've created a wildcard record since this is the same as our production environment.
6. Now your web-app should be able to reach the web-server through istio-envoy (please remember to configure a ServiceEntry), from an address similar to `test.web-server.domain.com`. This address resolves to two A records, leading to different IPs running your web-server. 
7. While sending simple traffic constantly, remove one of the IPs from the A record (the A record should point only to one IP). 
8. While continuing sending traffic, shutdown the instance that was removed from DNS. Now, `test.web-server.domain.com` points only to one IP. 
9. You should see, via `netstat` and/or `tcpdump`, packets being sent to the IP address which isn’t serving anymore. Also, you should see 5XX statuses from the services. 

We should also record that our services is written in NodeJS and use keep-alive - this indeed can keep connections open. But, saying that, we still believe that even in a case an underlying infra is being scaled out and in with IPs, istio-envoy should somehow understand the IP isn’t serving anymore and close the connection.

We should also record our envoy config, especially ServiceEntry: 
```
apiVersion: networking.istio.io/v1alpha3
kind: ServiceEntry
metadata:
  [...]
spec:
  hosts:
  - '*.our-endpoint.com'      // CNAME record of the ELB leading to that DC/OS env
  location: MESH_EXTERNAL
  ports:
  - name: http-port
    number: 80
    protocol: HTTP
  resolution: NONE
```
As you can see, this way istion-envoy isn’t responsible on DNS resolution at all. We can’t conclude entirely if the problem is in the service or envoy keeping outdated DNS answers.
After reproducing the issue, we changed our serviceEntry’s `spec` to behave differently:
```
spec:
  hosts:
  - '*.incident-test-lb.domain.com'
  ports:
  - number: 3000
    name: incident
    protocol: HTTP
  resolution: DNS
  location: MESH_EXTERNAL
  endpoints:
  - address: 'incident-test-lb.domaim.com'
```

This way, istio-envoy is managing DNS resolution as well, and can be updated of any changes in addresses. 

**Version (include the output of `istioctl version --remote` and `kubectl version`)**
Our EKS version is `1.12` and istio version `1.2.2`. 

**How was Istio installed?**
Regular installation with `Helm` and `kubectl`

**Environment where bug was observed (cloud vendor, OS, etc)**
EKS on AWS

**Comment by wxdao** [comment]
To anyone coming across: Besides putting the address to the exclude list, a ServiceEntry to that external service host with resolution set to DNS solves this problem for us. The default resolution mode, seeming to be original dest, somehow won't re-resolve the address itself and at the same time not terminating dead connections for the client, causing the client keep interacting with nowhere😕. With resolution set to DNS the proxy will try resolving every 5s, good enough to catch host backend changes in time.
