### ISSUE TITLE
VM running on separate network is not proxying traffic to east-west gateway while accessing k8s service

### ISSUE THREAD

**Issue by shashankram** [istio/istio#42411]
### Bug Description

I tried the [VM integration demo](https://istio.io/latest/docs/setup/install/virtual-machine/#prepare-the-guide-environment) based on the multi-network model a few times, and I can't seem to get this to work.

Based on my debugging, it's clear that the proxy on the VM gets the config from Istiod, however the endpoint for the upstream service in the k8s cluster points to the backend app pod IP instead of the external IP of the east-west gateway meant to route traffic across the 2 networks (VM and k8s cluster).

A tcpdump capture confirms this, as I see the destination IP set to the k8s app pod IP which is on a different L3 network. I would expect the traffic to be proxied to the external IP of the east-west gateway instead, which has already be configured per the guide.

VMs in the same network as the k8s cluster are able to access the backend. Is the multi-network functionality broken?

### Version

```prose
client version: 1.16.0
control plane version: 1.16.0
data plane version: 1.16.0 (4 proxies)
```

```
Client Version: v1.25.4
Kustomize Version: v4.5.7
Server Version: v1.24.5-gke.600
```

### Additional Information

Tcpdump capture on the client VM on `curl httpbin.httpbin.svc:14001/get`:
```
22:01:41.893390 IP foo.bar-236622.internal.54636 > 10.172.0.10.14001: Flags [S], seq 3304198473, win 65320, options [mss 1420,sackOK,TS val 3688933874 ecr 0,nop,wscale 7], length 0
22:01:42.911047 IP foo.bar-236622.internal.54636 > 10.172.0.10.14001: Flags [S], seq 3304198473, win 65320, options [mss 1420,sackOK,TS val 3688934892 ecr 0,nop,wscale 7], length 0
22:01:44.927080 IP foo.bar-236622.internal.54636 > 10.172.0.10.14001: Flags [S], seq 3304198473, win 65320, options [mss 1420,sackOK,TS val 3688936908 ecr 0,nop,wscale 7], length 0
```
Above, `10.172.0.10` is the IP address of the `httpbin` pod.

VM config dump:
[vm_config_dump.tar.gz](https://github.com/istio/istio/files/10212619/vm_config_dump.tar.gz)

**Comment by shashankram** [comment]
I tried the entire workflow using autoregistration and it works as expected.
