### ISSUE TITLE
TCP connections issues using golang net.textproto

### ISSUE THREAD

**Issue by zoltrain** [istio/istio#13394]
**Some TCP services don't work when the sidecar is injected**

**TCP services that work through kube-proxy should work with the sidecar enabled**

**The problem**
We have Mailhog installed in our staging environment to test email, when we enable the sidecar on this container email stops working, as in our golang services can no longer send SMTP commands to the server. If we disable the sidecar the same code in the clients can connect just fine. This leads us to believe istio is doing something strange with these types of text based protocols. The strange thing is if we enable the sidecar and then send the appropriate SMTP commands to Mailhog with say nodejs or telnet, the message is sent without a hitch. I wrote a rudimentary client to connect to mailhog service via golangs net library. As in setup a net connection, then setup a net.textproto connection. The first connection works correctly, the 3-way handshake happens correctly and I've confirmed this with tcpdump. The net.textproto connection is the thing that fails. Istio seems to block the response from the initial textproto connection. It expects a return code of 220, but always times out with a EOF error. 

Here's the tcpdump output when it times out

```tcpdump -i vethcfc9a17f port 25 -vvv
tcpdump: listening on vethcfc9a17f, link-type EN10MB (Ethernet), capture size 262144 bytes
15:25:42.420055 IP (tos 0x0, ttl 64, id 5369, offset 0, flags [DF], proto TCP (6), length 60)
    10.200.4.36.45522 > 10.200.16.27.smtp: Flags [S], cksum 0x29fd (incorrect -> 0xa0a4), seq 1024103067, win 28400, options [mss 1420,sackOK,TS val 641033982 ecr 0,nop,wscale 7], length 0
15:25:42.420468 IP (tos 0x0, ttl 62, id 0, offset 0, flags [DF], proto TCP (6), length 60)
    10.200.16.27.smtp > 10.200.4.36.45522: Flags [S.], cksum 0x72b1 (correct), seq 562815188, ack 1024103068, win 28160, options [mss 1420,sackOK,TS val 2721286718 ecr 641033982,nop,wscale 7], length 0
15:25:42.420518 IP (tos 0x0, ttl 64, id 5370, offset 0, flags [DF], proto TCP (6), length 52)
    10.200.4.36.45522 > 10.200.16.27.smtp: Flags [.], cksum 0x29f5 (incorrect -> 0x0e77), seq 1, ack 1, win 222, options [nop,nop,TS val 641033983 ecr 2721286718], length 0
15:25:57.422659 IP (tos 0x0, ttl 62, id 49022, offset 0, flags [DF], proto TCP (6), length 52)
    10.200.16.27.smtp > 10.200.4.36.45522: Flags [F.], cksum 0xd3df (correct), seq 1, ack 1, win 220, options [nop,nop,TS val 2721301718 ecr 641033983], length 0
15:25:57.422927 IP (tos 0x0, ttl 64, id 5371, offset 0, flags [DF], proto TCP (6), length 52)
    10.200.4.36.45522 > 10.200.16.27.smtp: Flags [F.], cksum 0x29f5 (incorrect -> 0x9943), seq 1, ack 2, win 222, options [nop,nop,TS val 641048984 ecr 2721301718], length 0
15:25:57.424135 IP (tos 0x0, ttl 62, id 49023, offset 0, flags [DF], proto TCP (6), length 52)
    10.200.16.27.smtp > 10.200.4.36.45522: Flags [.], cksum 0x9942 (correct), seq 2, ack 2, win 220, options [nop,nop,TS val 2721301721 ecr 641048984], length 0
```
What's stranger still is if I try to send another text command to the SMTP server while the connection is waiting for a response it forces the original response to finally return, and I get a 220 back. So it's like there's a buffer of responses and Istio is returning the response late.

**Steps to reproduce**
I've been able to reproduce this across namespaces in our cluster with the following steps.

Install mailhog in a namespace with injection enabled

```apiVersion: extensions/v1beta1
kind: Deployment
metadata:
  labels:
    run: mailhog
  name: mailhog
spec:
  replicas: 1
  selector:
    matchLabels:
      run: mailhog
  template:
    metadata:
      labels:
        run: mailhog
    spec:
      containers:
      - image: mailhog/mailhog
        imagePullPolicy: Always
        name: mailhog
        ports:
        - containerPort: 1025
          protocol: TCP
        - containerPort: 8025
          protocol: TCP
```

```
apiVersion: v1
kind: Service
metadata:
  labels:
    run: mailhog
  name: mailhog
spec:
  ports:
  - name: smtp
    port: 25
    protocol: TCP
    targetPort: 1025
  - name: http
    port: 8025
    protocol: TCP
    targetPort: 8025
  selector:
    run: mailhog
  type: ClusterIP
```

start a golang container inside the same namespace with a shell (we'll run the default mailhog replacement for sendmail here)

`kubectl run -i --tty --rm debug --image=golang:1.12-alpine --restart=Never -- sh`

inside the shell install git with `apk add git` and then install mhsendmail with `go get github.com/mailhog/mhsendmail`

mhsendmail should now be in the container path. We can try send an email to mailhog e.g.

```
mhsendmail --smtp-addr="mailhog:25" test@mailhog.local <<EOF
From: App <app@mailhog.local>
To: Test <test@mailhog.local>
Subject: Test message

Some content!
EOF
```

This will hang and produce the referenced tcpdump output, but you can send a SMTP message manually with telnet via the following from the golang container. So this seems to be a golang specific problem with lower level TCP protocols.

install telnet via `apk add busybox-extras`

Now run
```
telnet mailhog:25
ehlo localhost
mail from:<test@test.org>
rcpt to:<test@test.org>
data
test
.
quit
```

The strange thing is if you then disable injection on the mailhog pod (injection can still be enabled on your golang container) and run the same command it will send without a problem. So it has to do with ingress traffic to the destination pod, in this case mailhog.

**Version**
```
istioctl version --remote                                                                                                     
version.BuildInfo{Version:"1.1.2", GitRevision:"2b1331886076df103179e3da5dc9077fed59c989", User:"root", Host:"35adf5bb-5570-11e9-b00d-0a580a2c0205", GolangVersion:"go1.10.4", DockerHub:"docker.io/istio", BuildStatus:"Clean", GitTag:"1.1.1"}

kubectl version
Client Version: version.Info{Major:"1", Minor:"11", GitVersion:"v1.11.7", GitCommit:"65ecaf0671341311ce6aea0edab46ee69f65d59e", GitTreeState:"clean", BuildDate:"2019-01-24T19:32:00Z", GoVersion:"go1.10.7", Compiler:"gc", Platform:"darwin/amd64"}
Server Version: version.Info{Major:"1", Minor:"11+", GitVersion:"v1.11.7-gke.12", GitCommit:"06f08e60069231bd21bdf673cf0595aac80b99f6", GitTreeState:"clean", BuildDate:"2019-02-25T20:37:10Z", GoVersion:"go1.10.8b4", Compiler:"gc", Platform:"linux/amd64"}
```

**How was Istio installed?**
helm template then kubectl apply -f manifests.yaml

This is the `helm template` command

```
helm template ../helm/istio --name istio --namespace istio-system \
    --set ingress.enabled=false \
    --set gateways.istio-ingressgateway.enabled=false \
    --set gateways.istio-egressgateway.enabled=false \
    --set global.proxy.envoyStatsd.enabled=false \
    --set tracing.enabled=false \
    --set certmanager.enabled=false \
    --set prometheus.enabled=true \
    --set security.enabled=true \
    --set kiali.enabled=true \
    --set galley.enabled=true \
    --set galley.enabled=true \
    --set mixer.enabled=true \
    --set pilot.enabled=true \
    --set sidecarInjectorWebhook.enabled=true \
    --set kiali.dashboard.grafanaURL="http://dashboards" \
    --set global.proxy.includeIPRanges="10.10.0.0/20\,10.100.0.0/16"
```

**Environment where bug was observed (cloud vendor, OS, etc)**
GCP GKE v1.11.7-gke.12

**Comment by chris-str-cst** [comment]
I'm currently facing exactly the same issue. Did you figured out a solution @zoltrain?
