### ISSUE TITLE
Intermittent 503 errors due to port reuse on ingressgateway

### ISSUE THREAD

**Issue by fusidic** [istio/istio#42630]
### Bug Description

There is a circumstance where we meet the 503 UF in the multi-port-service scenario, as shown below, we have bound ports 8001 and 8002 in the service:
```yaml
apiVersion: v1
kind: Service
metadata:
  labels:
    app: multiport
    version: v1
  name: multiport
  namespace: default
spec:
  clusterIP: 10.247.223.69
  clusterIPs:
  - 10.247.223.69
  ports:
  - name: http-service-0
    port: 8001
    protocol: TCP
    targetPort: 8001
  - name: http-service-1
    port: 8002
    protocol: TCP
    targetPort: 8002
  selector:
    app: multiport
  sessionAffinity: None
  type: ClusterIP
status:
  loadBalancer: {}
```

This can occasionally lead to requests to different ports competing for the same ingressgateway port. 
As shown below, if a request to 8001 is also assigned to port 15018 of the ingressgateway when the ingressgateway 15018 has already established a connection to port 8002 on the server side, it will result in a 503 UF. 8001's SYN is responded by 8002.

```bash
[root@test-39705 ~]# tcpdump -nn tcp and dst host 10.0.0.38 or src host 10.0.0.38 
dropped privs to tcpdump
tcpdump: verbose output suppressed, use -v or -vv for full protocol decode
listening on eth0, link-type EN10MB (Ethernet), capture size 262144 bytes
09:53:30.706503 IP 10.0.0.45.15058 > 10.0.0.38.8001: Flags [S], seq 3905950105, win 29200, options [mss 1460,sackOK,TS val 2088065553 ecr 0,nop,wscale 9], length 0
09:53:30.706537 IP 10.0.0.38.8002 > 10.0.0.45.15058: Flags [.], ack 3032860957, win 358, options [nop,nop,TS val 2588636213 ecr 2087948838], length 0
09:53:31.723265 IP 10.0.0.45.15058 > 10.0.0.38.8001: Flags [S], seq 3905950105, win 29200, options [mss 1460,sackOK,TS val 2088066570 ecr 0,nop,wscale 9], length 0
09:53:31.723314 IP 10.0.0.38.8002 > 10.0.0.45.15058: Flags [.], ack 1, win 358, options [nop,nop,TS val 2588637230 ecr 2087948838], length 0
09:53:33.771270 IP 10.0.0.45.15058 > 10.0.0.38.8001: Flags [S], seq 3905950105, win 29200, options [mss 1460,sackOK,TS val 2088068618 ecr 0,nop,wscale 9], length 0
09:53:33.771317 IP 10.0.0.38.8002 > 10.0.0.45.15058: Flags [.], ack 1, win 358, options [nop,nop,TS val 2588639278 ecr 2087948838], length 0
09:53:36.011258 ARP, Request who-has 10.0.0.45 tell 10.0.0.38, length 28
09:53:36.011343 ARP, Reply 10.0.0.38 is-at fa:16:3e:23:18:ad, length 28
09:53:37.803269 IP 10.0.0.45.15058 > 10.0.0.38.8001: Flags [S], seq 3905950105, win 29200, options [mss 1460,sackOK,TS val 2088072650 ecr 0,nop,wscale 9], length 0
09:53:37.803337 IP 10.0.0.38.8002 > 10.0.0.45.15058: Flags [.], ack 1, win 358, options [nop,nop,TS val 2588643310 ecr 2087948838], length 0
09:53:40.726411 IP 10.0.0.45.15078 > 10.0.0.38.8001: Flags [S], seq 1250591929, win 29200, options [mss 1460,sackOK,TS val 2088075573 ecr 0,nop,wscale 9], length 0
09:53:40.726470 IP 10.0.0.38.8002 > 10.0.0.45.15078: Flags [.], ack 231511943, win 358, options [nop,nop,TS val 2588646233 ecr 2087948799], length 0
09:53:41.771259 IP 10.0.0.45.15078 > 10.0.0.38.8001: Flags [S], seq 1250591929, win 29200, options [mss 1460,sackOK,TS val 2088076618 ecr 0,nop,wscale 9], length 0
09:53:41.771321 IP 10.0.0.38.8002 > 10.0.0.45.15078: Flags [.], ack 1, win 358, options [nop,nop,TS val 2588647278 ecr 2087948799], length 0
09:53:43.819269 IP 10.0.0.45.15078 > 10.0.0.38.8001: Flags [S], seq 1250591929, win 29200, options [mss 1460,sackOK,TS val 2088078666 ecr 0,nop,wscale 9], length 0
09:53:43.819317 IP 10.0.0.38.8002 > 10.0.0.45.15078: Flags [.], ack 1, win 358, options [nop,nop,TS val 2588649326 ecr 2087948799], length 0
09:53:47.851252 IP 10.0.0.45.15078 > 10.0.0.38.8001: Flags [S], seq 1250591929, win 29200, options [mss 1460,sackOK,TS val 2088082698 ecr 0,nop,wscale 9], length 0
09:53:47.851293 IP 10.0.0.38.8002 > 10.0.0.45.15078: Flags [.], ack 1, win 358, options [nop,nop,TS val 2588653358 ecr 2087948799], length 0
09:53:50.726741 IP 10.0.0.45.15088 > 10.0.0.38.8001: Flags [S], seq 1170543417, win 29200, options [mss 1460,sackOK,TS val 2088085573 ecr 0,nop,wscale 9], length 0
09:53:50.726783 IP 10.0.0.38.8002 > 10.0.0.45.15088: Flags [.], ack 518770331, win 358, options [nop,nop,TS val 2588656233 ecr 2087948828], length 0
09:53:51.755263 IP 10.0.0.45.15088 > 10.0.0.38.8001: Flags [S], seq 1170543417, win 29200, options [mss 1460,sackOK,TS val 2088086601 ecr 0,nop,wscale 9], length 0
09:53:51.755319 IP 10.0.0.38.8002 > 10.0.0.45.15088: Flags [.], ack 1, win 358, options [nop,nop,TS val 2588657262 ecr 2087948828], length 0
09:53:53.803257 IP 10.0.0.45.15088 > 10.0.0.38.8001: Flags [S], seq 1170543417, win 29200, options [mss 1460,sackOK,TS val 2088088649 ecr 0,nop,wscale 9], length 0
09:53:53.803300 IP 10.0.0.38.8002 > 10.0.0.45.15088: Flags [.], ack 1, win 358, options [nop,nop,TS val 2588659309 ecr 2087948828], length 0
09:53:57.835258 IP 10.0.0.45.15088 > 10.0.0.38.8001: Flags [S], seq 1170543417, win 29200, options [mss 1460,sackOK,TS val 2088092681 ecr 0,nop,wscale 9], length 0
09:53:57.835345 IP 10.0.0.38.8002 > 10.0.0.45.15088: Flags [.], ack 1, win 358, options [nop,nop,TS val 2588663341 ecr 2087948828], length 0
```

### Version

```prose
istio version 1.8.6

kubectl version --short
Client Version: v1.21.4
Server Version: v1.21.7
```

### Additional Information

How to reproduce
Since this problem occurs less frequently in production environments, different requests that need access to the same pod happen to be assigned to the same port of the same ingressgateway.  We need to manually adjust the range of available ports on the ingressgateway to reproduce it.
Add securityContext.sysctls in ingressgateway deployment:
```yaml
     securityContext:
        fsGroup: 1337
        runAsGroup: 1337
        runAsNonRoot: true
        runAsUser: 1337
        sysctls:
        - name: net.ipv4.ip_local_port_range
          value: 15000 15090
```
And request 8002 via fortio to occupy all available ports on the ingressgateway, then request 8001 through ingressgateway will meet 503 UF.

**Comment by howardjohn** [comment]
I think this is https://github.com/istio/istio/issues/38982

PS: Istio 1.8 is like 2 years EOL, so we won't support it even if there is an issue. if its not the same as ^, please see if it reproduces on modern versions and open
