### ISSUE TITLE
503 with demo services in multicluster (replicated control-planes)

### ISSUE THREAD

**Issue by chiquiff** [istio/istio#21702]
Hi all,

I'm currently setting up a new configuration using 2 separated Kubernetes clusters and Istio 1.4.3. Both are living in AWS, and the ingress gateway for both of them are private NLB.

I'm following this docs `https://istio.io/docs/setup/install/multicluster/gateways/` and there's no way for me to make it work. Not sure if I'm missing something or what.

Here's some output from my configuration:

**Service Entry for service living in CLUSTER2, in CLUSTER1**

```apiVersion: networking.istio.io/v1alpha3
kind: ServiceEntry
metadata:
  annotations:
    kubectl.kubernetes.io/last-applied-configuration: |
      {"apiVersion":"networking.istio.io/v1alpha3","kind":"ServiceEntry","metadata":{"annotations":{},"name":"httpbin-bar","namespace":"foo"},"spec":{"addresses":["240.0.0.2"],"endpoints":[{"address":"ada1abd6c4d0411ea926012afd9c0721-d447d519dfd5060e.elb.us-east-1.amazonaws.com","ports":{"http1":15443}}],"hosts":["httpbin.bar.global"],"location":"MESH_INTERNAL","ports":[{"name":"http1","number":8000,"protocol":"http"}],"resolution":"DNS"}}
  creationTimestamp: "2020-02-12T20:34:44Z"
  generation: 25
  name: httpbin-bar
  namespace: foo
  resourceVersion: "2637645"
  selfLink: /apis/networking.istio.io/v1alpha3/namespaces/foo/serviceentries/httpbin-bar
  uid: 1a80379b-4dd7-11ea-be7b-02cc4db8aea7
spec:
  addresses:
  - 240.0.0.2
  endpoints:
  - address: ada1abd6c4d0411ea926012afd9c0721-d447d519dfd5060e.elb.us-east-1.amazonaws.com
    ports:
      http1: 15443
  hosts:
  - httpbin.bar.global
  location: MESH_INTERNAL
  ports:
  - name: http1
    number: 8000
    protocol: http
  resolution: DNS`
```
Whenever I hit `http://httpbin.bar.global/` from CLUSTER1, I see some logs in CLUSTER2 Ingres gw:
`[2020-03-02T15:31:04.596Z] "- - -" 0 - "-" "-" 195 1257 6 - "-" "-" "-" "-" "10.103.33.118:80" outbound_.8000_._.httpbin.bar.svc.cluster.local 10.103.131.210:58942 10.103.131.210:15443 10.103.34.181:57814 outbound_.8000_._.httpbin.bar.global -
[2020-03-02T15:31:04.624Z] "- - -" 0 - "-" "-" 195 1257 4 - "-" "-" "-" "-" "10.103.33.118:80" outbound_.8000_._.httpbin.bar.svc.cluster.local 10.103.131.210:58944 10.103.131.210:15443 10.103.131.110:35188 outbound_.8000_._.httpbin.bar.global -`

I don't see any logs in:
- the `httpbin` sidecar
- `httpbin` app container
- citadel
- alley

However, if I do a `tcpdump` in the `httpbin app container`, I see some tcp negotiation happenning:

`15:34:22.767167 IP 10-103-131-210.istio-ingressgateway.istio-system.svc.cluster.local.60592 > httpbin-64776bf78d-9jw45.http: Flags [S], seq 40393271, win 26883, options [mss 8961,sackOK,TS val 3500281905 ecr 0,nop,wscale 7], length 0
    0x0000:  4500 003c fcde 4000 fd06 c6c6 0a67 83d2  E..<..@......g..
    0x0010:  0a67 2176 ecb0 0050 0268 5a37 0000 0000  .g!v...P.hZ7....
    0x0020:  a002 6903 dd25 0000 0204 2301 0402 080a  ..i..%....#.....
    0x0030:  d0a2 1031 0000 0000 0103 0307            ...1........
15:34:22.767210 IP httpbin-64776bf78d-9jw45.http > 10-103-131-210.istio-ingressgateway.istio-system.svc.cluster.local.60592: Flags [S.], seq 3029703224, ack 40393272, win 26847, options [mss 8961,sackOK,TS val 2558308304 ecr 3500281905,nop,wscale 7], length 0
    0x0000:  4500 003c 0000 4000 ff06 c1a5 0a67 2176  E..<..@......g!v
    0x0010:  0a67 83d2 0050 ecb0 b495 9a38 0268 5a38  .g...P.....8.hZ8
    0x0020:  a012 68df ba44 0000 0204 2301 0402 080a  ..h..D....#.....
    0x0030:  987c afd0 d0a2 1031 0103 0307            .|.....1....
15:34:22.767900 IP 10-103-131-210.istio-ingressgateway.istio-system.svc.cluster.local.60592 > httpbin-64776bf78d-9jw45.http: Flags [.], ack 1, win 211, options [nop,nop,TS val 3500281906 ecr 2558308304], length 0
    0x0000:  4500 0034 fcdf 4000 fd06 c6cd 0a67 83d2  E..4..@......g..
    0x0010:  0a67 2176 ecb0 0050 0268 5a38 b495 9a39  .g!v...P.hZ8...9
    0x0020:  8010 00d3 fa41 0000 0101 080a d0a2 1032  .....A.........2
    0x0030:  987c afd0                                .|..
15:34:22.768026 IP 10-103-131-210.istio-ingressgateway.istio-system.svc.cluster.local.60592 > httpbin-64776bf78d-9jw45.http: Flags [P.], seq 1:189, ack 1, win 211, options [nop,nop,TS val 3500281906 ecr 2558308304], length 188: HTTP
    0x0000:  4500 00f0 fce0 4000 fd06 c610 0a67 83d2  E.....@......g..
    0x0010:  0a67 2176 ecb0 0050 0268 5a38 b495 9a39  .g!v...P.hZ8...9
    0x0020:  8018 00d3 d63f 0000 0101 080a d0a2 1032  .....?.........2
    0x0030:  987c afd0 1603 0100 b701 0000 b303 0341  .|.............A
    0x0040:  651a 1e39 4990 3d29 d8af cda2 b4a4 3b34  e..9I.=)......;4
    0x0050:  ed97 eb5b e091 212b 349f d88d 1dee 2200  ...[..!+4.....".
    0x0060:  001c c02b cca9 c02f cca8 c009 c013 009c  ...+.../........
    0x0070:  002f c02c c030 c00a c014 009d 0035 0100  ./.,.0.......5..
    0x0080:  006e 0000 0029 0027 0000 246f 7574 626f  .n...).'..$outbo
    0x0090:  756e 645f 2e38 3030 305f 2e5f 2e68 7474  und_.8000_._.htt
    0x00a0:  7062 696e 2e62 6172 2e67 6c6f 6261 6c00  pbin.bar.global.
    0x00b0:  1700 00ff 0100 0100 000a 0006 0004 001d  ................
    0x00c0:  0017 000b 0002 0100 0023 0000 0010 0008  .........#......
    0x00d0:  0006 0569 7374 696f 000d 0014 0012 0403  ...istio........
    0x00e0:  0804 0401 0503 0805 0501 0806 0601 0201  ................
15:34:22.768047 IP httpbin-64776bf78d-9jw45.http > 10-103-131-210.istio-ingressgateway.istio-system.svc.cluster.local.60592: Flags [.], ack 189, win 219, options [nop,nop,TS val 2558308305 ecr 3500281906], length 0
    0x0000:  4500 0034 d398 4000 ff06 ee14 0a67 2176  E..4..@......g!v
    0x0010:  0a67 83d2 0050 ecb0 b495 9a39 0268 5af4  .g...P.....9.hZ.
    0x0020:  8010 00db ba3c 0000 0101 080a 987c afd1  .....<.......|..
    0x0030:  d0a2 1032                                ...2
15:34:22.769613 IP httpbin-64776bf78d-9jw45.http > 10-103-131-210.istio-ingressgateway.istio-system.svc.cluster.local.60592: Flags [P.], seq 1:1258, ack 189, win 219, options [nop,nop,TS val 2558308307 ecr 3500281906], length 1257: HTTP
    0x0000:  4500 051d d399 4000 ff06 e92a 0a67 2176  E.....@....*.g!v
    0x0010:  0a67 83d2 0050 ecb0 b495 9a39 0268 5af4  .g...P.....9.hZ.
    0x0020:  8018 00db bf25 0000 0101 080a 987c afd3  .....%.......|..
    0x0030:  d0a2 1032 1603 0300 3f02 0000 3b03 035e  ...2....?...;..^
    0x0040:  5d27 7e28 f452 d5f0 116b 8d5e c884 9c3f  ]'~(.R...k.^...?
    0x0050:  ed19 90f3 b7aa 4c44 4f57 4e47 5244 0100  ......LDOWNGRD..
    0x0060:  c02f 0000 1300 1700 00ff 0100 0100 000b  ./..............
    0x0070:  0002 0100 0023 0000 1603 0303 280b 0003  .....#......(...
    0x0080:  2400 0321 0003 1e30 8203 1a30 8202 02a0  $..!...0...0....
    0x0090:  0302 0102 0211 00ba 3262 7144 a169 bc08  ........2bqD.i..
    0x00a0:  1963 c2f5 c142 9830 0d06 092a 8648 86f7  .c...B.0...*.H..
    0x00b0:  0d01 010b 0500 3018 3116 3014 0603 5504  ......0.1.0...U.
    0x00c0:  0a13 0d63 6c75 7374 6572 2e6c 6f63 616c  ...cluster.local
    0x00d0:  301e 170d 3230 3032 3238 3136 3430 3136  0...200228164016
    0x00e0:  5a17 0d32 3030 3532 3831 3634 3031 365a  Z..200528164016Z
    0x00f0:  3000 3082 0122 300d 0609 2a86 4886 f70d  0.0.."0...*.H...
    0x0100:  0101 0105 0003 8201 0f00 3082 010a 0282  ..........0.....
    0x0110:  0101 00b3 97e8 395d 90a0 aa66 7ca1 e696  ......9]...f|...
    0x0120:  a9c2 12b7 f91c e4b6 1094 7cd8 d27c fb08  ..........|..|..
    0x0130:  dae4 d63c dd44 5150 cf41 ec7a f3e8 646a  ...<.DQP.A.z..dj
    0x0140:  3abb b600 fca0 e81d c673 bab7 0d7d 1c61  :........s...}.a
    0x0150:  f1e9 b9e9 ebec f6a7 5cd3 a647 5202 7d93  ........\..GR.}.
    0x0160:  ad73 9a01 db81 c173 dd2e e56d 19c1 6b08  .s.....s...m..k.
    0x0170:  f9f9 b45f c12f fa8b 8c7c 3e50 b4a6 6dc7  ..._./...|>P..m.
    0x0180:  4553 cdbb 7298 71bc 7b54 a82d 837a 50d5  ES..r.q.{T.-.zP.
    0x0190:  3efe fd1e a871 1f25 fc34 6e37 b42a b1ed  >....q.%.4n7.*..
    0x01a0:  7e71 c39d 0c66 474c 5267 c7f9 47d0 ebf0  ~q...fGLRg..G...
    0x01b0:  d455 4856 9c6b 8505 4a23 ef96 9c99 ba7a  .UHV.k..J#.....z
    0x01c0:  eb48 ff46 a0eb ae36 1da8 d529 05bb 1e68  .H.F...6...)...h
    0x01d0:  c1a6 54bc 639e 7532 047a 82fa a6b2 8fc5  ..T.c.u2.z......
    0x01e0:  5b39 0386 b365 2622 bda9 f53c 13b2 3fdf  [9...e&"...<..?.
    0x01f0:  f243 6db0 bddf 60a2 5ea6 c9a2 f0bf 1ac3  .Cm...`.^.......
    0x0200:  b574 d7f4 ee86 1361 2194 86e3 d22e d681  .t.....a!.......
    0x0210:  33bd 2902 0301 0001 a377 3075 300e 0603  3.)......w0u0...
    0x0220:  551d 0f01 01ff 0404 0302 05a0 301d 0603  U...........0...
    0x0230:  551d 2504 1630 1406 082b 0601 0505 0703  U.%..0...+......
    0x0240:  0106 082b 0601 0505 0703 0230 0c06 0355  ...+.......0...U
    0x0250:  1d13 0101 ff04 0230 0030 3606 0355 1d11  .......0.06..U..
    0x0260:  0101 ff04 2c30 2a86 2873 7069 6666 653a  ....,0*.(spiffe:
    0x0270:  2f2f 636c 7573 7465 722e 6c6f 6361 6c2f  //cluster.local/
    0x0280:  6e73 2f62 6172 2f73 612f 6874 7470 6269  ns/bar/sa/httpbi
    0x0290:  6e30 0d06 092a 8648 86f7 0d01 010b 0500  n0...*.H........
    0x02a0:  0382 0101 0095 ad33 7dc8 982d 3585 6dae  .......3}..-5.m.
    0x02b0:  da4b a816 46cb 3918 c609 dd08 e23f 00aa  .K..F.9......?..
    0x02c0:  6e0a 49b7 92b9 666f a95b 0304 ac53 db1a  n.I...fo.[...S..
    0x02d0:  5747 1939 aa7b 725a 6221 cd3a 6b5f 2a1e  WG.9.{rZb!.:k_*.
    0x02e0:  8db5 a3a0 b643 6f81 9d6f e81e a902 565c  .....Co..o....V\
    0x02f0:  c236 5080 c3f8 b749 3e2f 51ff e368 6607  .6P....I>/Q..hf.
    0x0300:  93f7 c02c 4c4e acb4 e51c 4f30 a26a 8054  ...,LN....O0.j.T
    0x0310:  1756 4420 dd5c 9a60 c70e 85f5 b072 ca78  .VD..\.`.....r.x
    0x0320:  d166 4bbe 8542 47ba 265a 4c1d f04a b222  .fK..BG.&ZL..J."
    0x0330:  8d91 0ee0 8ba9 4055 bbda 8aeb 6cf9 fc63  ......@U....l..c
    0x0340:  76ce e56a ed0f bdbd 6c7e 51d4 31dc 4e15  v..j....l~Q.1.N.
    0x0350:  af9a 8136 f0cb d841 97dc 397e 86ec d492  ...6...A..9~....
    0x0360:  e009 c8c9 051c 29d3 f5aa 510d 05e8 1de9  ......)...Q.....
    0x0370:  8fa2 d850 1d43 7b6b 85f0 86b6 347a 3b56  ...P.C{k....4z;V
    0x0380:  d5c3 3045 fee6 7084 3b8a 274d 0194 2fdd  ..0E..p.;.'M../.
    0x0390:  ff6b 3c7f d30c 2c36 81c2 770f 773a 5c93  .k<...,6..w.w:\.
    0x03a0:  dd55 3663 bf16 0303 012c 0c00 0128 0300  .U6c.....,...(..
    0x03b0:  1d20 7744 6671 efec 0a54 ebea bfa2 456a  ..wDfq...T....Ej
    0x03c0:  ffa5 4036 7530 9f2b 9dde 9ea2 1293 1748  ..@6u0.+.......H
    0x03d0:  fc4b 0804 0100 6599 aa94 176b cc62 8f97  .K....e....k.b..
    0x03e0:  60be 6575 ba62 ea61 907e 9e35 a9fe 2a75  `.eu.b.a.~.5..*u
    0x03f0:  b7e4 57c0 3365 fc0a 55e8 ba8d 24e0 d50a  ..W.3e..U...$...
    0x0400:  e81e 4629 49bc 97dd f87f 0d3b 09a7 d2d7  ..F)I......;....
    0x0410:  ffd1 ea1a 5a59 f2aa bcc1 f15a 73d4 9044  ....ZY.....Zs..D
    0x0420:  4c91 3419 f91d 4909 0cda 5660 1c4c 9f9d  L.4...I...V`.L..
    0x0430:  583e f11b 35d0 4424 4eac d5f9 2ef5 5365  X>..5.D$N.....Se
    0x0440:  6f0c 3831 1555 5856 15a8 a169 bce6 6149  o.81.UXV...i..aI
    0x0450:  5b92 41fd 92cf 8eb3 169a ab37 fb7f 6276  [.A........7..bv
    0x0460:  a165 1421 48bb cade e6fd e36f 1cbe f624  .e.!H......o...$
    0x0470:  3ae7 5c92 dca0 dd96 0096 1992 de3b 3629  :.\..........;6)
    0x0480:  37ea 496d 8ee6 3ac4 2570 3750 90aa f805  7.Im..:.%p7P....
    0x0490:  6e89 d67e 82e9 5e83 4aa7 cd07 b2eb 2264  n..~..^.J....."d
    0x04a0:  d767 d6e8 4a8f f7e7 d769 bb40 b522 a444  .g..J....i.@.".D
    0x04b0:  88da 9c2f 3317 4b3c d6cd b65d 0311 5962  .../3.K<...]..Yb
    0x04c0:  a8f1 24ed 3859 b08d 8e3f abbd 86f5 0f34  ..$.8Y...?.....4
    0x04d0:  8b94 9652 13a1 1603 0300 390d 0000 3502  ...R......9...5.
    0x04e0:  0140 0012 0403 0804 0401 0503 0805 0501  .@..............
    0x04f0:  0806 0601 0201 001c 001a 3018 3116 3014  ..........0.1.0.
    0x0500:  0603 5504 0a13 0d63 6c75 7374 6572 2e6c  ..U....cluster.l
    0x0510:  6f63 616c 1603 0300 040e 0000 00         ocal.........
15:34:22.770341 IP 10-103-131-210.istio-ingressgateway.istio-system.svc.cluster.local.60592 > httpbin-64776bf78d-9jw45.http: Flags [.], ack 1258, win 230, options [nop,nop,TS val 3500281908 ecr 2558308307], length 0
    0x0000:  4500 0034 fce1 4000 fd06 c6cb 0a67 83d2  E..4..@......g..
    0x0010:  0a67 2176 ecb0 0050 0268 5af4 b495 9f22  .g!v...P.hZ...."
    0x0020:  8010 00e6 f484 0000 0101 080a d0a2 1034  ...............4
    0x0030:  987c afd3                                .|..
15:34:22.770871 IP 10-103-131-210.istio-ingressgateway.istio-system.svc.cluster.local.60592 > httpbin-64776bf78d-9jw45.http: Flags [P.], seq 189:196, ack 1258, win 230, options [nop,nop,TS val 3500281909 ecr 2558308307], length 7: HTTP
    0x0000:  4500 003b fce2 4000 fd06 c6c3 0a67 83d2  E..;..@......g..
    0x0010:  0a67 2176 ecb0 0050 0268 5af4 b495 9f22  .g!v...P.hZ...."
    0x0020:  8018 00e6 a76f 0000 0101 080a d0a2 1035  .....o.........5
    0x0030:  987c afd3 1503 0300 0202 33              .|........3
15:34:22.770930 IP httpbin-64776bf78d-9jw45.http > 10-103-131-210.istio-ingressgateway.istio-system.svc.cluster.local.60592: Flags [F.], seq 1258, ack 196, win 219, options [nop,nop,TS val 2558308308 ecr 3500281909], length 0
    0x0000:  4500 0034 d39a 4000 ff06 ee12 0a67 2176  E..4..@......g!v
    0x0010:  0a67 83d2 0050 ecb0 b495 9f22 0268 5afb  .g...P.....".hZ.
    0x0020:  8011 00db ba3c 0000 0101 080a 987c afd4  .....<.......|..
    0x0030:  d0a2 1035                                ...5
15:34:22.770962 IP 10-103-131-210.istio-ingressgateway.istio-system.svc.cluster.local.60592 > httpbin-64776bf78d-9jw45.http: Flags [F.], seq 196, ack 1258, win 230, options [nop,nop,TS val 3500281909 ecr 2558308307], length 0
    0x0000:  4500 0034 fce3 4000 fd06 c6c9 0a67 83d2  E..4..@......g..
    0x0010:  0a67 2176 ecb0 0050 0268 5afb b495 9f22  .g!v...P.hZ...."
    0x0020:  8011 00e6 f47b 0000 0101 080a d0a2 1035  .....{.........5
    0x0030:  987c afd3                                .|..
15:34:22.771005 IP httpbin-64776bf78d-9jw45.http > 10-103-131-210.istio-ingressgateway.istio-system.svc.cluster.local.60592: Flags [.], ack 197, win 219, options [nop,nop,TS val 2558308308 ecr 3500281909], length 0
    0x0000:  4500 0034 d39b 4000 ff06 ee11 0a67 2176  E..4..@......g!v
    0x0010:  0a67 83d2 0050 ecb0 b495 9f23 0268 5afc  .g...P.....#.hZ.
    0x0020:  8010 00db ba3c 0000 0101 080a 987c afd4  .....<.......|..
    0x0030:  d0a2 1035                                ...5
15:34:22.771621 IP 10-103-131-210.istio-ingressgateway.istio-system.svc.cluster.local.60592 > httpbin-64776bf78d-9jw45.http: Flags [.], ack 1259, win 230, options [nop,nop,TS val 3500281909 ecr 2558308308], length 0
    0x0000:  4500 0034 fce4 4000 fd06 c6c8 0a67 83d2  E..4..@......g..
    0x0010:  0a67 2176 ecb0 0050 0268 5afc b495 9f23  .g!v...P.hZ....#
    0x0020:  8010 00e6 f479 0000 0101 080a d0a2 1035  .....y.........5
    0x0030:  987c afd4                                .|..
15:34:23.837414 IP 10-103-131-210.istio-ingressgateway.istio-system.svc.cluster.local.60600 > httpbin-64776bf78d-9jw45.http: Flags [S], seq 919334493, win 26883, options [mss 8961,sackOK,TS val 3500282975 ecr 0,nop,wscale 7], length 0
    0x000...`

Not sure what to address now. I don't see any logs indicating what to attack next =(

**Comment by ayj** [comment]
Possibly related - https://github.com/istio/istio/issues/21676
