### ISSUE TITLE
Nginx cannot proxy back to ISTIO TLSv1.2 ingress gateway

### ISSUE THREAD

**Issue by trevorlinton** [istio/istio#18402]
**Bug description**

Nginx cannot proxy back to istio ingresses.

 I'm unsure if the issue is in istio or nginx but thought I'd file it here to see if anyone could pick apart the debug logs on nginx (I don't see any information on the ingress gateway pods logs).

**Expected behavior**

A reverse proxy should be able to reach istio.

**Steps to reproduce the bug**

1. Build the following docker file below with command `docker build . -t istio-nginx-test:1`.   **Replace `https://example.com` with a istio ingress gateway host that has a valid virtual service and TLS gateway with TLS v1.2 enabled.**
2. Then run the docker file `docker run -p8080:8080 -ti istio-nginx-test:1`
3. Once running, use curl to make a request to the proxied host: `curl http://localhost:8080`.
4. Notice Nginx returns a `502`, and in the nginx logs states istio was responsible for a connection reset during the TLS handshake:  `2019/10/28 18:33:51 [error] 11#11: *1 peer closed connection in SSL handshake while SSL handshaking to upstream, client: 172.17.0.1, server: , request: "GET / HTTP/1.1", upstream: "https://10.70.1.21:443/", host: "localhost:8080"`

`Dockerfile`: 
```
FROM ubuntu:disco
ENV TO_HOST https://example.com
RUN apt-get update
RUN apt install curl gnupg2 ca-certificates lsb-release --yes
RUN echo "deb http://nginx.org/packages/ubuntu `lsb_release -cs` nginx" | tee /etc/apt/sources.list.d/nginx.list
RUN echo "deb http://nginx.org/packages/mainline/ubuntu `lsb_release -cs` nginx" | tee /etc/apt/sources.list.d/nginx.list
RUN curl -fsSL https://nginx.org/keys/nginx_signing.key | apt-key add -
RUN apt-key fingerprint ABF5BD827BD9BF62
RUN apt-get update
RUN apt-get install openssl --yes
RUN apt-get install nginx --yes
RUN echo " \
server { \
	listen 8080 default_server; \
	listen [::]:8080 default_server; \
	location / { \
		proxy_pass $TO_HOST; \
		proxy_http_version 1.1; \
	} \
	ssl_protocols TLSv1.2; \
} \
access_log  /var/log/nginx/access.log  main; \
error_log /var/log/nginx/error.log debug; \
" > /etc/nginx/conf.d/default.conf
EXPOSE 8080
RUN mkdir /run/nginx
ENTRYPOINT cat /etc/nginx/nginx.conf ; /usr/sbin/nginx-debug -V ; /usr/sbin/nginx-debug ; /bin/sleep 4 ; /usr/bin/tail -f /var/log/nginx/access.log /var/log/nginx/error.log
```

I have tried the following to attempt to resolve this:

1. Asked nginx who never responded to my inquiry.
2. Attempted to see if it was the addition of forwarding paths that caused the issue (tested by adding x-forwarded-for and other proxy pass headers while directly making requests to the istio app)
3. Tried alpine, and ubuntu operating systems and default out of the box nginx installations (while running in Docker).
4. Enabled all cipherSuites on the ingress gateway certificate configuration.
5. Switched from lets encrypt to DigiCert certificates on the ingress gateway.
6. Went into the docker container and directly connected to istio using `openssl s_client -host example.com -port 443 -servername example.com` (which appears to have worked just fine, protocol `TLSv1.2`, cipher ` ECDHE-RSA-AES128-GCM-SHA256`).
7. Attempted to limit nginx to TLSv1.2 using `ssl_protocols TLSv1.2`.
8. Attempted to set the proxy passthrough http version to 1.1 using `proxy_http_version 1.1`.
9. Attempted to enforce the ecdh curves to the default ones on Envoy (listed here as the defaults, not sure if these are used on istio, https://www.envoyproxy.io/docs/envoy/v1.8.0/api-v1/listeners/listeners#config-listener-ssl-context).

As you may be able to tell, this is very frustrating and I could use some help. On the bright side it's very reproducible in the steps above.  

### Wireshark Output

Putting Wireshark on the connection filtering on `example.com` domain it shows:

* --to-istio--> `SYN`
* <--from-istio-- `SYN`, `ACK`
* --to-istio--> `ACK`
* --to-istio--> `TLSv1.2` Client Hello (advertising 28 available cipher suites, three match with istio, advertises no compression, ec_points `ansix962_compressed_prime/char2`, ec supported groups `x25519`, `secp256r1`, `x449`, `secp521r1`,`secp384r1`, no data in session ticket, encrypt_then_mac=0, extended_master_secret=0). For a full stream see below
* <--from-istio-- `ACK`
* <--from-istio-- `RST`, `ACK`
* --to-istio--> `ACK`

### Nginx Debug Output

Here's the output to the `cat /etc/nginx/nginx.conf ; nginx -V ; nginx` output with one request to a backend istio app (in debug mode):

```
$ docker run -ti istio-nginx-test:1

user  nginx;
worker_processes  1;

error_log  /var/log/nginx/error.log warn;
pid        /var/run/nginx.pid;


events {
    worker_connections  1024;
}


http {
    include       /etc/nginx/mime.types;
    default_type  application/octet-stream;

    log_format  main  '$remote_addr - $remote_user [$time_local] "$request" '
                      '$status $body_bytes_sent "$http_referer" '
                      '"$http_user_agent" "$http_x_forwarded_for"';

    access_log  /var/log/nginx/access.log  main;

    sendfile        on;
    #tcp_nopush     on;

    keepalive_timeout  65;

    #gzip  on;

    include /etc/nginx/conf.d/*.conf;
}
nginx version: nginx/1.17.5
built by gcc 8.3.0 (Ubuntu 8.3.0-6ubuntu1) 
built with OpenSSL 1.1.1b  26 Feb 2019
TLS SNI support enabled
configure arguments: --prefix=/etc/nginx --sbin-path=/usr/sbin/nginx --modules-path=/usr/lib/nginx/modules --conf-path=/etc/nginx/nginx.conf --error-log-path=/var/log/nginx/error.log --http-log-path=/var/log/nginx/access.log --pid-path=/var/run/nginx.pid --lock-path=/var/run/nginx.lock --http-client-body-temp-path=/var/cache/nginx/client_temp --http-proxy-temp-path=/var/cache/nginx/proxy_temp --http-fastcgi-temp-path=/var/cache/nginx/fastcgi_temp --http-uwsgi-temp-path=/var/cache/nginx/uwsgi_temp --http-scgi-temp-path=/var/cache/nginx/scgi_temp --user=nginx --group=nginx --with-compat --with-file-aio --with-threads --with-http_addition_module --with-http_auth_request_module --with-http_dav_module --with-http_flv_module --with-http_gunzip_module --with-http_gzip_static_module --with-http_mp4_module --with-http_random_index_module --with-http_realip_module --with-http_secure_link_module --with-http_slice_module --with-http_ssl_module --with-http_stub_status_module --with-http_sub_module --with-http_v2_module --with-mail --with-mail_ssl_module --with-stream --with-stream_realip_module --with-stream_ssl_module --with-stream_ssl_preread_module --with-cc-opt='-g -O2 -fdebug-prefix-map=/data/builder/debuild/nginx-1.17.5/debian/debuild-base/nginx-1.17.5=. -fstack-protector-strong -Wformat -Werror=format-security -Wp,-D_FORTIFY_SOURCE=2 -fPIC' --with-ld-opt='-Wl,-Bsymbolic-functions -Wl,-z,relro -Wl,-z,now -Wl,--as-needed -pie' --with-debug
==> /var/log/nginx/access.log <==

==> /var/log/nginx/error.log <==
2019/10/28 19:59:27 [debug] 11#11: epoll add event: fd:6 op:1 ev:00002001
2019/10/28 19:59:27 [debug] 11#11: epoll add event: fd:7 op:1 ev:00002001

==> /var/log/nginx/access.log <==
172.17.0.1 - - [28/Oct/2019:19:59:48 +0000] "GET / HTTP/1.1" 502 157 "-" "curl/7.54.0" "-"
172.17.0.1 - - [28/Oct/2019:19:59:48 +0000] "GET / HTTP/1.1" 502 157 "-" "curl/7.54.0"

==> /var/log/nginx/error.log <==
2019/10/28 19:59:48 [debug] 11#11: accept on 0.0.0.0:8080, ready: 0
2019/10/28 19:59:48 [debug] 11#11: posix_memalign: 0000557BF566DE30:512 @16
2019/10/28 19:59:48 [debug] 11#11: *1 accept: 172.17.0.1:44770 fd:3
2019/10/28 19:59:48 [debug] 11#11: *1 event timer add: 3: 60000:97512559
2019/10/28 19:59:48 [debug] 11#11: *1 reusable connection: 1
2019/10/28 19:59:48 [debug] 11#11: *1 epoll add event: fd:3 op:1 ev:80002001
2019/10/28 19:59:48 [debug] 11#11: *1 http wait request handler
2019/10/28 19:59:48 [debug] 11#11: *1 malloc: 0000557BF5654160:1024
2019/10/28 19:59:48 [debug] 11#11: *1 recv: eof:0, avail:-1
2019/10/28 19:59:48 [debug] 11#11: *1 recv: fd:3 78 of 1024
2019/10/28 19:59:48 [debug] 11#11: *1 reusable connection: 0
2019/10/28 19:59:48 [debug] 11#11: *1 posix_memalign: 0000557BF569F330:4096 @16
2019/10/28 19:59:48 [debug] 11#11: *1 http process request line
2019/10/28 19:59:48 [debug] 11#11: *1 http request line: "GET / HTTP/1.1"
2019/10/28 19:59:48 [debug] 11#11: *1 http uri: "/"
2019/10/28 19:59:48 [debug] 11#11: *1 http args: ""
2019/10/28 19:59:48 [debug] 11#11: *1 http exten: ""
2019/10/28 19:59:48 [debug] 11#11: *1 posix_memalign: 0000557BF567D7E0:4096 @16
2019/10/28 19:59:48 [debug] 11#11: *1 http process request header line
2019/10/28 19:59:48 [debug] 11#11: *1 http header: "Host: localhost:8080"
2019/10/28 19:59:48 [debug] 11#11: *1 http header: "User-Agent: curl/7.54.0"
2019/10/28 19:59:48 [debug] 11#11: *1 http header: "Accept: */*"
2019/10/28 19:59:48 [debug] 11#11: *1 http header done
2019/10/28 19:59:48 [debug] 11#11: *1 event timer del: 3: 97512559
2019/10/28 19:59:48 [debug] 11#11: *1 generic phase: 0
2019/10/28 19:59:48 [debug] 11#11: *1 rewrite phase: 1
2019/10/28 19:59:48 [debug] 11#11: *1 test location: "/"
2019/10/28 19:59:48 [debug] 11#11: *1 using configuration "/"
2019/10/28 19:59:48 [debug] 11#11: *1 http cl:-1 max:1048576
2019/10/28 19:59:48 [debug] 11#11: *1 rewrite phase: 3
2019/10/28 19:59:48 [debug] 11#11: *1 post rewrite phase: 4
2019/10/28 19:59:48 [debug] 11#11: *1 generic phase: 5
2019/10/28 19:59:48 [debug] 11#11: *1 generic phase: 6
2019/10/28 19:59:48 [debug] 11#11: *1 generic phase: 7
2019/10/28 19:59:48 [debug] 11#11: *1 access phase: 8
2019/10/28 19:59:48 [debug] 11#11: *1 access phase: 9
2019/10/28 19:59:48 [debug] 11#11: *1 access phase: 10
2019/10/28 19:59:48 [debug] 11#11: *1 post access phase: 11
2019/10/28 19:59:48 [debug] 11#11: *1 generic phase: 12
2019/10/28 19:59:48 [debug] 11#11: *1 generic phase: 13
2019/10/28 19:59:48 [debug] 11#11: *1 http init upstream, client timer: 0
2019/10/28 19:59:48 [debug] 11#11: *1 epoll add event: fd:3 op:3 ev:80002005
2019/10/28 19:59:48 [debug] 11#11: *1 http script copy: "Host"
2019/10/28 19:59:48 [debug] 11#11: *1 http script var: "example.com"
2019/10/28 19:59:48 [debug] 11#11: *1 http script copy: "Connection"
2019/10/28 19:59:48 [debug] 11#11: *1 http script copy: "close"
2019/10/28 19:59:48 [debug] 11#11: *1 http script copy: ""
2019/10/28 19:59:48 [debug] 11#11: *1 http script copy: ""
2019/10/28 19:59:48 [debug] 11#11: *1 http proxy header: "User-Agent: curl/7.54.0"
2019/10/28 19:59:48 [debug] 11#11: *1 http proxy header: "Accept: */*"
2019/10/28 19:59:48 [debug] 11#11: *1 http proxy header:
"GET / HTTP/1.1
Host: example.com
Connection: close
User-Agent: curl/7.54.0
Accept: */*

"
2019/10/28 19:59:48 [debug] 11#11: *1 http cleanup add: 0000557BF567E128
2019/10/28 19:59:48 [debug] 11#11: *1 get rr peer, try: 1
2019/10/28 19:59:48 [debug] 11#11: *1 stream socket 12
2019/10/28 19:59:48 [debug] 11#11: *1 epoll add connection: fd:12 ev:80002005
2019/10/28 19:59:48 [debug] 11#11: *1 connect to 10.70.1.21:443, fd:12 #2
2019/10/28 19:59:48 [debug] 11#11: *1 http upstream connect: -2
2019/10/28 19:59:48 [debug] 11#11: *1 posix_memalign: 0000557BF56A0340:128 @16
2019/10/28 19:59:48 [debug] 11#11: *1 event timer add: 12: 60000:97512559
2019/10/28 19:59:48 [debug] 11#11: *1 http finalize request: -4, "/?" a:1, c:2
2019/10/28 19:59:48 [debug] 11#11: *1 http request count:2 blk:0
2019/10/28 19:59:48 [debug] 11#11: *1 http run request: "/?"
2019/10/28 19:59:48 [debug] 11#11: *1 http upstream check client, write event:1, "/"
2019/10/28 19:59:48 [debug] 11#11: *1 http upstream request: "/?"
2019/10/28 19:59:48 [debug] 11#11: *1 http upstream send request handler
2019/10/28 19:59:48 [debug] 11#11: *1 malloc: 0000557BF566DCE0:96
2019/10/28 19:59:48 [debug] 11#11: *1 set session: 0000000000000000
2019/10/28 19:59:48 [debug] 11#11: *1 tcp_nodelay
2019/10/28 19:59:48 [debug] 11#11: *1 SSL_do_handshake: -1
2019/10/28 19:59:48 [debug] 11#11: *1 SSL_get_error: 2
2019/10/28 19:59:48 [debug] 11#11: *1 SSL handshake handler: 0
2019/10/28 19:59:48 [debug] 11#11: *1 SSL_do_handshake: -1
2019/10/28 19:59:48 [debug] 11#11: *1 SSL_get_error: 5
2019/10/28 19:59:48 [error] 11#11: *1 peer closed connection in SSL handshake while SSL handshaking to upstream, client: 172.17.0.1, server: , request: "GET / HTTP/1.1", upstream: "https://10.70.1.21:443/", host: "localhost:8080"
2019/10/28 19:59:48 [debug] 11#11: *1 http upstream ssl handshake: "/?"
2019/10/28 19:59:48 [debug] 11#11: *1 http next upstream, 2
2019/10/28 19:59:48 [debug] 11#11: *1 free rr peer 1 4
2019/10/28 19:59:48 [debug] 11#11: *1 finalize http upstream request: 502
2019/10/28 19:59:48 [debug] 11#11: *1 finalize http proxy request
2019/10/28 19:59:48 [debug] 11#11: *1 close http upstream connection: 12
2019/10/28 19:59:48 [debug] 11#11: *1 free: 0000557BF566DCE0
2019/10/28 19:59:48 [debug] 11#11: *1 free: 0000557BF56A0340, unused: 32
2019/10/28 19:59:48 [debug] 11#11: *1 event timer del: 12: 97512559
2019/10/28 19:59:48 [debug] 11#11: *1 reusable connection: 0
2019/10/28 19:59:48 [debug] 11#11: *1 http finalize request: 502, "/?" a:1, c:1
2019/10/28 19:59:48 [debug] 11#11: *1 http special response: 502, "/?"
2019/10/28 19:59:48 [debug] 11#11: *1 HTTP/1.1 502 Bad Gateway
Server: nginx/1.17.5
Date: Mon, 28 Oct 2019 19:59:48 GMT
Content-Type: text/html
Content-Length: 157
Connection: keep-alive

2019/10/28 19:59:48 [debug] 11#11: *1 write new buf t:1 f:0 0000557BF567E1B8, pos 0000557BF567E1B8, size: 157 file: 0, size: 0
2019/10/28 19:59:48 [debug] 11#11: *1 http write filter: l:0 f:0 s:157
2019/10/28 19:59:48 [debug] 11#11: *1 http output filter "/?"
2019/10/28 19:59:48 [debug] 11#11: *1 http copy filter: "/?"
2019/10/28 19:59:48 [debug] 11#11: *1 http postpone filter "/?" 0000557BF567E3A0
2019/10/28 19:59:48 [debug] 11#11: *1 write old buf t:1 f:0 0000557BF567E1B8, pos 0000557BF567E1B8, size: 157 file: 0, size: 0
2019/10/28 19:59:48 [debug] 11#11: *1 write new buf t:0 f:0 0000000000000000, pos 0000557BF485CB40, size: 104 file: 0, size: 0
2019/10/28 19:59:48 [debug] 11#11: *1 write new buf t:0 f:0 0000000000000000, pos 0000557BF485DDE0, size: 53 file: 0, size: 0
2019/10/28 19:59:48 [debug] 11#11: *1 http write filter: l:1 f:0 s:314
2019/10/28 19:59:48 [debug] 11#11: *1 http write filter limit 0
2019/10/28 19:59:48 [debug] 11#11: *1 writev: 314 of 314
2019/10/28 19:59:48 [debug] 11#11: *1 http write filter 0000000000000000
2019/10/28 19:59:48 [debug] 11#11: *1 http copy filter: 0 "/?"
2019/10/28 19:59:48 [debug] 11#11: *1 http finalize request: 0, "/?" a:1, c:1
2019/10/28 19:59:48 [debug] 11#11: *1 set http keepalive handler
2019/10/28 19:59:48 [debug] 11#11: *1 http close request
2019/10/28 19:59:48 [debug] 11#11: *1 http log handler
2019/10/28 19:59:48 [debug] 11#11: *1 free: 0000557BF569F330, unused: 8
2019/10/28 19:59:48 [debug] 11#11: *1 free: 0000557BF567D7E0, unused: 778
2019/10/28 19:59:48 [debug] 11#11: *1 free: 0000557BF5654160
2019/10/28 19:59:48 [debug] 11#11: *1 hc free: 0000000000000000
2019/10/28 19:59:48 [debug] 11#11: *1 hc busy: 0000000000000000 0
2019/10/28 19:59:48 [debug] 11#11: *1 tcp_nodelay
2019/10/28 19:59:48 [debug] 11#11: *1 reusable connection: 1
2019/10/28 19:59:48 [debug] 11#11: *1 event timer add: 3: 65000:97517619
2019/10/28 19:59:48 [debug] 11#11: *1 http keepalive handler
2019/10/28 19:59:48 [debug] 11#11: *1 malloc: 0000557BF5654160:1024
2019/10/28 19:59:48 [debug] 11#11: *1 recv: eof:1, avail:-1
2019/10/28 19:59:48 [debug] 11#11: *1 recv: fd:3 0 of 1024
2019/10/28 19:59:48 [info] 11#11: *1 client 172.17.0.1 closed keepalive connection
2019/10/28 19:59:48 [debug] 11#11: *1 close http connection: 3
2019/10/28 19:59:48 [debug] 11#11: *1 event timer del: 3: 97517619
2019/10/28 19:59:48 [debug] 11#11: *1 reusable connection: 0
2019/10/28 19:59:48 [debug] 11#11: *1 free: 0000557BF5654160
2019/10/28 19:59:48 [debug] 11#11: *1 free: 0000557BF566DE30, unused: 136
```

**Version (include the output of `istioctl version --remote` and `kubectl version`)**

```
$ istioctl version --remote
client version: version.BuildInfo{Version:"1.1.1", GitRevision:"2b1331886076df103179e3da5dc9077fed59c989", User:"root", Host:"7077232d-4c6c-11e9-813c-0a580a2c0506", GolangVersion:"go1.10.4", DockerHub:"docker.io/istio", BuildStatus:"Clean", GitTag:"1.1.0-17-g2b13318"}
apps-private-ingressgateway version: version.BuildInfo{Version:"", GitRevision:"", User:"", Host:"", GolangVersion:"", DockerHub:"", BuildStatus:"", GitTag:""}
apps-private-ingressgateway version: version.BuildInfo{Version:"", GitRevision:"", User:"", Host:"", GolangVersion:"", DockerHub:"", BuildStatus:"", GitTag:""}
apps-public-ingressgateway version: version.BuildInfo{Version:"", GitRevision:"", User:"", Host:"", GolangVersion:"", DockerHub:"", BuildStatus:"", GitTag:""}
apps-public-ingressgateway version: version.BuildInfo{Version:"", GitRevision:"", User:"", Host:"", GolangVersion:"", DockerHub:"", BuildStatus:"", GitTag:""}
citadel version: version.BuildInfo{Version:"1.2.6", GitRevision:"b26019f05195188378be9118b0f0fa7613f7ebb4-dirty", User:"root", Host:"0798c310-d8da-11e9-89ce-86619cd7d75e", GolangVersion:"go1.12.9", DockerHub:"docker.io/istio", BuildStatus:"Modified", GitTag:"1.2.5-8-gb26019f"}
galley version: version.BuildInfo{Version:"1.2.6", GitRevision:"b26019f05195188378be9118b0f0fa7613f7ebb4-dirty", User:"root", Host:"0798c310-d8da-11e9-89ce-86619cd7d75e", GolangVersion:"go1.12.9", DockerHub:"docker.io/istio", BuildStatus:"Modified", GitTag:"1.2.5-8-gb26019f"}
pilot version: version.BuildInfo{Version:"1.2.6", GitRevision:"b26019f05195188378be9118b0f0fa7613f7ebb4-dirty", User:"root", Host:"0798c310-d8da-11e9-89ce-86619cd7d75e", GolangVersion:"go1.12.9", DockerHub:"docker.io/istio", BuildStatus:"Modified", GitTag:"1.2.5-8-gb26019f"}
policy version: version.BuildInfo{Version:"1.2.6", GitRevision:"b26019f05195188378be9118b0f0fa7613f7ebb4-dirty", User:"root", Host:"0798c310-d8da-11e9-89ce-86619cd7d75e", GolangVersion:"go1.12.9", DockerHub:"docker.io/istio", BuildStatus:"Modified", GitTag:"1.2.5-8-gb26019f"}
sidecar-injector version: version.BuildInfo{Version:"1.2.6", GitRevision:"b26019f05195188378be9118b0f0fa7613f7ebb4-dirty", User:"root", Host:"0798c310-d8da-11e9-89ce-86619cd7d75e", GolangVersion:"go1.12.9", DockerHub:"docker.io/istio", BuildStatus:"Modified", GitTag:"1.2.5-8-gb26019f"}
telemetry version: version.BuildInfo{Version:"1.2.6", GitRevision:"b26019f05195188378be9118b0f0fa7613f7ebb4-dirty", User:"root", Host:"0798c310-d8da-11e9-89ce-86619cd7d75e", GolangVersion:"go1.12.9", DockerHub:"docker.io/istio", BuildStatus:"Modified", GitTag:"1.2.5-8-gb26019f"}
sites-private-ingressgateway version: version.BuildInfo{Version:"", GitRevision:"", User:"", Host:"", GolangVersion:"", DockerHub:"", BuildStatus:"", GitTag:""}
sites-private-ingressgateway version: version.BuildInfo{Version:"", GitRevision:"", User:"", Host:"", GolangVersion:"", DockerHub:"", BuildStatus:"", GitTag:""}
sites-public-ingressgateway version: version.BuildInfo{Version:"", GitRevision:"", User:"", Host:"", GolangVersion:"", DockerHub:"", BuildStatus:"", GitTag:""}
sites-public-ingressgateway version: version.BuildInfo{Version:"", GitRevision:"", User:"", Host:"", GolangVersion:"", DockerHub:"", BuildStatus:"", GitTag:""}
```

```
$ kubectl version
Client Version: version.Info{Major:"1", Minor:"15", GitVersion:"v1.15.3", GitCommit:"2d3c76f9091b6bec110a5e63777c332469e0cba2", GitTreeState:"clean", BuildDate:"2019-08-19T12:36:28Z", GoVersion:"go1.12.9", Compiler:"gc", Platform:"darwin/amd64"}
Server Version: version.Info{Major:"1", Minor:"13", GitVersion:"v1.13.5", GitCommit:"2166946f41b36dea2c4626f90a77706f426cdea2", GitTreeState:"clean", BuildDate:"2019-03-25T15:19:22Z", GoVersion:"go1.11.5", Compiler:"gc", Platform:"linux/amd64"}
```

**How was Istio installed?**

Helm

**Environment where bug was observed (cloud vendor, OS, etc)**

In most (if not all environments) we've setup with istio.

### Wireshark TLS Client Hello Output

```
Frame 26: 260 bytes on wire (2080 bits), 260 bytes captured (2080 bits) on interface 0
Ethernet II, Src: Apple_8a:9a:3c (68:5b:35:8a:9a:3c), Dst: Cisco_ff:fc:50 (00:08:e3:ff:fc:50)
Internet Protocol Version 4, Src: 172.19.12.152, Dst: 10.70.1.21
Transmission Control Protocol, Src Port: 49614, Dst Port: 443, Seq: 1, Ack: 1, Len: 194
    Source Port: 49614
    Destination Port: 443
    [Stream index: 0]
    [TCP Segment Len: 194]
    Sequence number: 1    (relative sequence number)
    [Next sequence number: 195    (relative sequence number)]
    Acknowledgment number: 1    (relative ack number)
    1000 .... = Header Length: 32 bytes (8)
    Flags: 0x018 (PSH, ACK)
        000. .... .... = Reserved: Not set
        ...0 .... .... = Nonce: Not set
        .... 0... .... = Congestion Window Reduced (CWR): Not set
        .... .0.. .... = ECN-Echo: Not set
        .... ..0. .... = Urgent: Not set
        .... ...1 .... = Acknowledgment: Set
        .... .... 1... = Push: Set
        .... .... .0.. = Reset: Not set
        .... .... ..0. = Syn: Not set
        .... .... ...0 = Fin: Not set
        [TCP Flags: ·······AP···]
    Window size value: 65535
    [Calculated window size: 65535]
    [Window size scaling factor: -2 (no window scaling used)]
    Checksum: 0xc4ee [unverified]
    [Checksum Status: Unverified]
    Urgent pointer: 0
    Options: (12 bytes), No-Operation (NOP), No-Operation (NOP), Timestamps
    [SEQ/ACK analysis]
        [iRTT: 0.022380000 seconds]
        [Bytes in flight: 194]
        [Bytes sent since last PSH flag: 194]
    [Timestamps]
        [Time since first frame in this TCP stream: 0.023084000 seconds]
        [Time since previous frame in this TCP stream: 0.000704000 seconds]
    TCP payload (194 bytes)
Transport Layer Security
    TLSv1 Record Layer: Handshake Protocol: Client Hello
        Content Type: Handshake (22)
        Version: TLS 1.0 (0x0301)
        Length: 189
        Handshake Protocol: Client Hello
            Handshake Type: Client Hello (1)
            Length: 185
            Version: TLS 1.2 (0x0303)
            Random: 13bdea735967fa80efd049fae9ab41ba2986828c2c7aded5…
                GMT Unix Time: Jun 30, 1980 05:43:47.000000000 MDT
                Random Bytes: 5967fa80efd049fae9ab41ba2986828c2c7aded57cd0069d…
            Session ID Length: 0
            Cipher Suites Length: 56
            Cipher Suites (28 suites)
                Cipher Suite: TLS_ECDHE_ECDSA_WITH_AES_256_GCM_SHA384 (0xc02c)
                Cipher Suite: TLS_ECDHE_RSA_WITH_AES_256_GCM_SHA384 (0xc030)
                Cipher Suite: TLS_DHE_RSA_WITH_AES_256_GCM_SHA384 (0x009f)
                Cipher Suite: TLS_ECDHE_ECDSA_WITH_CHACHA20_POLY1305_SHA256 (0xcca9)
                Cipher Suite: TLS_ECDHE_RSA_WITH_CHACHA20_POLY1305_SHA256 (0xcca8)
                Cipher Suite: TLS_DHE_RSA_WITH_CHACHA20_POLY1305_SHA256 (0xccaa)
                Cipher Suite: TLS_ECDHE_ECDSA_WITH_AES_128_GCM_SHA256 (0xc02b)
                Cipher Suite: TLS_ECDHE_RSA_WITH_AES_128_GCM_SHA256 (0xc02f)
                Cipher Suite: TLS_DHE_RSA_WITH_AES_128_GCM_SHA256 (0x009e)
                Cipher Suite: TLS_ECDHE_ECDSA_WITH_AES_256_CBC_SHA384 (0xc024)
                Cipher Suite: TLS_ECDHE_RSA_WITH_AES_256_CBC_SHA384 (0xc028)
                Cipher Suite: TLS_DHE_RSA_WITH_AES_256_CBC_SHA256 (0x006b)
                Cipher Suite: TLS_ECDHE_ECDSA_WITH_AES_128_CBC_SHA256 (0xc023)
                Cipher Suite: TLS_ECDHE_RSA_WITH_AES_128_CBC_SHA256 (0xc027)
                Cipher Suite: TLS_DHE_RSA_WITH_AES_128_CBC_SHA256 (0x0067)
                Cipher Suite: TLS_ECDHE_ECDSA_WITH_AES_256_CBC_SHA (0xc00a)
                Cipher Suite: TLS_ECDHE_RSA_WITH_AES_256_CBC_SHA (0xc014)
                Cipher Suite: TLS_DHE_RSA_WITH_AES_256_CBC_SHA (0x0039)
                Cipher Suite: TLS_ECDHE_ECDSA_WITH_AES_128_CBC_SHA (0xc009)
                Cipher Suite: TLS_ECDHE_RSA_WITH_AES_128_CBC_SHA (0xc013)
                Cipher Suite: TLS_DHE_RSA_WITH_AES_128_CBC_SHA (0x0033)
                Cipher Suite: TLS_RSA_WITH_AES_256_GCM_SHA384 (0x009d)
                Cipher Suite: TLS_RSA_WITH_AES_128_GCM_SHA256 (0x009c)
                Cipher Suite: TLS_RSA_WITH_AES_256_CBC_SHA256 (0x003d)
                Cipher Suite: TLS_RSA_WITH_AES_128_CBC_SHA256 (0x003c)
                Cipher Suite: TLS_RSA_WITH_AES_256_CBC_SHA (0x0035)
                Cipher Suite: TLS_RSA_WITH_AES_128_CBC_SHA (0x002f)
                Cipher Suite: TLS_EMPTY_RENEGOTIATION_INFO_SCSV (0x00ff)
            Compression Methods Length: 1
            Compression Methods (1 method)
            Extensions Length: 88
            Extension: ec_point_formats (len=4)
                Type: ec_point_formats (11)
                Length: 4
                EC point formats Length: 3
                Elliptic curves point formats (3)
                    EC point format: uncompressed (0)
                    EC point format: ansiX962_compressed_prime (1)
                    EC point format: ansiX962_compressed_char2 (2)
            Extension: supported_groups (len=12)
                Type: supported_groups (10)
                Length: 12
                Supported Groups List Length: 10
                Supported Groups (5 groups)
                    Supported Group: x25519 (0x001d)
                    Supported Group: secp256r1 (0x0017)
                    Supported Group: x448 (0x001e)
                    Supported Group: secp521r1 (0x0019)
                    Supported Group: secp384r1 (0x0018)
            Extension: session_ticket (len=0)
                Type: session_ticket (35)
                Length: 0
                Data (0 bytes)
            Extension: encrypt_then_mac (len=0)
                Type: encrypt_then_mac (22)
                Length: 0
            Extension: extended_master_secret (len=0)
                Type: extended_master_secret (23)
                Length: 0
            Extension: signature_algorithms (len=48)
                Type: signature_algorithms (13)
                Length: 48
                Signature Hash Algorithms Length: 46
                Signature Hash Algorithms (23 algorithms)
                    Signature Algorithm: ecdsa_secp256r1_sha256 (0x0403)
                    Signature Algorithm: ecdsa_secp384r1_sha384 (0x0503)
                    Signature Algorithm: ecdsa_secp521r1_sha512 (0x0603)
                    Signature Algorithm: ed25519 (0x0807)
                    Signature Algorithm: ed448 (0x0808)
                    Signature Algorithm: rsa_pss_pss_sha256 (0x0809)
                    Signature Algorithm: rsa_pss_pss_sha384 (0x080a)
                    Signature Algorithm: rsa_pss_pss_sha512 (0x080b)
                    Signature Algorithm: rsa_pss_rsae_sha256 (0x0804)
                    Signature Algorithm: rsa_pss_rsae_sha384 (0x0805)
                    Signature Algorithm: rsa_pss_rsae_sha512 (0x0806)
                    Signature Algorithm: rsa_pkcs1_sha256 (0x0401)
                    Signature Algorithm: rsa_pkcs1_sha384 (0x0501)
                    Signature Algorithm: rsa_pkcs1_sha512 (0x0601)
                    Signature Algorithm: SHA224 ECDSA (0x0303)
                    Signature Algorithm: ecdsa_sha1 (0x0203)
                    Signature Algorithm: SHA224 RSA (0x0301)
                    Signature Algorithm: rsa_pkcs1_sha1 (0x0201)
                    Signature Algorithm: SHA224 DSA (0x0302)
                    Signature Algorithm: SHA1 DSA (0x0202)
                    Signature Algorithm: SHA256 DSA (0x0402)
                    Signature Algorithm: SHA384 DSA (0x0502)
                    Signature Algorithm: SHA512 DSA (0x0602)



                    Transport Layer Security
    TLSv1 Record Layer: Handshake Protocol: Client Hello
        Content Type: Handshake (22)
        Version: TLS 1.0 (0x0301)
        Length: 189
        Handshake Protocol: Client Hello
            Handshake Type: Client Hello (1)
            Length: 185
            Version: TLS 1.2 (0x0303)
            Random: 13bdea735967fa80efd049fae9ab41ba2986828c2c7aded5…
                GMT Unix Time: Jun 30, 1980 05:43:47.000000000 MDT
                Random Bytes: 5967fa80efd049fae9ab41ba2986828c2c7aded57cd0069d…
            Session ID Length: 0
            Compression Methods Length: 1
            Compression Methods (1 method)
                Compression Method: null (0)
            Extensions Length: 88
            Extension: ec_point_formats (len=4)
                Type: ec_point_formats (11)
                Length: 4
                EC point formats Length: 3
                Elliptic curves point formats (3)
                    EC point format: uncompressed (0)
                    EC point format: ansiX962_compressed_prime (1)
                    EC point format: ansiX962_compressed_char2 (2)
            Extension: supported_groups (len=12)
                Type: supported_groups (10)
                Length: 12
                Supported Groups List Length: 10
                Supported Groups (5 groups)
                    Supported Group: x25519 (0x001d)
                    Supported Group: secp256r1 (0x0017)
                    Supported Group: x448 (0x001e)
                    Supported Group: secp521r1 (0x0019)
                    Supported Group: secp384r1 (0x0018)
            Extension: session_ticket (len=0)
                Type: session_ticket (35)
                Length: 0
                Data (0 bytes)
            Extension: encrypt_then_mac (len=0)
                Type: encrypt_then_mac (22)
                Length: 0
            Extension: extended_master_secret (len=0)
                Type: extended_master_secret (23)
                Length: 0
            Extension: signature_algorithms (len=48)
```

**Comment by trevorlinton** [comment]
I believe I figured this out.  If I set `proxy_ssl_server_name on` within nginx when I proxy back it adds the SNI server name to the TLS request and everything works fine (The SNI extension is missing in the Wireshark trace above). 

However with our older load balancer it would present a "default" dummy certificate (not even the same hostname!) then route based on the `Host` header. Which, obviously is incorrect.  I'm not sure if this is an issue with both our load balancer (f5) and/or nginx.  But I don't think this is a behavior I'd like to see in istio. 

I'm closing this out but do you think this is an F5 or nginx (or both) issue?
