### ISSUE TITLE
What are the solutions for kubelet health check failures when using ambient mode in Alibaba Cloud ACK clusters?

### ISSUE THREAD

**Issue by FIREcup** [istio/istio#58531]
istio version: 1.28.0
I found that the istio-cni component adds an SNAT rule, which causes health check failures. When I delete this rule, the health checks succeed. Is there a way to prevent istio-cni from automatically creating this rule, or are there other solutions?
`SNAT       tcp  --  *      *       0.0.0.0/0            0.0.0.0/0            owner socket exists match-set istio-inpod-probes-v4 dst to:169.254.7.127`

**Comment by sridhargaddam** [comment]
If your workload, namespace, or cluster enforces Kubernetes NetworkPolicy, you must allow both the IPv4 (`169.254.7.127`) and IPv6 (`fd16:9254:7127:1337:ffff:ffff:ffff:ffff`) addresses used by ambient mode. Depending on your CNI, packets with these addresses may otherwise be blocked, which will cause application pod health probes to fail once they join the ambient mesh.

For more details, see https://istio.io/latest/docs/ambient/usage/networkpolicy/#ambient-health-probes-and-kubernetes-networkpolicy

**Comment by FIREcup** [comment]
> If your workload, namespace, or cluster enforces Kubernetes NetworkPolicy, you must allow both the IPv4 (`169.254.7.127`) and IPv6 (`fd16:9254:7127:1337:ffff:ffff:ffff:ffff`) addresses used by ambient mode. Depending on your CNI, packets with these addresses may otherwise be blocked, which will cause application pod health probes to fail once they join the ambient mesh.
> 
> For more details, see https://istio.io/latest/docs/ambient/usage/networkpolicy/#ambient-health-probes-and-kubernetes-networkpolicy

I have seen this part of the documentation, but my cluster has already disabled NetworkPolicy, so I believe this is not due to NetworkPolicy.

**Comment by sridhargaddam** [comment]
The iptables rule exists to support kubelet health checks by rewriting traffic that comes from the node itself so the mesh can recognize it as probe traffic and skip policy enforcement. Looks like the iptable rule is not getting applied.

May i know the CNI that is used in your K8s ACK cluster?
Also, just to confirm, did you configure `PeerAuthentication` as strict in your mesh?

**Comment by FIREcup** [comment]
> The iptables rule exists to support kubelet health checks by rewriting traffic that comes from the node itself so the mesh can recognize it as probe traffic and skip policy enforcement. Looks like the iptable rule is not getting applied.
> 
> May i know the CNI that is used in your K8s ACK cluster? Also, just to confirm, did you configure `PeerAuthentication` as strict in your mesh?

This is the CNI plugin being used: [[Link](GitHub - AliyunContainerService/terway)](https://github.com/AliyunContainerService/terway).
I do not configure `PeerAuthentication `.
Through packet capture analysis, I found that an RST packet is ultimately sent, which appears abnormal.
`16:05:12.857367 IP 169.254.7.127.47916 > 10.30.80.18.cslistener: Flags [S], seq 51805656, win 65535, options [mss 1460,sackOK,TS val 3619895142 ecr 0,nop,wscale 9], length 0`
`16:05:12.857367 IP 169.254.7.127.47918 > 10.30.80.18.cslistener: Flags [S], seq 399606690, win 65535, options [mss 1460,sackOK,TS val 3619895142 ecr 0,nop,wscale 9], length 0`
`16:05:12.857412 IP 10.30.80.18.cslistener > 169.254.7.127.47916: Flags [S.], seq 1069302020, ack 51805657, win 65535, options [mss 1460,sackOK,TS val 2486774019 ecr 3619895142,nop,wscale 9], length 0`
`16:05:12.857413 IP 10.30.80.18.cslistener > 169.254.7.127.47918: Flags [S.], seq 4089071608, ack 399606691, win 65535, options [mss 1460,sackOK,TS val 2486774019 ecr 3619895142,nop,wscale 9], length 0`
`16:05:12.859210 IP 169.254.7.127.47918 > 10.30.80.18.cslistener: Flags [R], seq 399606691, win 65535, length 0`
`16:05:12.859432 IP 169.254.7.127.47916 > 10.30.80.18.cslistener: Flags [R], seq 51805657, win 65535, length 0`
Additionally, I noticed that in EKS, istio-cni does not create this SNAT rule. Could it be that Istio's adaptation for terway is not yet optimal?

**Comment by sridhargaddam** [comment]
> I do not configure PeerAuthentication 

Interesting. When `PeerAuthentication` is in `Permissive` mode instead of `STRICT`, the health checks should still pass even without the SNAT rule being triggered.

> Additionally, I noticed that in EKS, istio-cni does not create this SNAT rule...

AFAICT, when using the Ambient mode, the IstioCNI would program the SNAT rule on the host network for all the CNIs.

**Comment by sridhargaddam** [comment]
> This is the CNI plugin being used: [[Link](GitHub - AliyunContainerService/terway)](https://github.com/AliyunContainerService/terway).

It looks like the CNI is using eBPF. Looping @howardjohn, @keithmattix and @ilrudie for their thoughts.

**Comment by FIREcup** [comment]
> > I do not configure PeerAuthentication
> 
> Interesting. When `PeerAuthentication` is in `Permissive` mode instead of `STRICT`, the health checks should still pass even without the SNAT rule being triggered.
> 
> > Additionally, I noticed that in EKS, istio-cni does not create this SNAT rule...
> 
> AFAICT, when using the Ambient mode, the IstioCNI would program the SNAT rule on the host network for all the CNIs.

OK, I see it.

**Comment by ilrudie** [comment]
> Interesting. When PeerAuthentication is in Permissive mode instead of STRICT, the health checks should still pass even without the SNAT rule being triggered.

If you have some AuthorizationPolicy that makes an assertion about identity it's going to reject probes (not just probes but any traffic which has no identity).

If their CNI is somehow causing the probes to skip our SNAT rule, I would expect this traffic to be going through ztunnel which can log why it is rejecting the probes.

(edit) After rereading, it seems like the CNI may be preventing the SNAT'd probes from reaching ztunnel at all so maybe there would be no logging at all from ztunnel regarding probe traffic.

**Comment by ilrudie** [comment]
Looking at the terway docs, they have a lot of references to cilium and cilium args. Not clear on the exact relation, but it might be worth checking out https://istio.io/latest/docs/ambient/install/platform-prerequisites/#cilium which highlights the requirements for installing in ambient mode on top of cilium. Unclear if there is some 1:1 mapping of cilium settings to terway, but it could be a useful jumping off point.

**Comment by FIREcup** [comment]
> Looking at the terway docs, they have a lot of references to cilium and cilium args. Not clear on the exact relation, but it might be worth checking out https://istio.io/latest/docs/ambient/install/platform-prerequisites/#cilium which highlights the requirements for installing in ambient mode on top of cilium. Unclear if there is some 1:1 mapping of cilium settings to terway, but it could be a useful jumping off point.

I tried switching the CNI to Flannel, and the health checks started working normally. It appears the issue lies specifically with the Terway CNI. I will try to confirm with the cloud provider if there are any solutions. Thank you.

**Comment by ilrudie** [comment]
Thanks @FIREcup
