### DISCUSSION TITLE
AWS NLB resets small % of packets randomly on Istio 1.18.5

### DISCUSSION THREAD

**Discussion by RicHincapie** [istio/istio#49043] [Q&A]
Hi all.

We have services communicating over two clusters trough a AWS NLB. One port's (9443) using Istio mTSL and the other on 443 is using HTTPS. 443 does not have any issue. Only 9443. This is happening under functional testing, not huge loads or something. Is not a long standing connection, only a POST with a 3k to 5k bytes body. Good responses avr. 1.5 secs in latency.

_Most requests to the same service:9443 are successful_, but a little % fails. The TCP dump shows the server-side is RST the connection before initiating response, like
```
24        11:36:51,684705        123.456.789        111.222.33.444        TLSv1.2        3497        Application Data
25        11:36:51,685482        111.222.33.444        123.456.789        TCP        56        9443 → 35098 [RST, ACK] Seq=1 Ack=1449 Win=443 Len=0
27        11:36:51,686039        111.222.33.444        123.456.789        TCP        56        9443 → 35098 [RST, ACK] Seq=1 Ack=2897 Win=443 Len=0
28        11:36:51,686044        111.222.33.444        123.456.789        TCP        56        9443 → 35098 [RST, ACK] Seq=1 Ack=3430 Win=443 Len=0
``` 
On the ingress server-side, we see:
```
1        16:49:55,293140        123.456.789        111.222.33.444        TCP        74        46692 → 9443 [SYN] Seq=0 Win=8961 Len=0 MSS=8361 SACK_PERM=1 TSval=1460679207 TSecr=0 WS=1
2        16:49:55,293159        111.222.33.444        123.456.789        TCP        74        9443 → 46692 [SYN, ACK] Seq=0 Ack=1 Win=62643 Len=0 MSS=8961 SACK_PERM=1 TSval=1857680324 TSecr=1460679207 WS=128
3        16:49:55,293957        123.456.789        111.222.33.444        TCP        66        46692 → 9443 [ACK] Seq=1 Ack=1 Win=8961 Len=0 TSval=1460679208 TSecr=1857680324
4        16:49:55,293958        123.456.789        111.222.33.444        PROXYv2        89        46692 → 9443 [PSH, ACK] Seq=1 Ack=1 Win=8961 Len=23 TSval=1460679208 TSecr=1857680324
5        16:49:55,294003        111.222.33.444        123.456.789        TCP        66        9443 → 46692 [ACK] Seq=1 Ack=24 Win=62720 Len=0 TSval=1857680325 TSecr=1460679208
6        16:49:55,294018        123.456.789        111.222.33.444        TCP        66        46692 → 9443 [FIN, ACK] Seq=24 Ack=1 Win=8961 Len=0 TSval=1460679208 TSecr=1857680324
7        16:49:55,294140        111.222.33.444        123.456.789        TCP        66        9443 → 46692 [RST, ACK] Seq=1 Ack=25 Win=62720 Len=0 TSval=1857680325 TSecr=1460679208
```

The ingress in the server-side does not sees any failed package or any issue at all, logs are clean, and the NLB reset count is very low.

- Proxy-protocol filter is in place
- Cross-zone loadbalancing has been activated with no success.
- NLB has been recreated.

Has anybody faced a similar issue or may I get hints on a debug path?

Thanks!
