### DISCUSSION TITLE
Troubleshooting Istio with NGINX Ingress Controller

### DISCUSSION THREAD

**Discussion by adam-aph2** [istio/istio#48608] [Q&A] [answered]
Hi All. I'm gaining experience with Istio and most features work out of the box, which is great. I have however few cases which are somehow problematic to me, and this is one of them.
I'm doing all my tests in AWS with EKS 1.27 and Istio 1.15.2 (cannot really upgrade to higher versions because of other dependencies).

I wanted to build that simple scenario:
<img src="https://github.com/istio/istio/assets/97974298/94eb5c51-cc86-4278-88f4-5e457cf07020" width="500">

Ingress controller has been instantiated this way:
```
resource "helm_release" "nginx-ingress-external" {
  name = "nginx-ingress-ext"
  namespace = kubernetes_namespace.nginx-system.metadata[0].name
  repository = "https://helm.nginx.com/stable"
  chart = "nginx-ingress"
  version = "1.0.2"

  dynamic "set" {
    for_each = {
      "securityContext.runAsNonRoot" = true
      "service.ports.http" = "80"
      "service.ports.https" = "443"
      "controller.service.type" = "LoadBalancer"
    }
    content {
      name  = set.key
      value = set.value
    }
  }

#  this works for nginx community version
  values = [
    yamlencode(
      {
        labels = {
        }
        controller = {
          service = {
            annotations = {
              "traffic.sidecar.istio.io/includeInboundPorts"     = ""
              "traffic.sidecar.istio.io/excludeInboundPorts"     = "80,443"
              "traffic.sidecar.istio.io/excludeOutboundIPRanges" = "172.20.0.1/32"
              "sidecar.istio.io/inject"                          = "true"     # to make sure envoy will be injected

              "service.beta.kubernetes.io/aws-load-balancer-backend-protocol" = "tcp"
              "service.beta.kubernetes.io/aws-load-balancer-connection-idle-timeout" = "60"
              "service.beta.kubernetes.io/aws-load-balancer-cross-zone-load-balancing-enabled" = "true"
              "service.beta.kubernetes.io/aws-load-balancer-type" = "nlb"
              "service.beta.kubernetes.io/aws-load-balancer-scheme" = "internet-facing"
              "service.beta.kubernetes.io/aws-load-balancer-internal" = "false"
              "service.beta.kubernetes.io/aws-load-balancer-nlb-target-type" = "ip"
              "service.beta.kubernetes.io/aws-load-balancer-subnets" = "subnet-x1, subnet-x2, subnet-x3"
            }
          }
        }
      }
    )
  ]
  depends_on = [
    kubernetes_namespace.nginx-system
  ]
}
```
And this is the setup for Istio and the App:
```
---
apiVersion: v1
kind: Service
metadata:
  name: game-nginx-api-srv
  namespace: game-nginx
  labels:
    app.kubernetes.io/name: game-nginx-api
    app.kubernetes.io/instance: game-nginx-api
spec:
  ports:
  - name: http
    port: 8080
    targetPort: 80
    protocol: TCP
  selector:
    app: game-nginx-api
  type: ClusterIP
---
apiVersion: networking.istio.io/v1beta1
kind: VirtualService
metadata:
  name: game-nginx-vs
  namespace: game-nginx
spec:
  exportTo:
    - "*"
  hosts:
    - game-nginx-api-srv.game-nginx.svc.cluster.local
  gateways:
    - mesh
  http:
    - match:
        - port: 80     
        - uri:
            prefix: /game2
      route:
        - destination:
            host: game-nginx-api-srv.game-nginx.svc.cluster.local
            subset: game-nginx-api-srv
            port:
              number: 8080    
---
apiVersion: networking.istio.io/v1beta1
kind: DestinationRule
metadata:
  name: game-nginx-dr
  namespace: game-nginx
spec:
  workloadSelector:
    matchLabels:
      app: game-nginx-api
  host: game-nginx-api-srv.game-nginx.svc.cluster.local
  subsets:
    - name: game-nginx-api-srv
      labels:
        app: game-nginx-api
---
apiVersion: networking.k8s.io/v1
kind: Ingress
metadata:
  name:  game-nginx-ingress
  namespace: game-nginx
  annotations:
    kubernetes.io/ingress.class: "nginx"
    nginx.ingress.kubernetes.io/service-upstream: "true"
    nginx.ingress.kubernetes.io/upstream-vhost: game-nginx-api-srv.game-nginx.svc.cluster.local
spec:
  ingressClassName: nginx
  rules:
    - host: game-nginx-api-srv.game-nginx.svc.cluster.local
      http:
        paths:
          - path: /game2
            pathType: Prefix
            backend:
              service:
                name: game-nginx-api-srv
                port:
                  number: 80
```
Istio doesn't see any obvious configuration errors:
```
kubectl istio analyze -n game-nginx
✔ No validation issues found when analyzing namespace: game-nginx.
```
The test is failing, when running curl from home computer:
```
curl -v -H "Host: game-nginx-api-srv.game-nginx.svc.cluster.local" -H "Content-Type: application/json"  http://xyz.elb.us-east-2.amazonaws.com/game2
  *   Trying a.b.c.d:80...
  * Connected to xyz.elb.us-east-2.amazonaws.com (a.b.c.d) port 80 (#0)
  > GET /game2 HTTP/1.1
  > Host: game-nginx-api-srv.game-nginx.svc.cluster.local
  > User-Agent: curl/8.0.1
  > Accept: */*
  > Content-Type: application/json
  >
  * Recv failure: Connection was reset
  * Closing connection 0
  curl: (56) Recv failure: Connection was reset
```
I enabled debug logs at nginx controller Pod and see this:
```
2024-01-02T14:00:42.634837Z     debug   envoy filter    tls inspector: new connection accepted
2024-01-02T14:00:42.639314Z     debug   envoy conn_handler      closing connection from my.home.ip.addr:8309: no matching filter chain found
[2024-01-02T14:00:42.634Z] Host:- Method:- OrPath:- Proto:- RespC:0 RespFl:NR BytesRcv:0 BytesSent:0 Dur:5 RespTime:- ReqForw:- ReqUser:- ReqId:- ReqAuth:- UpstHost:- RoutName:- UpsClust:- UpsLocAddr:- DownLocAddr:nginx.ingress.controller.pod:80 DownRemAddr:my.home.ip.addr:8309 ReqServName:- IstioPolicyStatus:- UpsTranFailReason:-
```
'Host' in access log is `Host:%REQ(HOST)%`, does it mean that Nginx is not forwarding Host to envoy proxy and this is the reason for missing routing?

Here is also list of listeners on this Nginx controller:
```
ADDRESS        PORT  MATCH                                                                    DESTINATION
0.0.0.0        1     Trans: raw_buffer; App: http/1.1,h2c                                     Route: 1
0.0.0.0        1     ALL                                                                      Non-HTTP/Non-TCP
172.20.0.10    53    ALL                                                                      Cluster: outbound|53||kube-dns.kube-system.svc.cluster.local
0.0.0.0        80    Trans: raw_buffer; App: http/1.1,h2c                                     Route: 80
0.0.0.0        80    ALL                                                                      Non-HTTP/Non-TCP
172.20.0.1     443   ALL                                                                      Cluster: outbound|443||kubernetes.default.svc.cluster.local
172.20.131.205 443   Trans: raw_buffer; App: http/1.1,h2c                                     Route: calico-api.calico-apiserver.svc.cluster.local:443
172.20.131.205 443   ALL                                                                      Cluster: outbound|443||calico-api.calico-apiserver.svc.cluster.local
172.20.150.227 443   ALL                                                                      Cluster: outbound|443||istio-egressgateway.istio-system.svc.cluster.local
172.20.165.93  443   ALL                                                                      Cluster: outbound|443||cert-manager-webhook.istio-system.svc.cluster.local
172.20.196.244 443   Trans: raw_buffer; App: http/1.1,h2c                                     Route: jaeger-operator-webhook-service.istio-system.svc.cluster.local:443
172.20.196.244 443   ALL                                                                      Cluster: outbound|443||jaeger-operator-webhook-service.istio-system.svc.cluster.local
172.20.24.183  443   ALL                                                                      Cluster: outbound|443||istiod.istio-system.svc.cluster.local
172.20.37.93   443   ALL                                                                      Cluster: outbound|443||istio-ingressgateway-alb.istio-system.svc.cluster.local
172.20.7.182   443   ALL                                                                      Cluster: outbound|443||nginx-ingress-ext-controller.nginx-system.svc.cluster.local
172.20.71.21   443   ALL                                                                      Cluster: outbound|443||istio-ingressgateway.istio-system.svc.cluster.local
172.20.80.111  443   Trans: raw_buffer; App: http/1.1,h2c                                     Route: aws-load-balancer-webhook-service.kube-system.svc.cluster.local:443
172.20.80.111  443   ALL                                                                      Cluster: outbound|443||aws-load-balancer-webhook-service.kube-system.svc.cluster.local
0.0.0.0        4317  Trans: raw_buffer; App: http/1.1,h2c                                     Route: 4317
0.0.0.0        4317  ALL                                                                      Non-HTTP/Non-TCP
0.0.0.0        4318  Trans: raw_buffer; App: http/1.1,h2c                                     Route: 4318
0.0.0.0        4318  ALL                                                                      Non-HTTP/Non-TCP
172.20.239.109 5473  Trans: raw_buffer; App: http/1.1,h2c                                     Route: calico-typha.calico-system.svc.cluster.local:5473
172.20.239.109 5473  ALL                                                                      Cluster: outbound|5473||calico-typha.calico-system.svc.cluster.local
0.0.0.0        5778  Trans: raw_buffer; App: http/1.1,h2c                                     Route: 5778
0.0.0.0        5778  ALL                                                                      Non-HTTP/Non-TCP
0.0.0.0        8080  Trans: raw_buffer; App: http/1.1,h2c                                     Route: 8080
0.0.0.0        8080  ALL                                                                      Non-HTTP/Non-TCP
172.20.37.93   8080  Trans: raw_buffer; App: http/1.1,h2c                                     Route: istio-ingressgateway-alb.istio-system.svc.cluster.local:8080
172.20.37.93   8080  ALL                                                                      Cluster: outbound|8080||istio-ingressgateway-alb.istio-system.svc.cluster.local
0.0.0.0        8180  Trans: raw_buffer; App: http/1.1,h2c                                     Route: 8180
0.0.0.0        8180  ALL                                                                      Non-HTTP/Non-TCP
172.20.150.227 8180  ALL                                                                      Cluster: outbound|8180||istio-egressgateway.istio-system.svc.cluster.local
172.20.158.126 8383  Trans: raw_buffer; App: http/1.1,h2c                                     Route: jaeger-operator-metrics.istio-system.svc.cluster.local:8383
172.20.158.126 8383  ALL                                                                      Cluster: outbound|8383||jaeger-operator-metrics.istio-system.svc.cluster.local
172.20.37.93   8443  Trans: raw_buffer; App: http/1.1,h2c                                     Route: istio-ingressgateway-alb.istio-system.svc.cluster.local:8443
172.20.37.93   8443  ALL                                                                      Cluster: outbound|8443||istio-ingressgateway-alb.istio-system.svc.cluster.local
172.20.71.21   8443  ALL                                                                      Cluster: outbound|8443||istio-ingressgateway.istio-system.svc.cluster.local
0.0.0.0        9090  Trans: raw_buffer; App: http/1.1,h2c                                     Route: 9090
0.0.0.0        9090  ALL                                                                      Non-HTTP/Non-TCP
10.100.83.231  9094  Trans: raw_buffer; App: http/1.1,h2c                                     Route: calico-kube-controllers-metrics.calico-system.svc.cluster.local:9094
10.100.83.231  9094  ALL                                                                      Cluster: outbound|9094||calico-kube-controllers-metrics.calico-system.svc.cluster.local
172.20.0.10    9153  Trans: raw_buffer; App: http/1.1,h2c                                     Route: kube-dns.kube-system.svc.cluster.local:9153
172.20.0.10    9153  ALL                                                                      Cluster: outbound|9153||kube-dns.kube-system.svc.cluster.local
172.20.158.127 9402  ALL                                                                      Cluster: outbound|9402||cert-manager.istio-system.svc.cluster.local
0.0.0.0        9411  Trans: raw_buffer; App: http/1.1,h2c                                     Route: 9411
0.0.0.0        9411  ALL                                                                      Non-HTTP/Non-TCP
0.0.0.0        14250 Trans: raw_buffer; App: http/1.1,h2c                                     Route: 14250
0.0.0.0        14250 ALL                                                                      Non-HTTP/Non-TCP
0.0.0.0        14267 Trans: raw_buffer; App: http/1.1,h2c                                     Route: 14267
0.0.0.0        14267 ALL                                                                      Non-HTTP/Non-TCP
0.0.0.0        14268 Trans: raw_buffer; App: http/1.1,h2c                                     Route: 14268
0.0.0.0        14268 ALL                                                                      Non-HTTP/Non-TCP
10.100.51.189  14269 Trans: raw_buffer; App: http/1.1,h2c                                     Route: jaeger-collector-headless.istio-system.svc.cluster.local:14269
10.100.51.189  14269 ALL                                                                      Cluster: outbound|14269||jaeger-collector-headless.istio-system.svc.cluster.local
172.20.211.170 14269 Trans: raw_buffer; App: http/1.1,h2c                                     Route: jaeger-collector.istio-system.svc.cluster.local:14269
172.20.211.170 14269 ALL                                                                      Cluster: outbound|14269||jaeger-collector.istio-system.svc.cluster.local
10.100.51.189  14271 Trans: raw_buffer; App: http/1.1,h2c                                     Route: jaeger-agent.istio-system.svc.cluster.local:14271
10.100.51.189  14271 ALL                                                                      Cluster: outbound|14271||jaeger-agent.istio-system.svc.cluster.local
0.0.0.0        15001 Addr: *:15001                                                            Non-HTTP/Non-TCP
0.0.0.0        15001 ALL                                                                      Non-HTTP/Non-TCP
0.0.0.0        15006 Addr: *:15006                                                            Non-HTTP/Non-TCP
0.0.0.0        15006 Trans: tls; App: istio-http/1.0,istio-http/1.1,istio-h2; Addr: 0.0.0.0/0 InboundPassthroughClusterIpv4
0.0.0.0        15006 Trans: tls; Addr: 0.0.0.0/0                                              InboundPassthroughClusterIpv4
0.0.0.0        15006 Trans: tls; Addr: *:80                                                   Cluster: inbound|80||
0.0.0.0        15006 Trans: tls; Addr: *:443                                                  Cluster: inbound|443||
0.0.0.0        15010 Trans: raw_buffer; App: http/1.1,h2c                                     Route: 15010
0.0.0.0        15010 ALL                                                                      Non-HTTP/Non-TCP
172.20.24.183  15012 ALL                                                                      Cluster: outbound|15012||istiod.istio-system.svc.cluster.local
0.0.0.0        15014 Trans: raw_buffer; App: http/1.1,h2c                                     Route: 15014
0.0.0.0        15014 ALL                                                                      Non-HTTP/Non-TCP
0.0.0.0        15021 ALL                                                                      Inline Route: /healthz/ready*
172.20.150.227 15021 Trans: raw_buffer; App: http/1.1,h2c                                     Route: istio-egressgateway.istio-system.svc.cluster.local:15021
172.20.150.227 15021 ALL                                                                      Cluster: outbound|15021||istio-egressgateway.istio-system.svc.cluster.local
172.20.37.93   15021 Trans: raw_buffer; App: http/1.1,h2c                                     Route: istio-ingressgateway-alb.istio-system.svc.cluster.local:15021
172.20.37.93   15021 ALL                                                                      Cluster: outbound|15021||istio-ingressgateway-alb.istio-system.svc.cluster.local
172.20.71.21   15021 Trans: raw_buffer; App: http/1.1,h2c                                     Route: istio-ingressgateway.istio-system.svc.cluster.local:15021
172.20.71.21   15021 ALL                                                                      Cluster: outbound|15021||istio-ingressgateway.istio-system.svc.cluster.local
0.0.0.0        15090 ALL                                                                      Inline Route: /stats/prometheus*
0.0.0.0        16685 Trans: raw_buffer; App: http/1.1,h2c                                     Route: 16685
0.0.0.0        16685 ALL                                                                      Non-HTTP/Non-TCP
0.0.0.0        16686 Trans: raw_buffer; App: http/1.1,h2c                                     Route: 16686
0.0.0.0        16686 ALL                                                                      Non-HTTP/Non-TCP
172.20.204.117 16687 Trans: raw_buffer; App: http/1.1,h2c                                     Route: jaeger-query.istio-system.svc.cluster.local:16687
172.20.204.117 16687 ALL                                                                      Cluster: outbound|16687||jaeger-query.istio-system.svc.cluster.local
0.0.0.0        20001 Trans: raw_buffer; App: http/1.1,h2c                                     Route: 20001
0.0.0.0        20001 ALL                                                                      Non-HTTP/Non-TCP
```
And list of clusters:
```
SERVICE FQDN                                                        PORT      SUBSET     DIRECTION     TYPE             DESTINATION RULE
                                                                    80        -          inbound       ORIGINAL_DST
                                                                    443       -          inbound       ORIGINAL_DST
BlackHoleCluster                                                    -         -          -             STATIC
InboundPassthroughClusterIpv4                                       -         -          -             ORIGINAL_DST
PassthroughCluster                                                  -         -          -             ORIGINAL_DST
agent                                                               -         -          -             STATIC
aws-load-balancer-webhook-service.kube-system.svc.cluster.local     443       -          outbound      EDS
calico-api.calico-apiserver.svc.cluster.local                       443       -          outbound      EDS
calico-kube-controllers-metrics.calico-system.svc.cluster.local     9094      -          outbound      ORIGINAL_DST
calico-typha.calico-system.svc.cluster.local                        5473      -          outbound      EDS
cc-api.cc.svc.cluster.local                                         8080      -          outbound      EDS
cert-manager-webhook.istio-system.svc.cluster.local                 443       -          outbound      EDS
cert-manager.istio-system.svc.cluster.local                         9402      -          outbound      EDS
clients-api.clients.svc.cluster.local                               8080      -          outbound      EDS
dikastes.calico.cluster.local                                       1         -          outbound      EDS              dikastes-mtls.istio-system
game-alb-api-srv.game-alb.svc.cluster.local                         8080      -          outbound      EDS
game-nginx-api-srv.game-nginx.svc.cluster.local                     8080      -          outbound      EDS
istio-egressgateway.istio-system.svc.cluster.local                  80        -          outbound      EDS
istio-egressgateway.istio-system.svc.cluster.local                  443       -          outbound      EDS
istio-egressgateway.istio-system.svc.cluster.local                  8080      -          outbound      EDS
istio-egressgateway.istio-system.svc.cluster.local                  8180      -          outbound      EDS
istio-egressgateway.istio-system.svc.cluster.local                  15021     -          outbound      EDS
istio-ingressgateway-alb.istio-system.svc.cluster.local             80        -          outbound      EDS
istio-ingressgateway-alb.istio-system.svc.cluster.local             443       -          outbound      EDS
istio-ingressgateway-alb.istio-system.svc.cluster.local             8080      -          outbound      EDS
istio-ingressgateway-alb.istio-system.svc.cluster.local             8443      -          outbound      EDS
istio-ingressgateway-alb.istio-system.svc.cluster.local             15021     -          outbound      EDS
istio-ingressgateway.istio-system.svc.cluster.local                 80        -          outbound      EDS
istio-ingressgateway.istio-system.svc.cluster.local                 443       -          outbound      EDS
istio-ingressgateway.istio-system.svc.cluster.local                 8080      -          outbound      EDS
istio-ingressgateway.istio-system.svc.cluster.local                 8180      -          outbound      EDS
istio-ingressgateway.istio-system.svc.cluster.local                 8443      -          outbound      EDS
istio-ingressgateway.istio-system.svc.cluster.local                 15021     -          outbound      EDS
istiod.istio-system.svc.cluster.local                               443       -          outbound      EDS
istiod.istio-system.svc.cluster.local                               15010     -          outbound      EDS
istiod.istio-system.svc.cluster.local                               15012     -          outbound      EDS
istiod.istio-system.svc.cluster.local                               15014     -          outbound      EDS
jaeger-agent.istio-system.svc.cluster.local                         5778      -          outbound      ORIGINAL_DST
jaeger-agent.istio-system.svc.cluster.local                         14271     -          outbound      ORIGINAL_DST
jaeger-collector-headless.istio-system.svc.cluster.local            4317      -          outbound      ORIGINAL_DST
jaeger-collector-headless.istio-system.svc.cluster.local            4318      -          outbound      ORIGINAL_DST
jaeger-collector-headless.istio-system.svc.cluster.local            9411      -          outbound      ORIGINAL_DST
jaeger-collector-headless.istio-system.svc.cluster.local            14250     -          outbound      ORIGINAL_DST
jaeger-collector-headless.istio-system.svc.cluster.local            14267     -          outbound      ORIGINAL_DST
jaeger-collector-headless.istio-system.svc.cluster.local            14268     -          outbound      ORIGINAL_DST
jaeger-collector-headless.istio-system.svc.cluster.local            14269     -          outbound      ORIGINAL_DST
jaeger-collector.istio-system.svc.cluster.local                     4317      -          outbound      EDS
jaeger-collector.istio-system.svc.cluster.local                     4318      -          outbound      EDS
jaeger-collector.istio-system.svc.cluster.local                     9411      -          outbound      EDS
jaeger-collector.istio-system.svc.cluster.local                     14250     -          outbound      EDS
jaeger-collector.istio-system.svc.cluster.local                     14267     -          outbound      EDS
jaeger-collector.istio-system.svc.cluster.local                     14268     -          outbound      EDS
jaeger-collector.istio-system.svc.cluster.local                     14269     -          outbound      EDS
jaeger-operator-metrics.istio-system.svc.cluster.local              8383      -          outbound      EDS
jaeger-operator-webhook-service.istio-system.svc.cluster.local      443       -          outbound      EDS
jaeger-query.istio-system.svc.cluster.local                         16685     -          outbound      EDS
jaeger-query.istio-system.svc.cluster.local                         16686     -          outbound      EDS
jaeger-query.istio-system.svc.cluster.local                         16687     -          outbound      EDS
kiali.istio-system.svc.cluster.local                                9090      -          outbound      EDS
kiali.istio-system.svc.cluster.local                                20001     -          outbound      EDS
kube-dns.kube-system.svc.cluster.local                              53        -          outbound      EDS
kube-dns.kube-system.svc.cluster.local                              9153      -          outbound      EDS
kubernetes.default.svc.cluster.local                                443       -          outbound      EDS
nginx-ingress-ext-controller.nginx-system.svc.cluster.local         80        -          outbound      EDS
nginx-ingress-ext-controller.nginx-system.svc.cluster.local         443       -          outbound      EDS
orders-api.orders.svc.cluster.local                                 8080      -          outbound      EDS
payment-api.payment.svc.cluster.local                               8080      -          outbound      EDS
prometheus.istio-system.svc.cluster.local                           9090      -          outbound      EDS
prometheus_stats                                                    -         -          -             STATIC
sds-grpc                                                            -         -          -             STATIC
xds-grpc                                                            -         -          -             STATIC
zipkin                                                              -         -          -             STRICT_DNS
```

Is there anything else should I check? Any obvious errors in my configuration? Any pointers are appreciated.

**Comment by adam-aph2** [comment]
I did one more attempt - fresh cluster with EKS 1.28 and Istio 1.20.1, this time nothing else in the system (in previous tests I had also integrated Calico with it). Still the same error.

**Reply by zirain** [reply]
Can I ask a stupid question? why do you need ingress here? why not use istio Ingress Gateway?

**Reply by adam-aph2** [reply]
Well, we want to use both. Most UC can go through standard Istio Ingress Gateway, but there are few UC where we still need to do some conditional header manipulations before routing and we are not ready to give up on this yet.

I found many examples where it simply works, so I try to understand/troubleshoot what is different on my side that I cannot make it working.

**Comment by adam-aph2** [comment]
Worker node is receiving proper GET request on port 80:
```
16:00:01.721152 IP ip-10-100-97-163.internal.29639 > ip-10-100-30-43.internal.http: Flags [P.], seq 2899501712:2899501859, ack 1841962271, win 1026, length 147: HTTP: GET /game2 HTTP/1.1
E...w.@.m..y
da.
d.+s..P....m...P....j..GET /game2 HTTP/1.1
Host: game-nginx-api-srv.game-nginx.svc.cluster.local
User-Agent: curl/8.0.1
Accept: */*
Content-Type: application/json
```
Then sidecar in the nginx-ingress Pod should ignore ports 80,443 so the flow should be nginx-ingress:80 -> game-nginx-api-srv:80 and the  sidecar in game Pod should intercept the traffic, right? But it seems like sidecar in nginx-ingress is already intercepting the traffic from port 80 and that creates missing route error? Is this some Istio bug?

Here is description of nginx-ingress service:
```
Name:                     nginx-ingress-ext-controller
Namespace:                nginx-system
Labels:                   app.kubernetes.io/instance=nginx-ingress-ext
                          app.kubernetes.io/managed-by=Helm
                          app.kubernetes.io/name=nginx-ingress
                          app.kubernetes.io/version=3.3.2
                          helm.sh/chart=nginx-ingress-1.0.2
Annotations:              meta.helm.sh/release-name: nginx-ingress-ext
                          meta.helm.sh/release-namespace: nginx-system
                          service.beta.kubernetes.io/aws-load-balancer-backend-protocol: tcp
                          service.beta.kubernetes.io/aws-load-balancer-connection-idle-timeout: 60
                          service.beta.kubernetes.io/aws-load-balancer-cross-zone-load-balancing-enabled: true
                          service.beta.kubernetes.io/aws-load-balancer-internal: false
                          service.beta.kubernetes.io/aws-load-balancer-nlb-target-type: ip
                          service.beta.kubernetes.io/aws-load-balancer-scheme: internet-facing
                          service.beta.kubernetes.io/aws-load-balancer-subnets: subnet-x, subnet-y, subnet-z
                          service.beta.kubernetes.io/aws-load-balancer-type: nlb
                          sidecar.istio.io/inject: true
                          traffic.sidecar.istio.io/excludeInboundPorts: 80,443
                          traffic.sidecar.istio.io/excludeOutboundIPRanges: 172.20.0.1/32
                          traffic.sidecar.istio.io/includeInboundPorts:
Selector:                 app.kubernetes.io/instance=nginx-ingress-ext,app.kubernetes.io/name=nginx-ingress
Type:                     LoadBalancer
IP Family Policy:         SingleStack
IP Families:              IPv4
IP:                       172.20.44.63
IPs:                      172.20.44.63
LoadBalancer Ingress:     k8s-nginxsys-nginxing-xyz.amazonaws.com
Port:                     http  80/TCP
TargetPort:               80/TCP
NodePort:                 http  31521/TCP
Endpoints:                10.100.30.43:80
Port:                     https  443/TCP
TargetPort:               443/TCP
NodePort:                 https  31425/TCP
Endpoints:                10.100.30.43:443
Session Affinity:         None
External Traffic Policy:  Local
HealthCheck NodePort:     32478
Events:                   <none>
```
Sidecar should follow this annotation: `traffic.sidecar.istio.io/excludeInboundPorts: 80,443`
Here is the controller Pod description:
```
Name:             nginx-ingress-ext-controller-7b877d4b5b-vkf2z
Namespace:        nginx-system
Priority:         0
Service Account:  nginx-ingress-ext
Node:             ip-10-100-26-101.us-east-2.compute.internal/10.100.26.101
Start Time:       Tue, 09 Jan 2024 12:28:58 +0100
Labels:           app.kubernetes.io/instance=nginx-ingress-ext
                  app.kubernetes.io/name=nginx-ingress
                  app.kubernetes.io/version=3.3.2
                  app.nginx.org/version=1.25.3
                  pod-template-hash=7b877d4b5b
                  security.istio.io/tlsMode=istio
                  service.istio.io/canonical-name=nginx-ingress
                  service.istio.io/canonical-revision=latest
Annotations:      istio.io/rev: default
                  kubectl.kubernetes.io/default-container: nginx-ingress
                  kubectl.kubernetes.io/default-logs-container: nginx-ingress
                  prometheus.io/path: /stats/prometheus
                  prometheus.io/port: 15020
                  prometheus.io/scheme: http
                  prometheus.io/scrape: true
                  sidecar.istio.io/status:
                    {"initContainers":["istio-init"],"containers":["istio-proxy"],"volumes":["workload-socket","credential-socket","workload-certs","istio-env...
Status:           Running
IP:               10.100.30.43
IPs:
  IP:           10.100.30.43
Controlled By:  ReplicaSet/nginx-ingress-ext-controller-7b877d4b5b
Init Containers:
  istio-init:
    Container ID:  containerd://67b8ec605648baff4970051901cb673c867a2faf34e72b25a054692e44b8849a
    Image:         docker.io/istio/proxyv2:1.20.1
    Image ID:      docker.io/istio/proxyv2@sha256:d58efa92c283c26765a5cdb2d66c4a26ea6e9cb7042242dd2f8a89fc2a520f9c
    Port:          <none>
    Host Port:     <none>
    Args:
      istio-iptables
      -p
      15001
      -z
      15006
      -u
      1337
      -m
      REDIRECT
      -i
      *
      -x

      -b
      *
      -d
      15090,15021,15020
      --log_output_level=default:info
    State:          Terminated
      Reason:       Completed
      Exit Code:    0
      Started:      Tue, 09 Jan 2024 12:28:59 +0100
      Finished:     Tue, 09 Jan 2024 12:28:59 +0100
    Ready:          True
    Restart Count:  0
    Limits:
      cpu:     2
      memory:  1Gi
    Requests:
      cpu:        100m
      memory:     128Mi
    Environment:  <none>
    Mounts:
      /var/run/secrets/kubernetes.io/serviceaccount from kube-api-access-dvhmd (ro)
Containers:
  nginx-ingress:
    Container ID:  containerd://052e958938d4065d075db77ea7bbe7805cea7217297408c0339e76f4dd1c720a
    Image:         nginx/nginx-ingress:3.3.2
    Image ID:      docker.io/nginx/nginx-ingress@sha256:e4fb2283d7f3d4bdba71f403e89be6cd20ec61628bf4e5d8bf661ca6b04256e7
    Ports:         80/TCP, 443/TCP, 9113/TCP, 8081/TCP
    Host Ports:    0/TCP, 0/TCP, 0/TCP, 0/TCP
    Args:
      -nginx-plus=false
      -nginx-reload-timeout=60000
      -enable-app-protect=false
      -enable-app-protect-dos=false
      -nginx-configmaps=$(POD_NAMESPACE)/nginx-ingress-ext
      -ingress-class=nginx
      -health-status=false
      -health-status-uri=/nginx-health
      -nginx-debug=false
      -v=1
      -nginx-status=true
      -nginx-status-port=8080
      -nginx-status-allow-cidrs=127.0.0.1
      -report-ingress-status
      -external-service=nginx-ingress-ext-controller
      -enable-leader-election=true
      -leader-election-lock-name=nginx-ingress-ext-leader-election
      -enable-prometheus-metrics=true
      -prometheus-metrics-listen-port=9113
      -prometheus-tls-secret=
      -enable-service-insight=false
      -service-insight-listen-port=9114
      -service-insight-tls-secret=
      -enable-custom-resources=true
      -enable-snippets=false
      -include-year=false
      -disable-ipv6=false
      -enable-tls-passthrough=false
      -enable-preview-policies=false
      -enable-cert-manager=false
      -enable-oidc=false
      -enable-external-dns=false
      -ready-status=true
      -ready-status-port=8081
      -enable-latency-metrics=false
    State:          Running
      Started:      Tue, 09 Jan 2024 12:29:11 +0100
    Last State:     Terminated
      Reason:       Error
      Exit Code:    255
      Started:      Tue, 09 Jan 2024 12:29:08 +0100
      Finished:     Tue, 09 Jan 2024 12:29:08 +0100
    Ready:          True
    Restart Count:  1
    Requests:
      cpu:      100m
      memory:   128Mi
    Readiness:  http-get http://:15020/app-health/nginx-ingress/readyz delay=0s timeout=1s period=1s #success=1 #failure=3
    Environment:
      POD_NAMESPACE:  nginx-system (v1:metadata.namespace)
      POD_NAME:       nginx-ingress-ext-controller-7b877d4b5b-vkf2z (v1:metadata.name)
    Mounts:
      /var/run/secrets/kubernetes.io/serviceaccount from kube-api-access-dvhmd (ro)
  istio-proxy:
    Container ID:  containerd://dd7974ea15e6c23e77262290e80c08522ec991cf6f35426e645a267ea36bf9e6
    Image:         docker.io/istio/proxyv2:1.20.1
    Image ID:      docker.io/istio/proxyv2@sha256:d58efa92c283c26765a5cdb2d66c4a26ea6e9cb7042242dd2f8a89fc2a520f9c
    Port:          15090/TCP
    Host Port:     0/TCP
    Args:
      proxy
      sidecar
      --domain
      $(POD_NAMESPACE).svc.cluster.local
      --proxyLogLevel=warning
      --proxyComponentLogLevel=misc:error
      --log_output_level=default:info
    State:          Running
      Started:      Tue, 09 Jan 2024 12:29:08 +0100
    Ready:          True
    Restart Count:  0
    Limits:
      cpu:     2
      memory:  1Gi
    Requests:
      cpu:      100m
      memory:   128Mi
    Readiness:  http-get http://:15021/healthz/ready delay=0s timeout=3s period=15s #success=1 #failure=4
    Startup:    http-get http://:15021/healthz/ready delay=0s timeout=3s period=1s #success=1 #failure=600
    Environment:
      JWT_POLICY:                    third-party-jwt
      PILOT_CERT_PROVIDER:           istiod
      CA_ADDR:                       istiod.istio-system.svc:15012
      POD_NAME:                      nginx-ingress-ext-controller-7b877d4b5b-vkf2z (v1:metadata.name)
      POD_NAMESPACE:                 nginx-system (v1:metadata.namespace)
      INSTANCE_IP:                    (v1:status.podIP)
      SERVICE_ACCOUNT:                (v1:spec.serviceAccountName)
      HOST_IP:                        (v1:status.hostIP)
      ISTIO_CPU_LIMIT:               2 (limits.cpu)
      PROXY_CONFIG:                  {}

      ISTIO_META_POD_PORTS:          [
                                         {"name":"http","containerPort":80,"protocol":"TCP"}
                                         ,{"name":"https","containerPort":443,"protocol":"TCP"}
                                         ,{"name":"prometheus","containerPort":9113,"protocol":"TCP"}
                                         ,{"name":"readiness-port","containerPort":8081,"protocol":"TCP"}
                                     ]
      ISTIO_META_APP_CONTAINERS:     nginx-ingress
      GOMEMLIMIT:                    1073741824 (limits.memory)
      GOMAXPROCS:                    2 (limits.cpu)
      ISTIO_META_CLUSTER_ID:         Kubernetes
      ISTIO_META_NODE_NAME:           (v1:spec.nodeName)
      ISTIO_META_INTERCEPTION_MODE:  REDIRECT
      ISTIO_META_WORKLOAD_NAME:      nginx-ingress-ext-controller
      ISTIO_META_OWNER:              kubernetes://apis/apps/v1/namespaces/nginx-system/deployments/nginx-ingress-ext-controller
      ISTIO_META_MESH_ID:            cluster.local
      TRUST_DOMAIN:                  cluster.local
      ISTIO_PROMETHEUS_ANNOTATIONS:  {"scrape":"true","path":"","port":"9113"}
      ISTIO_KUBE_APP_PROBERS:        {"/app-health/nginx-ingress/readyz":{"httpGet":{"path":"/nginx-ready","port":8081,"scheme":"HTTP"},"timeoutSeconds":1}}
    Mounts:
      /etc/istio/pod from istio-podinfo (rw)
      /etc/istio/proxy from istio-envoy (rw)
      /var/lib/istio/data from istio-data (rw)
      /var/run/secrets/credential-uds from credential-socket (rw)
      /var/run/secrets/istio from istiod-ca-cert (rw)
      /var/run/secrets/kubernetes.io/serviceaccount from kube-api-access-dvhmd (ro)
      /var/run/secrets/tokens from istio-token (rw)
      /var/run/secrets/workload-spiffe-credentials from workload-certs (rw)
      /var/run/secrets/workload-spiffe-uds from workload-socket (rw)
Conditions:
  Type              Status
  Initialized       True
  Ready             True
  ContainersReady   True
  PodScheduled      True
Volumes:
  workload-socket:
    Type:       EmptyDir (a temporary directory that shares a pod's lifetime)
    Medium:
    SizeLimit:  <unset>
  credential-socket:
    Type:       EmptyDir (a temporary directory that shares a pod's lifetime)
    Medium:
    SizeLimit:  <unset>
  workload-certs:
    Type:       EmptyDir (a temporary directory that shares a pod's lifetime)
    Medium:
    SizeLimit:  <unset>
  istio-envoy:
    Type:       EmptyDir (a temporary directory that shares a pod's lifetime)
    Medium:     Memory
    SizeLimit:  <unset>
  istio-data:
    Type:       EmptyDir (a temporary directory that shares a pod's lifetime)
    Medium:
    SizeLimit:  <unset>
  istio-podinfo:
    Type:  DownwardAPI (a volume populated by information about the pod)
    Items:
      metadata.labels -> labels
      metadata.annotations -> annotations
  istio-token:
    Type:                    Projected (a volume that contains injected data from multiple sources)
    TokenExpirationSeconds:  43200
  istiod-ca-cert:
    Type:      ConfigMap (a volume populated by a ConfigMap)
    Name:      istio-ca-root-cert
    Optional:  false
  kube-api-access-dvhmd:
    Type:                    Projected (a volume that contains injected data from multiple sources)
    TokenExpirationSeconds:  3607
    ConfigMapName:           kube-root-ca.crt
    ConfigMapOptional:       <nil>
    DownwardAPI:             true
QoS Class:                   Burstable
Node-Selectors:              <none>
Tolerations:                 node.kubernetes.io/not-ready:NoExecute op=Exists for 300s
                             node.kubernetes.io/unreachable:NoExecute op=Exists for 300s
Events:                      <none>
```
`nginx-ingress` is listening to these: `Ports: 80/TCP, 443/TCP, 9113/TCP, 8081/TCP`
However what is this for `istio-proxy` : 
```
Host Port:     0/TCP

      ISTIO_META_POD_PORTS:          [
                                         {"name":"http","containerPort":80,"protocol":"TCP"}
                                         ,{"name":"https","containerPort":443,"protocol":"TCP"}
```

Does it mean Istio sidecar is ignoring this annotation: `traffic.sidecar.istio.io/excludeInboundPorts: 80,443` ?

**Reply by abasitt** [reply]
I am not able to understand clearly the UC you are trying. But to answer some of your questions.

> traffic.sidecar.istio.io/excludeInboundPorts: 80,443

This will ignore the incoming traffic to nginx pod from redirecting to sidecar. But the traffic after terminating on nginx and leaving out the nginx pod will still be redirected to the sidecar. You can exclude that too but not sure what will be the reason of using sidecar with nginx if you exclude both inbound and outbound ports. 

Earlier your comment.

> Then sidecar in the nginx-ingress Pod should ignore ports 80,443 so the flow should be nginx-ingress:80 -> game-nginx-api-srv:80 and the sidecar in game Pod should intercept the traffic, right?

If you want to achieve that, you have to exclude outboundports as well.

**Reply by adam-aph2** [reply]
Thanks @abasitt, maybe I was not fully clear - I try to build UC as depicted on the top diagram in this thread, basically enter the incoming requests into the Istio mesh through the NGINX proxy. So the flow which I want to achieve is rather this: 
`A:[http req] -> B:[aws nlb] -> C:[nginx] -> D:[nginx sidecar] -> E:[app sidecar] -> F:[app srv]`

I see routing errors in nginx sidecar access logs, so I'm not clear what is happening and trying to troubleshoot it. I see http requests coming to worker node on port 80, so it is either on `C` or `D` in the above flow:
```
10:17:29.598523 IP ip-10-100-190-97.internal.47222 > ip-10-100-30-43.internal.http: Flags [P.], seq 723222582:723222730, ack 894638680, win 229, options [nop,nop,TS val 1021980785 ecr 997058179], length 148: HTTP: GET /game2 HTTP/1.1
E(....@.%...
d.a
d.+.v.P+..65S.X....j7.....
<.0q;m..GET /game2 HTTP/1.1
User-Agent: curl/7.29.0
Accept: */*
Host: game-nginx-api-srv.game-nginx.svc.cluster.local
Content-Type: application/json
```
I cannot capture any traffic on this node on ports 15006 or 15001 and since I see some errors in nginx sidecar access logs would this mean that nginx sidecar is actually intercepting port 80?

Here is the iptables contents from this worker node:
```
Chain PREROUTING (policy ACCEPT 87308 packets, 5238K bytes)
 pkts bytes target     prot opt in     out     source               destination
 236K   14M ISTIO_INBOUND  tcp  --  *      *       0.0.0.0/0            0.0.0.0/0

Chain INPUT (policy ACCEPT 236K packets, 14M bytes)
 pkts bytes target     prot opt in     out     source               destination

Chain OUTPUT (policy ACCEPT 104K packets, 7407K bytes)
 pkts bytes target     prot opt in     out     source               destination
82349 4941K ISTIO_OUTPUT  tcp  --  *      *       0.0.0.0/0            0.0.0.0/0

Chain POSTROUTING (policy ACCEPT 104K packets, 7409K bytes)
 pkts bytes target     prot opt in     out     source               destination

Chain ISTIO_INBOUND (1 references)
 pkts bytes target     prot opt in     out     source               destination
    0     0 RETURN     tcp  --  *      *       0.0.0.0/0            0.0.0.0/0            tcp dpt:15008
    0     0 RETURN     tcp  --  *      *       0.0.0.0/0            0.0.0.0/0            tcp dpt:15090
 5459  328K RETURN     tcp  --  *      *       0.0.0.0/0            0.0.0.0/0            tcp dpt:15021
81849 4911K RETURN     tcp  --  *      *       0.0.0.0/0            0.0.0.0/0            tcp dpt:15020
 149K 8930K ISTIO_IN_REDIRECT  tcp  --  *      *       0.0.0.0/0            0.0.0.0/0

Chain ISTIO_IN_REDIRECT (3 references)
 pkts bytes target     prot opt in     out     source               destination
 149K 8930K REDIRECT   tcp  --  *      *       0.0.0.0/0            0.0.0.0/0            redir ports 15006

Chain ISTIO_OUTPUT (1 references)
 pkts bytes target     prot opt in     out     source               destination
82241 4934K RETURN     all  --  *      lo      127.0.0.6            0.0.0.0/0
    0     0 ISTIO_IN_REDIRECT  tcp  --  *      lo      0.0.0.0/0           !127.0.0.1            tcp dpt:!15008 owner UID match 1337
    4   240 RETURN     all  --  *      lo      0.0.0.0/0            0.0.0.0/0            ! owner UID match 1337
   60  3600 RETURN     all  --  *      *       0.0.0.0/0            0.0.0.0/0            owner UID match 1337
    0     0 ISTIO_IN_REDIRECT  tcp  --  *      lo      0.0.0.0/0           !127.0.0.1            tcp dpt:!15008 owner GID match 1337
    0     0 RETURN     all  --  *      lo      0.0.0.0/0            0.0.0.0/0            ! owner GID match 1337
    0     0 RETURN     all  --  *      *       0.0.0.0/0            0.0.0.0/0            owner GID match 1337
    0     0 RETURN     all  --  *      *       0.0.0.0/0            127.0.0.1
   44  2640 ISTIO_REDIRECT  all  --  *      *       0.0.0.0/0            0.0.0.0/0

Chain ISTIO_REDIRECT (1 references)
 pkts bytes target     prot opt in     out     source               destination
   44  2640 REDIRECT   tcp  --  *      *       0.0.0.0/0            0.0.0.0/0            redir ports 15001
```

**Reply by abasitt** [reply]
based on the logs you shared earlier.

> [2024-01-02T14:00:42.634Z] Host:- Method:- OrPath:- Proto:- RespC:0 RespFl:NR BytesRcv:0 BytesSent:0 Dur:5 RespTime:- ReqForw:- ReqUser:- ReqId:- ReqAuth:- UpstHost:- RoutName:- UpsClust:- UpsLocAddr:- DownLocAddr:nginx.ingress.controller.pod:80 DownRemAddr:my.home.ip.addr:8309 ReqServName:- IstioPolicyStatus:- UpsTranFailReason:-

it seems like the request capture you are seeing is at D and dying right here. You are right nginx sidecar is intercepting correctly. Some of additional suggestions.

1. Can you make sure nginx does forward the header correctly ? e.g. in envoylogs i don't see any upstHost,upstClust.
2. You should enable envoy access-logging, You will get a better idea where is the request dying. [https://istio.io/latest/docs/tasks/observability/logs/access-log/#using-telemetry-api](url)
3. try to use curl directly from the shell of nginx and sidecar. just to make sure there is reachability within the mesh before checking from the external client.

**Reply by adam-aph2** [reply]
**Re point 2**, access logs are enabled, I'm using this definition:
```
"meshConfig.accessLogFormat" = "[%START_TIME%] Host:%REQ(HOST)% Method:%REQ(:METHOD)% OrPath:%REQ(X-ENVOY-ORIGINAL-PATH?:PATH)% Proto:%PROTOCOL% RespC:%RESPONSE_CODE% RespFl:%RESPONSE_FLAGS% BytesRcv:%BYTES_RECEIVED% BytesSent:%BYTES_SENT% Dur:%DURATION% RespTime:%RESP(X-ENVOY-UPSTREAM-SERVICE-TIME)% ReqForw:%REQ(X-FORWARDED-FOR)% ReqUser:%REQ(USER-AGENT)% ReqId:%REQ(X-REQUEST-ID)% ReqAuth:%REQ(:AUTHORITY)% UpstHost:%UPSTREAM_HOST% RoutName:%ROUTE_NAME% UpsClust:%UPSTREAM_CLUSTER% UpsLocAddr:%UPSTREAM_LOCAL_ADDRESS% DownLocAddr:%DOWNSTREAM_LOCAL_ADDRESS% DownRemAddr:%DOWNSTREAM_REMOTE_ADDRESS% ReqServName:%REQUESTED_SERVER_NAME% IstioPolicyStatus:%DYNAMIC_METADATA(istio.mixer:status)% UpsTranFailReason:%UPSTREAM_TRANSPORT_FAILURE_REASON%\n"
```

**Re point 3**, I ran curl from the nginx controller Pod, simulating pasthrough from nginx:
```
curl -v -H "Host: game-nginx-api-srv.game-nginx.svc.cluster.local" -H "Content-Type: application/json"  http://game-nginx-api-srv.game-nginx.svc.cluster.local/game2
*   Trying 172.20.25.168:80...
* Connected to game-nginx-api-srv.game-nginx.svc.cluster.local (172.20.25.168) port 80 (#0)
> GET /game2 HTTP/1.1
> Host: game-nginx-api-srv.game-nginx.svc.cluster.local
> User-Agent: curl/7.80.0
> Accept: */*
> Content-Type: application/json
>
* Mark bundle as not supporting multiuse
< HTTP/1.1 503 Service Unavailable
< date: Wed, 10 Jan 2024 14:37:38 GMT
< server: envoy
< content-length: 0
<
* Connection #0 to host game-nginx-api-srv.game-nginx.svc.cluster.local left intact
```
So this seems to be intercepted by sidecar, as I see in the log:
```
2024-01-10T14:37:38.707130Z     debug   envoy http external/envoy/source/common/http/conn_manager_impl.cc:1194  [Tags: "ConnectionId":"7737","StreamId":"1520470235480341971"] request headers complete (end_stream=true):
':authority', 'game-nginx-api-srv.game-nginx.svc.cluster.local'
':path', '/game2'
':method', 'GET'
'user-agent', 'curl/7.80.0'
'accept', '*/*'
'content-type', 'application/json'
2024-01-10T14:37:38.707245Z     debug   envoy filter source/extensions/filters/http/alpn/alpn_filter.cc:68      cannot find cluster outbound|8080|game-nginx-api-srv|game-nginx-api-srv.game-nginx.svc.cluster.local    thread=23
2024-01-10T14:37:38.707325Z     debug   envoy http external/envoy/source/common/http/conn_manager_impl.cc:1863  [Tags: "ConnectionId":"7737","StreamId":"1520470235480341971"] encoding headers via codec (end_stream=true):
':status', '503'
'date', 'Wed, 10 Jan 2024 14:37:38 GMT'
'server', 'envoy'
        thread=23
[2024-01-10T14:37:38.707Z] Host:game-nginx-api-srv.game-nginx.svc.cluster.local Method:GET OrPath:/game2 Proto:HTTP/1.1 RespC:503 RespFl:NC BytesRcv:0 BytesSent:0 Dur:0 RespTime:- ReqForw:- ReqUser:curl/7.80.0 ReqId:facdb955-b819-4d51-ac5b-504c7fffff72 ReqAuth:game-nginx-api-srv.game-nginx.svc.cluster.local UpstHost:- RoutName:- UpsClust:- UpsLocAddr:- DownLocAddr:172.20.25.168:80 DownRemAddr:10.100.30.43:44566 ReqServName:- IstioPolicyStatus:- UpsTranFailReason:-
```
Why it says 'cannot find cluster', where it seems to be defined in the nginx controller Pod:
```
kubectl istio proxy-config cluster -n nginx-system nginx-ingress-ext-controller-7b877d4b5b-vkf2z |grep game-nginx-api-srv
game-nginx-api-srv.game-nginx.svc.cluster.local                               8080      -                    outbound      EDS
```

**Re point 1**, is there a way to capture requests intercepted by sidecar? Listening with tcpdump on port 15006 gives nothing...

**Reply by abasitt** [reply]
Based on below the VS is trying to reach subset which reflects how you configured the VS.
> cannot find cluster outbound|8080|game-nginx-api-srv|game-nginx-api-srv.game-nginx.svc.cluster.local

But the destination rule doesn't seems to be applied correctly. You should see a subset here as well.

> game-nginx-api-srv.game-nginx.svc.cluster.local                               8080      -                    outbound      EDS

e.g. if i take helloworld.

> istioctl pc c sleep-9454cc476-2nb5q.default | grep hello
helloworld.default.svc.cluster.local                                               5000      -          outbound      EDS              helloworld.default
helloworld.default.svc.cluster.local                                               5000      v1         outbound      EDS              helloworld.default
helloworld.default.svc.cluster.local                                               5000      v2         outbound      EDS              helloworld.default

why don't you keep the setup simpler and just try without subset routing for now till you figure the initial connectivity ?



You can capture the traffic but you have to nsenter in to the nginxpod and run tcpdump there.

**Comment by adam-aph2** [comment]
Ok, I tried to simplify the setup, so I created another test App:
```
---
apiVersion: v1
kind: Service
metadata:
  name: game-nginx-app2
  namespace: game-nginx
  labels:
    app.kubernetes.io/name: game-nginx-app2
    app.kubernetes.io/instance: game-nginx-app2
spec:
  ports:
  - name: http
    port: 80
    protocol: TCP
  selector:
    app: game-nginx-app2
  type: ClusterIP
---
apiVersion: networking.k8s.io/v1
kind: Ingress
metadata:
  name:  game-nginx-ingress
  namespace: game-nginx
  annotations:
    kubernetes.io/ingress.class: "nginx"
    nginx.ingress.kubernetes.io/service-upstream: "true"
    nginx.ingress.kubernetes.io/upstream-vhost: game-nginx-app2.game-nginx.svc.cluster.local
spec:
  ingressClassName: nginx
  rules:
    - host: api2.game-nginx.k8s.cluster
      http:
        paths:
          - path: /nginx
            pathType: Prefix
            backend:
              service:
                name: game-nginx-app2
                port:
                  number: 80
---
apiVersion: networking.istio.io/v1beta1
kind: VirtualService
metadata:
  name: game-nginx-vs
  namespace: game-nginx
spec:
  exportTo:
    - "*"
  hosts:
    - api2.game-nginx.k8s.cluster
  gateways:
    - mesh
  http:
    - match:
        - port: 80      # must correspond to Ingress port
        - uri:
            prefix: /nginx
      route:
        - destination:
            port:
              number: 80    # must correspond to Service port
            host: game-nginx-app2
```
When I run curl from nginx container, it works:
```
curl -v -H "Host: api2.game-nginx.k8s.cluster" -H "Content-Type: application/json"  http://game-nginx-app2.game-nginx.svc.cluster.local/nginx/
*   Trying 172.20.69.191:80...
* Connected to game-nginx-app2.game-nginx.svc.cluster.local (172.20.69.191) port 80 (#0)
> GET /nginx/ HTTP/1.1
> Host: api2.game-nginx.k8s.cluster
> User-Agent: curl/7.80.0
> Accept: */*
> Content-Type: application/json
>
* Mark bundle as not supporting multiuse
< HTTP/1.1 200 OK
< server: envoy
< date: Thu, 11 Jan 2024 12:50:14 GMT
< content-type: text/html
< content-length: 63
< last-modified: Thu, 11 Jan 2024 12:49:01 GMT
< etag: "659fe3bd-3f"
< accept-ranges: bytes
< x-envoy-upstream-service-time: 1
<
<html>
<h2> This is game-nginx </h2>
</html>
* Connection #0 to host game-nginx-app2.game-nginx.svc.cluster.local left intact
```
Sidecar is intercepting this traffic, I can see this in the log:
```
[2024-01-11T12:50:14.557Z] Host:api2.game-nginx.k8s.cluster Method:GET OrPath:/nginx/ Proto:HTTP/1.1 RespC:200 RespFl:- BytesRcv:0 BytesSent:63 Dur:3 RespTime:1 ReqForw:- ReqUser:curl/7.80.0 ReqId:99ac4d0a-31af-4ed3-9253-ee3ac4d616e7 ReqAuth:api2.game-nginx.k8s.cluster UpstHost:10.100.37.82:80 RoutName:- UpsClust:outbound|80||game-nginx-app2.game-nginx.svc.cluster.local UpsLocAddr:10.100.30.43:38812 DownLocAddr:172.20.69.191:80 DownRemAddr:10.100.30.43:47266 ReqServName:- IstioPolicyStatus:- UpsTranFailReason:-
```
However with external request I see this in sidecar log:
```
2024-01-11T12:55:58.577803Z     debug   envoy conn_handler external/envoy/source/extensions/listener_managers/listener_manager/active_stream_listener_base.cc:45        closing connection from 10.100.190.97:4224: no matching filter chain found      thread=23
[2024-01-11T12:55:58.561Z] Host:- Method:- OrPath:- Proto:- RespC:0 RespFl:NR BytesRcv:0 BytesSent:0 Dur:16 RespTime:- ReqForw:- ReqUser:- ReqId:- ReqAuth:- UpstHost:- RoutName:- UpsClust:- UpsLocAddr:- DownLocAddr:10.100.30.43:80 DownRemAddr:10.100.190.97:4224 ReqServName:- IstioPolicyStatus:- UpsTranFailReason:-

DownRemAddr: 10.100.190.97:4224 = nlb eni
DownLocAddr:10.100.30.43:80 = nginx ingress
```
Routes at nginx ingress:
```
        "virtualHosts": [
            {
                "name": "api2.game-nginx.k8s.cluster:80",
                "domains": [
                    "api2.game-nginx.k8s.cluster"
                ],
                "routes": [
                    {
                        "match": {
                            "prefix": "/",
                            "caseSensitive": true
                        },
                        "route": {
                            "cluster": "outbound|80||game-nginx-app2.game-nginx.svc.cluster.local",
                            "timeout": "0s",
                            "retryPolicy": {
                                "retryOn": "connect-failure,refused-stream,unavailable,cancelled,retriable-status-codes",
                                "numRetries": 2,
                                "retryHostPredicate": [
                                    {
                                        "name": "envoy.retry_host_predicates.previous_hosts",
                                        "typedConfig": {
                                            "@type": "type.googleapis.com/envoy.extensions.retry.host.previous_hosts.v3.PreviousHostsPredicate"
                                        }
                                    }
                                ],
                                "hostSelectionRetryMaxAttempts": "5",
                                "retriableStatusCodes": [
                                    503
                                ]
                            },
                            "maxGrpcTimeout": "0s"
                        },
                        "metadata": {
                            "filterMetadata": {
                                "istio": {
                                    "config": "/apis/networking.istio.io/v1alpha3/namespaces/game-nginx/virtual-service/game-nginx-vs"
                                }
                            }
                        },
                        "decorator": {
                            "operation": "game-nginx-app2.game-nginx.svc.cluster.local:80/*"
                        }
                    }
                ],
                "includeRequestAttemptCount": true
            },

            {
                "name": "game-nginx-app2.game-nginx.svc.cluster.local:80",
                "domains": [
                    "game-nginx-app2.game-nginx.svc.cluster.local",
                    "game-nginx-app2.game-nginx",
                    "game-nginx-app2.game-nginx.svc",
                    "172.20.69.191"
                ],
                "routes": [
                    {
                        "name": "default",
                        "match": {
                            "prefix": "/"
                        },
                        "route": {
                            "cluster": "outbound|80||game-nginx-app2.game-nginx.svc.cluster.local",
                            "timeout": "0s",
                            "retryPolicy": {
                                "retryOn": "connect-failure,refused-stream,unavailable,cancelled,retriable-status-codes",
                                "numRetries": 2,
                                "retryHostPredicate": [
                                    {
                                        "name": "envoy.retry_host_predicates.previous_hosts",
                                        "typedConfig": {
                                            "@type": "type.googleapis.com/envoy.extensions.retry.host.previous_hosts.v3.PreviousHostsPredicate"
                                        }
                                    }
                                ],
                                "hostSelectionRetryMaxAttempts": "5",
                                "retriableStatusCodes": [
                                    503
                                ]
                            },
                            "maxGrpcTimeout": "0s"
                        },
                        "decorator": {
                            "operation": "game-nginx-app2.game-nginx.svc.cluster.local:80/*"
                        }
                    }
                ],
                "includeRequestAttemptCount": true
            },
```

I don't know how to check what nginx is forwarding (and what is intercepted by sidecar), when I nsenter to nginx namespace and listen to all ports, I see only one request:
```
13:02:49.718439 IP ip-10-100-136-204.internal.45063 > ip-10-100-30-43.internal.http: Flags [P.], seq 4088560051:4088560179, ack 3677762615, win 1026, length 128: HTTP: GET /nginx/ HTTP/1.1
E...`.@.m..t
d..
d.+...P..y..647P....6..GET /nginx/ HTTP/1.1
Host: api2.game-nginx.k8s.cluster
User-Agent: curl/8.0.1
Accept: */*
Content-Type: application/json
```

**Reply by abasitt** [reply]
NR very likely means the external request forwarded by nginx is not matching the Virtualservice that you have defined. I will try to dig and figure out what is actually being forwarded from nginx. 
If i send a wrong Host request to my ingress. I will at least see authority with NR. But in your case, I don't even see that.

**Comment by adam-aph2** [comment]
I enabled also access logs on nginx and noticed, that nginx is indeed listening on 80, as when I execute curl from worker node:
```
curl -v -H "Host: api2.game-nginx.k8s.cluster" -H "Content-Type: application/json"  http://127.0.0.1/nginx/
*   Trying 127.0.0.1:80...
* Connected to 127.0.0.1 (127.0.0.1) port 80
> GET /nginx/ HTTP/1.1
> Host: api2.game-nginx.k8s.cluster
> User-Agent: curl/8.3.0
> Accept: */*
> Content-Type: application/json
>
< HTTP/1.1 404 Not Found
< Server: nginx/1.25.3
< Date: Fri, 12 Jan 2024 08:28:14 GMT
< Content-Type: text/html
< Content-Length: 153
< Connection: keep-alive
<
<html>
<head><title>404 Not Found</title></head>
<body>
<center><h1>404 Not Found</h1></center>
<hr><center>nginx/1.25.3</center>
</body>
</html>
* Connection #0 to host 127.0.0.1 left intact
```
then I see it also in nginx access log, but nothing in sidecar log, as nginx is dumping it down:
```
127.0.0.1 - - [12/Jan/2024:08:28:14 +0000] "GET /nginx/ HTTP/1.1" 404 153 "-" "curl/8.3.0" "-"
```

But when I execute external curl, I see opposite, nginx log is empty, sidecar log shows wrong routing error:
```
curl -v -H "Host: api2.game-nginx.k8s.cluster" -H "Content-Type: application/json"  http://nginxsys-xyz.amazonaws.com/nginx/
*   Trying a.b.c.d:80...
* Connected to nginxsys-xyz.amazonaws.com (a.b.c.d) port 80 (#0)
> GET /nginx/ HTTP/1.1
> Host: api2.game-nginx.k8s.cluster
> User-Agent: curl/8.0.1
> Accept: */*
> Content-Type: application/json
>
* Recv failure: Connection was reset
* Closing connection 0
curl: (56) Recv failure: Connection was reset
```
```
[2024-01-12T08:31:35.138Z] Host:- Method:- OrPath:- Proto:- RespC:0 RespFl:NR BytesRcv:0 BytesSent:0 Dur:4 RespTime:- ReqForw:- ReqUser:- ReqId:- ReqAuth:- UpstHost:- RoutName:- UpsClust:- UpsLocAddr:- DownLocAddr:10.100.19.141:80 DownRemAddr:10.100.136.204:2887 ReqServName:- IstioPolicyStatus:- UpsTranFailReason:-
```

So AWS NLB is somehow bypassing nginx and injects somehow that request directly into the mesh? Ugh...

**Reply by abasitt** [reply]
this seems strange...

> curl -v -H "Host: api2.game-nginx.k8s.cluster" -H "Content-Type: application/json"  http://127.0.0.1/nginx/

I have a feeling this may be an os nginx responding.

Can you instead curl from the worker node directly to the nginx pod IP or the service-IP ?

**Reply by adam-aph2** [reply]
yeah, executing curl from different worker node to nginx Pod IP gives the same result like externall call - no log entry in nginx and log entry in sidecar:
```
curl -v -H "Host: api2.game-nginx.k8s.cluster" -H "Content-Type: application/json"  http://10.100.19.141/nginx/
*   Trying 10.100.19.141:80...
* Connected to 10.100.19.141 (10.100.19.141) port 80
> GET /nginx/ HTTP/1.1
> Host: api2.game-nginx.k8s.cluster
> User-Agent: curl/8.3.0
> Accept: */*
> Content-Type: application/json
>
* Recv failure: Connection reset by peer
* Closing connection
curl: (56) Recv failure: Connection reset by peer


[2024-01-12T12:13:07.933Z] Host:- Method:- OrPath:- Proto:- RespC:0 RespFl:NR BytesRcv:0 BytesSent:0 Dur:0 RespTime:- ReqForw:- ReqUser:- ReqId:- ReqAuth:- UpstHost:- RoutName:- UpsClust:- UpsLocAddr:- DownLocAddr:10.100.19.141:80 DownRemAddr:10.100.75.16:54900 ReqServName:- IstioPolicyStatus:- UpsTranFailReason:-
```

**Reply by abasitt** [reply, marked as answer]
Sorry I didn't realize you were not seeing any log entries on Nginx ?. checking back on your earlier comments.

> Sidecar should follow this annotation: traffic.sidecar.istio.io/excludeInboundPorts: 80,443

and your below pod description shows the annotations are definitely not working and the traffic is straight going to sidecar and that may explain why is it failing.

> Args:
      istio-iptables
      -p
      15001
      -z
      15006
      -u
      1337
      -m
      REDIRECT
      -i
      *
      -x

      -b
      *
      -d
      15090,15021,15020
      
  you should see something in the last line like below.
  

> -d
      15090,15021,80,443,15020
      
 Can you make sure you are applying correct annotations on the deployment? Not on the service.

**Comment by adam-aph2** [comment]
That helped, thanks!

Here is successful curl with nginx and sidecar log entries:
```
curl -v -H "Host: api2.game-nginx.k8s.cluster" -H "Content-Type: application/json"  http://k8s-nginxsys-xyz.amazonaws.com/nginx/
*   Trying a.b.c.d:80...
* Connected to k8s-nginxsys-xyz.amazonaws.com (a.b.c.d) port 80 (#0)
> GET /nginx/ HTTP/1.1
> Host: api2.game-nginx.k8s.cluster
> User-Agent: curl/8.0.1
> Accept: */*
> Content-Type: application/json
>
< HTTP/1.1 200 OK
< Server: nginx/1.25.3
< Date: Mon, 15 Jan 2024 08:31:15 GMT
< Content-Type: text/html
< Content-Length: 63
< Connection: keep-alive
< last-modified: Mon, 15 Jan 2024 08:30:58 GMT
< etag: "65a4ed42-3f"
< accept-ranges: bytes
< x-envoy-upstream-service-time: 13
<
<html>
<h2> This is game-nginx via Nginx Ingress </h2>
</html>
* Connection #0 to host k8s-nginxsys-xyz.amazonaws.com left intact


nginx access log:
10.100.97.163 - - [15/Jan/2024:08:31:15 +0000] "GET /nginx/ HTTP/1.1" 200 63 "-" "curl/8.0.1" "-"

sidecar access log:
Host:api2.game-nginx.k8s.cluster Method:GET OrPath:/nginx/ Proto:HTTP/1.1 RespC:200 RespFl:- BytesRcv:0 BytesSent:63 Dur:14 RespTime:13 ReqForw:10.100.97.163 ReqUser:curl/8.0.1 ReqId:3a138aff-306d-4254-8fde-c5df3f0d5aad ReqAuth:api2.game-nginx.k8s.cluster UpstHost:10.100.58.144:80 RoutName:- UpsClust:outbound|80||game-nginx-app2.game-nginx.svc.cluster.local UpsLocAddr:10.100.2.24:35108 DownLocAddr:172.20.149.172:80 DownRemAddr:10.100.97.163:0 ReqServName:- IstioPolicyStatus:- UpsTranFailReason:-
```

For the reference, changed ingress setup:
```
resource "helm_release" "nginx-ingress-external" {
  name = "nginx-ingress-ext"
  namespace = kubernetes_namespace.nginx-system.metadata[0].name                 # to make sure envoy will be injected
  repository = "https://helm.nginx.com/stable"
  chart = "nginx-ingress"
  version = "1.0.2"

  dynamic "set" {
    for_each = {
      "securityContext.runAsNonRoot" = true
      "service.ports.http" = "80"
      "service.ports.https" = "443"
      "controller.service.type" = "LoadBalancer"
    }
    content {
      name  = set.key
      value = set.value
    }
  }

#  this works for nginx community version
  values = [
    yamlencode(
      {
        labels = {
        }
        controller = {
          pod = {
            annotations = {
              "traffic.sidecar.istio.io/includeInboundPorts"     = ""
              "traffic.sidecar.istio.io/excludeInboundPorts"     = "80,443"
              "traffic.sidecar.istio.io/excludeOutboundIPRanges" = "172.20.0.1/32"  # K8s API: kubectl get svc kubernetes -o jsonpath='{.spec.clusterIP}'
              "sidecar.istio.io/inject"                          = "true"     # to make sure envoy will be injected
            }
          }
          service = {
            annotations = {
              "service.beta.kubernetes.io/aws-load-balancer-backend-protocol" = "tcp"
              "service.beta.kubernetes.io/aws-load-balancer-connection-idle-timeout" = "60"
              "service.beta.kubernetes.io/aws-load-balancer-cross-zone-load-balancing-enabled" = "true"
              "service.beta.kubernetes.io/aws-load-balancer-type" = "nlb"
              "service.beta.kubernetes.io/aws-load-balancer-scheme" = "internet-facing"
              "service.beta.kubernetes.io/aws-load-balancer-internal" = "false"
              "service.beta.kubernetes.io/aws-load-balancer-nlb-target-type" = "ip"
              "service.beta.kubernetes.io/aws-load-balancer-subnets" = "subnet-x, subnet-y, subnet-z"    # public cluster subnets
            }
          }
        }
      }
    )
  ]

  depends_on = [
    kubernetes_namespace.nginx-system
  ]
}
```

And updated test App setup:
```
---
apiVersion: v1
kind: Service
metadata:
  name: game-nginx-app2
  namespace: game-nginx
  labels:
    app.kubernetes.io/name: game-nginx-app2
    app.kubernetes.io/instance: game-nginx-app2
spec:
  ports:
  - name: http
    port: 80
    protocol: TCP
  selector:
    app: game-nginx-app2
  type: ClusterIP
---
apiVersion: networking.istio.io/v1beta1
kind: VirtualService
metadata:
  name: game-nginx-vs
  namespace: game-nginx
spec:
  exportTo:
    - "*"
  hosts:
    - api2.game-nginx.k8s.cluster
  gateways:
    - mesh
  http:
    - match:
        - port: 80      # must correspond to Ingress port
        - uri:
            prefix: /nginx
      route:
        - destination:
            port:
              number: 80    # must correspond to Service port
            host: game-nginx-app2
---
apiVersion: k8s.nginx.org/v1
kind: VirtualServer
metadata:
  name: game-nginx-nvs
  namespace: game-nginx
spec:
  host: api2.game-nginx.k8s.cluster
  upstreams:
    - name: api2
      service: game-nginx-app2
      port: 80
      use-cluster-ip: true
  routes:
    - path: /nginx
      action:
        proxy:
          upstream: api2
          requestHeaders:
            set:
              - name: Host
                value: api2.game-nginx.k8s.cluster
```
