### ISSUE TITLE
No packets were captured at inbound or outbound

### ISSUE THREAD

**Issue by wanggithub08** [istio/istio#38547]
After deploy sample application according to this [article](https://istio.io/latest/docs/examples/bookinfo/). I go into the productpage pod and  execute `tcpdump -i eth0 port 15006 -vv` or `tcpdump -i eth0 port 15001 -vv`.But I got nothing.Does anyone know why?

**Comment by hzxuzhonghu** [comment]
change port to 9080, IIUC, istio setting ruls with  `redirect`, which does not change the dest port

**Comment by wanggithub08** [comment]
> change port to 9080, IIUC, istio setting ruls with `redirect`, which does not change the dest port

Yes,I can capture packets at the port of 9080.But I can not stand what you said,Why can envoy get packets from these ports? and tcpdump can't do it.

**Comment by wanggithub08** [comment]
> > change port to 9080, IIUC, istio setting ruls with `redirect`, which does not change the dest port
> 
> Yes,I can capture packets at the port of 9080.But I can not stand what you said,Why can envoy get packets from these ports? and tcpdump can't do it.

Sorry, I may not have been clear.What I'm confused about is how does envoy manage traffic if the destination port is not changed?

**Comment by hzxuzhonghu** [comment]
@wanggithub08 Good question
>change port to 9080, IIUC, istio setting ruls with redirect, which does not change the dest port

This is not right. iptabeles redirect will change the destination IP and port, and also records the old ones. Envoy can restore the original IP and port in 15001 listener handling.


Come back to the original question, how about capturing `lo`

tcpdump -i any port 15001 -vv

**Comment by wanggithub08** [comment]
Same result as `tcpdump -i eth0 port 15006 -vv`.

**Comment by wanggithub08** [comment]
> @wanggithub08 Good question
> 
> > change port to 9080, IIUC, istio setting ruls with redirect, which does not change the dest port
> 
> This is not right. iptabeles redirect will change the destination IP and port, and also records the old ones. Envoy can restore the original IP and port in 15001 listener handling.
> 
> Come back to the original question, how about capturing `lo`
> 
> tcpdump -i any port 15001 -vv

Same result as tcpdump -i eth0 port 15006 -vv.

**Comment by hzxuzhonghu** [comment]
I donot think so

```
# tcpdump -i any port 15001 -vv
tcpdump: listening on any, link-type LINUX_SLL (Linux cooked v1), capture size 262144 bytes
17:37:51.833708 IP (tos 0x0, ttl 64, id 38144, offset 0, flags [DF], proto TCP (6), length 60)
    10.244.0.28.45768 > localhost.15001: Flags [S], cksum 0x8a3f (incorrect -> 0x22ad), seq 3808500744, win 64240, options [mss 1460,sackOK,TS val 2885158893 ecr 0,nop,wscale 7], length 0
17:37:51.833738 IP (tos 0x0, ttl 64, id 38145, offset 0, flags [DF], proto TCP (6), length 52)
    10.244.0.28.45768 > localhost.15001: Flags [.], cksum 0x8a37 (incorrect -> 0x65c4), seq 3808500745, ack 3843432325, win 502, options [nop,nop,TS val 2885158893 ecr 3375044312], length 0
17:37:51.833810 IP (tos 0x0, ttl 64, id 38146, offset 0, flags [DF], proto TCP (6), length 139)
    10.244.0.28.45768 > localhost.15001: Flags [P.], cksum 0x8a8e (incorrect -> 0x5e64), seq 0:87, ack 1, win 502, options [nop,nop,TS val 2885158893 ecr 3375044312], length 87
17:37:53.105054 IP (tos 0x0, ttl 64, id 38147, offset 0, flags [DF], proto TCP (6), length 52)
    10.244.0.28.45768 > localhost.15001: Flags [.], cksum 0x8a37 (incorrect -> 0x5888), seq 87, ack 761, win 501, options [nop,nop,TS val 2885160164 ecr 3375045583], length 0
17:37:53.105285 IP (tos 0x0, ttl 64, id 38148, offset 0, flags [DF], proto TCP (6), length 52)
    10.244.0.28.45768 > localhost.15001: Flags [F.], cksum 0x8a37 (incorrect -> 0x5886), seq 87, ack 761, win 501, options [nop,nop,TS val 2885160165 ecr 3375045583], length 0
17:37:53.105412 IP (tos 0x0, ttl 64, id 38149, offset 0, flags [DF], proto TCP (6), length 52)
    10.244.0.28.45768 > localhost.15001: Flags [.], cksum 0x8a37 (incorrect -> 0x5884), seq 88, ack 762, win 501, options [nop,nop,TS val 2885160165 ecr 3375045584], length 0

```

**Comment by believening** [comment]
> It's weird, I can't catch any packets, but when I visit my service I can see the logs of envoy.
> 
> ```
> bash-5.1# tcpdump -i any port 15001 -vv
> tcpdump: data link type LINUX_SLL2
> tcpdump: listening on any, link-type LINUX_SLL2 (Linux cooked v2), snapshot length 262144 bytes
> ^C
> 0 packets captured
> 0 packets received by filter
> 0 packets dropped by kernel
> bash-5.1# tcpdump -i any port 15006 -vv
> tcpdump: data link type LINUX_SLL2
> tcpdump: listening on any, link-type LINUX_SLL2 (Linux cooked v2), snapshot length 262144 bytes
> ^C
> 0 packets captured
> 0 packets received by filter
> 0 packets dropped by kernel
> ```

also, and see: https://superuser.com/a/925332
