### ISSUE TITLE
Regarding the cluster generated for the ServiceEntry

### ISSUE THREAD

**Issue by zengyuxing007** [istio/istio#50119]
**Describe the feature request**

Create the following serviceEntry under Istio：

```yaml
  kind: ServiceEntry
  metadata:
    name: example1
    namespace: istio-system
  spec:
    exportTo:
    - default
    hosts:
    - www.example.com
    location: MESH_EXTERNAL
    ports:
    - name: https
      number: 8080
      protocol: HTTPS
    resolution: DNS
```

the generated corresponing Cluster some like this: （sidecar  config_dump):
```json
{
     "cluster": {
      "@type": "type.googleapis.com/envoy.config.cluster.v3.Cluster",
      "name": "outbound|8080||www.example.com",
      "type": "STRICT_DNS",
      "connect_timeout": "10s",
      "lb_policy": "LEAST_REQUEST",
      "circuit_breakers": {
       "thresholds": [
        {
         "max_connections": 4294967295,
         "max_pending_requests": 4294967295,
         "max_requests": 4294967295,
         "max_retries": 4294967295,
         "track_remaining": true
        }
       ]
      },
      "dns_refresh_rate": "60s",
      "dns_lookup_family": "V4_ONLY",
      "load_assignment": {
       "cluster_name": "outbound|8080||www.example.com",
       "endpoints": [
        {
         "locality": {},
         "lb_endpoints": [
          {
          {
           "endpoint": {
            "address": {
             "socket_address": {
              "address": "www.example.com",
              "port_value": 8080
             }
            }
           },
           "metadata": {
            "filter_metadata": {
             "istio": {
              "workload": ";;;;"
             }
            }
           },
           "load_balancing_weight": 1
          },
          {
           "endpoint": {
            "address": {
             "socket_address": {
              "address": "www.example.com",
              "port_value": 8080
             }
            }
           },
           "metadata": {
            "filter_metadata": {
             "istio": {
              "workload": ";;;;"
             }
            }
           },
           "load_balancing_weight": 1
          },

...
         "load_balancing_weight": 6
        }
     ]
}
```

## Optimization Point 1:

The domain `www.example.com` should be written in FQDN (Fully Qualified Domain Name) format, ensuring that DNS resolution requests from a sidecar in a Kubernetes cluster are not mistakenly treated as potential internal service/ domain names, thereby reducing unnecessary search-related queries.

```shell
07:56:08.943664 eth0  Out IP 10.0.175.73.40370 > 169.254.20.10.53: 61648+ A? www.example.com.default.svc.cluster.local. (59)
07:56:08.944241 eth0  In  IP 169.254.20.10.53 > 10.0.175.73.40370: 61648 NXDomain*- 0/1/0 (152)
07:56:08.944344 eth0  Out IP 10.0.175.73.49183 > 192.168.0.10.53: 61648+ A? www.example.com.default.svc.cluster.local. (59)
07:56:08.944459 eth0  In  IP 192.168.0.10.53 > 10.0.175.73.49183: 61648 NXDomain*- 0/1/0 (152)
07:56:08.944607 eth0  Out IP 10.0.175.73.35130 > 169.254.20.10.53: 268+ A? www.example.com.svc.cluster.local. (51)
07:56:08.944867 eth0  In  IP 169.254.20.10.53 > 10.0.175.73.35130: 268 NXDomain*- 0/1/0 (144)
07:56:08.944932 eth0  Out IP 10.0.175.73.54753 > 192.168.0.10.53: 268+ A? www.example.com.svc.cluster.local. (51)
07:56:08.945025 eth0  In  IP 192.168.0.10.53 > 10.0.175.73.54753: 268 NXDomain*- 0/1/0 (144)
07:56:08.945134 eth0  Out IP 10.0.175.73.34457 > 169.254.20.10.53: 36800+ A? www.example.com.cluster.local. (47)
07:56:08.945352 eth0  In  IP 169.254.20.10.53 > 10.0.175.73.34457: 36800 NXDomain*- 0/1/0 (140)
07:56:08.945411 eth0  Out IP 10.0.175.73.47976 > 192.168.0.10.53: 36800+ A? www.example.com.cluster.local. (47)
07:56:08.945486 eth0  In  IP 192.168.0.10.53 > 10.0.175.73.47976: 36800 NXDomain*- 0/1/0 (140)
07:56:08.945663 eth0  Out IP 10.0.175.73.32884 > 169.254.20.10.53: 44690+ A? www.example.com. (33)
07:56:08.946289 eth0  In  IP 169.254.20.10.53 > 10.0.175.73.32884: 44690 1/0/0 A 93.184.216.34 (64)
07:56:08.946469 eth0  Out IP 10.0.175.73.43868 > 169.254.20.10.53: 40028+ AAAA? www.example.com. (33)
07:56:08.946947 eth0  In  IP 169.254.20.10.53 > 10.0.175.73.43868: 40028 1/0/0 AAAA 2606:2800:220:1:248:1893:25c8:1946 (76)
```
> 6 unnecessary A-record  queries

www.example.com -> www.example.com.  (add a dot at the end of the domain name)
>   "  location: MESH_EXTERNAL "  We can set it to FQDN format for this type only

## Optimization Point 2:

It's not entirely clear why the aforementioned cluster why have multiple Endpoints added, along with corresponding load_balancing_weights.  

It seems related to EndpointsByNetworkFilter (https://github.com/istio/istio/pull/9453), but is this configuration correct? Similar configurations will affect DNS A record queries. For instance, the cluster mentioned above could potentially amplify an A record query by **five times** due to having five identical Endpoints.

**Describe alternatives you've considered**

**Affected product area (please put an X in all that apply)**

[ ] Ambient
[ ] Docs
[ ] Dual Stack
[ ] Installation
[ ] Networking
[X] Performance and Scalability
[ ] Extensions and Telemetry
[ ] Security
[ ] Test and Release
[ ] User Experience
[ ] Developer Infrastructure

**Affected features (please put an X in all that apply)**

[ ] Multi Cluster
[ ] Virtual Machine
[ ] Multi Control Plane

**Additional context**

**Comment by zengyuxing007** [comment]
cc @howardjohn @hzxuzhonghu

**Comment by zengyuxing007** [comment]
ref Issue: https://github.com/istio/istio/issues/50119

**Comment by howardjohn** [comment]
If user wants the FQDN they should use it directly. I am not sure its appropriate for us to assume they do not want DNS searching.

For the double endpoint, are you sure you have just that SE? The port is 8081 which suggests to me you may have another SE so its merging and adding both endpoints

**Comment by zengyuxing007** [comment]
>> If user wants the FQDN they should use it directly. I am not sure its appropriate for us to assume they do not want DNS searching.

Is it only possible to write  FQDN to Endpoint  under serviceEntry? The host should be also used for other purposes, and it would be a problem to write it as a FQDN directly, right?

>> For the double endpoint, are you sure you have just that SE? The port is 8081 which suggests to me you may have another SE so its merging and adding both endpoints

There is no second serviceEntry, just because of my editing mistake.

**Comment by howardjohn** [comment]
I cannot reproduce the double endpoints, can you give more info

**Comment by zengyuxing007** [comment]
> I cannot reproduce the double endpoints, can you give more info

There are some gateway resources configured in the environment that may be relevant to this.

**Comment by hzxuzhonghu** [comment]
Endpoints are generated from inner endpointShard, which is generated from endpointslice controller or SE controller. I am sure it is unrelated to any gateway resource

**Comment by zengyuxing007** [comment]
> Endpoints are generated from inner endpointShard, which is generated from endpointslice controller or SE controller. I am sure it is unrelated to any gateway resource

the Endpoints (static) configdump have `load_balancing_weight ` property,    It may be related to the `EndpointsByNetworkFilter`
