### ISSUE TITLE
Cannot communication between microservices used istio-proxy

### ISSUE THREAD

**Issue by jinjie2088** [istio/istio#9048]
**Describe the bug**

**Before you begin:**
1. I used istio-demo-auth.yaml install istio1.0 system on k8s(version 1.9.0)
2. A and B used  istio-proxy, C is not.

**1.curl service B from service A**
[root@portal-ui-8447dc7b5b-vlkr2 /]# curl -v http://account-service:8080/account-service/status
* About to connect() to account-service port 8080 (#0)
*   Trying 10.96.185.4...
* Connected to account-service (10.96.185.4) port 8080 (#0)
> GET /account-service/status HTTP/1.1
> User-Agent: curl/7.29.0
> Host: account-service:8080
> Accept: */*
>
* Empty reply from server
* Connection #0 to host account-service left intact

cannot get response.

**tcpdump on service A's istio-proxy**
07:30:49.062249 IP 10.244.4.225.40165 > 10.96.185.4.8080: Flags [S], seq 3137939232, win 28200, options [mss 1410,sackOK,TS val 276281133 ecr 0,nop,wscale 7], length 0
07:30:49.062762 IP 10.96.185.4.8080 > 10.244.4.225.40165: Flags [S.], seq 428613582, ack 3137939233, win 27960, options [mss 1410,sackOK,TS val 276285143 ecr 276281133,nop,wscale 7], length 0
07:30:49.062774 IP 10.244.4.225.40165 > 10.96.185.4.8080: Flags [.], ack 1, win 221, options [nop,nop,TS val 276281133 ecr 276285143], length 0
07:30:49.062999 IP 10.244.4.225.40165 > 10.96.185.4.8080: Flags [P.], seq 1:107, ack 1, win 221, options [nop,nop,TS val 276281133 ecr 276285143], length 106: HTTP: GET /account-service/status HTTP/1.1
07:30:49.063336 IP 10.96.185.4.8080 > 10.244.4.225.40165: Flags [.], ack 107, win 219, options [nop,nop,TS val 276285143 ecr 276281133], length 0
07:30:49.063408 IP 10.96.185.4.8080 > 10.244.4.225.40165: Flags [R.], seq 1, ack 107, win 219, options [nop,nop,TS val 0 ecr 276281133], length 0

**tcpdump on service B's istio-proxy**

07:30:49.051890 IP 10.244.4.225.40165 > 10.244.1.198.8080: Flags [S], seq 3137939232, win 28200, options [mss 1410,sackOK,TS val 276281133 ecr 0,nop,wscale 7], length 0
07:30:49.051949 IP 10.244.1.198.8080 > 10.244.4.225.40165: Flags [S.], seq 428613582, ack 3137939233, win 27960, options [mss 1410,sackOK,TS val 276285143 ecr 276281133,nop,wscale 7], length 0
07:30:49.052148 IP 10.244.4.225.40165 > 10.244.1.198.8080: Flags [.], ack 1, win 221, options [nop,nop,TS val 276281133 ecr 276285143], length 0
07:30:49.052529 IP 10.244.4.225.40165 > 10.244.1.198.8080: Flags [P.], seq 1:107, ack 1, win 221, options [nop,nop,TS val 276281133 ecr 276285143], length 106: HTTP: GET /account-service/status HTTP/1.1
07:30:49.052537 IP 10.244.1.198.8080 > 10.244.4.225.40165: Flags [.], ack 107, win 219, options [nop,nop,TS val 276285143 ecr 276281133], length 0
07:30:49.052608 IP 10.244.1.198.8080 > 10.244.4.225.40165: Flags [R.], seq 1, ack 107, win 219, options [nop,nop,TSval 0 ecr 276281133], length 0

**2.curl service C from service A**
[root@portal-ui-8447dc7b5b-vlkr2 /]# curl -v http://system-service:8080/system-service/status
* About to connect() to system-service port 8080 (#0)
*   Trying 10.99.212.230...
* Connected to system-service (10.99.212.230) port 8080 (#0)
> GET /system-service/status HTTP/1.1
> User-Agent: curl/7.29.0
> Host: system-service:8080
> Accept: */*
>
< HTTP/1.1 200 OK
< Server: Apache-Coyote/1.1
< Content-Type: text/html;charset=ISO-8859-1
< Content-Length: 3
< Date: Sat, 29 Sep 2018 07:36:33 GMT
<
OK
* Connection #0 to host system-service left intact

It's ok.
**tcpdump on service A's istio-proxy**
07:36:33.862313 IP 10.244.4.225.42729 > 10.99.212.230.8080: Flags [S], seq 345395272, win 28200, options [mss 1410,sackOK,TS val 276625933 ecr 0,nop,wscale 7], length 0
07:36:33.862651 IP 10.99.212.230.8080 > 10.244.4.225.42729: Flags [S.], seq 3261622639, ack 345395273, win 27960, options [mss 1410,sackOK,TS val 276642977 ecr 276625933,nop,wscale 7], length 0
07:36:33.862669 IP 10.244.4.225.42729 > 10.99.212.230.8080: Flags [.], ack 1, win 221, options [nop,nop,TS val 276625933 ecr 276642977], length 0
07:36:33.862927 IP 10.244.4.225.42729 > 10.99.212.230.8080: Flags [P.], seq 1:105, ack 1, win 221, options [nop,nop,TS val 276625933 ecr 276642977], length 104: HTTP: GET /system-service/status HTTP/1.1
07:36:33.863197 IP 10.99.212.230.8080 > 10.244.4.225.42729: Flags [.], ack 105, win 219, options [nop,nop,TS val 276642977 ecr 276625933], length 0
07:36:33.863774 IP 10.99.212.230.8080 > 10.244.4.225.42729: Flags [P.], seq 1:147, ack 105, win 219, options [nop,nop,TS val 276642978 ecr 276625933], length 146: HTTP: HTTP/1.1 200 OK
07:36:33.863802 IP 10.244.4.225.42729 > 10.99.212.230.8080: Flags [.], ack 147, win 229, options [nop,nop,TS val 276625934 ecr 276642978], length 0
07:36:33.863821 IP 10.99.212.230.8080 > 10.244.4.225.42729: Flags [P.], seq 147:150, ack 105, win 219, options [nop,nop,TS val 276642978 ecr 276625933], length 3: HTTP
07:36:33.863833 IP 10.244.4.225.42729 > 10.99.212.230.8080: Flags [.], ack 150, win 229, options [nop,nop,TS val 276625934 ecr 276642978], length 0
07:36:33.864686 IP 10.244.4.225.42729 > 10.99.212.230.8080: Flags [F.], seq 105, ack 150, win 229, options [nop,nop,TS val 276625935 ecr 276642978], length 0
07:36:33.865328 IP 10.99.212.230.8080 > 10.244.4.225.42729: Flags [F.], seq 150, ack 106, win 219, options [nop,nop,TS val 276642979 ecr 276625935], length 0
07:36:33.865362 IP 10.244.4.225.42729 > 10.99.212.230.8080: Flags [.], ack 151, win 229, options [nop,nop,TS val 276625936 ecr 276642979], length 0

**questions:**
Why is it pod'IP(10.244.1.198) from B’tcpdump, not service'ip(10.96.185.4)?

**Comment by esnible** [comment]
You asked "Why is it pod'IP(10.244.1.198) from B’tcpdump, not service'ip(10.96.185.4)?".  The reason is that Envoy has been configured to know all of the endpoints of a service and to invoke those endpoints directly, not via the Kubernetes service IP.  This allows Istio pods to control traffic, for example only to pods with certain labels.
